{
  "name": "BankQuantitySelection",
  "full_name": "org.dreambot.api.methods.container.impl.bank.BankQuantitySelection",
  "full_url": "https://dreambot.org/javadocs/org/dreambot/api/methods/container/impl/bank/BankQuantitySelection.html",
  "type": "enum",
  "package": "org.dreambot.api.methods.container.impl.bank",
  "description": "Created with IntelliJ IDEA.",
  "page_structure": {
    "type": "enum",
    "format_version": "old",
    "has_summary_tables": true,
    "has_detail_sections": true,
    "has_nested_classes": false
  },
  "inheritance": [
    "BankQuantitySelection"
  ],
  "interfaces_implemented": [],
  "nested_classes": [],
  "methods": [
    {
      "name": "BankQuantitySelection",
      "return_type": "BankQuantitySelection[]",
      "modifiers": [
        "static"
      ],
      "description": "Returns an array containing the constants of this enum type, in the order they are declared.",
      "deprecated": false
    },
    {
      "name": "values",
      "signature": "public static BankQuantitySelection[] values()",
      "return_type": "",
      "modifiers": [],
      "description": "Returns an array containing the constants of this enum type, in the order they are declared. This method may be used to iterate over the constants as follows: for (BankQuantitySelection c : BankQuantitySelection.values()) System.out.println(c);",
      "parameters": [],
      "return": {
        "type": "",
        "description": ""
      },
      "deprecated": false
    },
    {
      "name": "valueOf",
      "signature": "public static BankQuantitySelection valueOf\u200b(java.lang.String name)",
      "return_type": "",
      "modifiers": [],
      "description": "Returns the enum constant of this type with the specified name. The string must match exactly an identifier used to declare an enum constant in this type. (Extraneous whitespace characters are not permitted.)",
      "parameters": [],
      "return": {
        "type": "",
        "description": ""
      },
      "deprecated": false
    },
    {
      "name": "getSelection",
      "signature": "public static BankQuantitySelection getSelection()",
      "return_type": "",
      "modifiers": [],
      "description": "",
      "parameters": [],
      "return": {
        "type": "",
        "description": ""
      },
      "deprecated": false
    },
    {
      "name": "getChildId",
      "signature": "public int getChildId()",
      "return_type": "",
      "modifiers": [],
      "description": "",
      "parameters": [],
      "return": {
        "type": "",
        "description": ""
      },
      "deprecated": false
    },
    {
      "name": "toString",
      "signature": "public java.lang.String toString()",
      "return_type": "",
      "modifiers": [],
      "description": "",
      "parameters": [],
      "return": {
        "type": "",
        "description": ""
      },
      "deprecated": false
    }
  ],
  "fields": [],
  "constructors": [],
  "enum_constants": [
    {
      "name": "Enum",
      "description": "Constant Summary\n\nEnum Constants  Enum Constant | Description  \n---|---  \n`ALL` |    \n`FIVE` |    \n`ONE` |    \n`TEN` |    \n`X` |    \n    * ### Method Summary\n\nAll Methods [Static Methods](javascript:show\\(1\\);) [Instance Methods](javascript:show\\(2\\);) [Concrete Methods](javascript:show\\(8\\);)  Modifier and Type | Method | Description  \n---|---|---  \n`int` | `getChildId()` |    \n`static [BankQuantitySelection](BankQuantitySelection.html \"enum in org.dreambot.api.methods.container.impl.bank\")` | `getSelection()` |    \n`java.lang.String` | `toString()` |    \n`static [BankQuantitySelection](BankQuantitySelection.html \"enum in org.dreambot.api.methods.container.impl.bank\")` | `valueOf\u200b(java.lang.String name)` |  Returns the enum constant of this type with the specified name.  \n`static [BankQuantitySelection](BankQuantitySelection.html \"enum in org.dreambot.api.methods.container.impl.bank\")[]` | `values()` |  Returns an array containing the constants of this enum type, in the order they are declared.  \n      * ### Methods inherited from class java.lang.Enum\n\n`compareTo, equals, getDeclaringClass, hashCode, name, ordinal, valueOf`\n\n      * ### Methods inherited from class java.lang.Object\n\n`getClass, notify, notifyAll, wait, wait, wait`\n\n  *     * ### Enum Constant Detail\n\n      * #### ONE\n            \n                        public static final [BankQuantitySelection](BankQuantitySelection.html \"enum in org.dreambot.api.methods.container.impl.bank\") ONE\n\n      * #### FIVE\n            \n                        public static final [BankQuantitySelection](BankQuantitySelection.html \"enum in org.dreambot.api.methods.container.impl.bank\") FIVE\n\n      * #### TEN\n            \n                        public static final [BankQuantitySelection](BankQuantitySelection.html \"enum in org.dreambot.api.methods.container.impl.bank\") TEN\n\n      * #### X\n            \n                        public static final [BankQuantitySelection](BankQuantitySelection.html \"enum in org.dreambot.api.methods.container.impl.bank\") X\n\n      * #### ALL\n            \n                        public static final [BankQuantitySelection](BankQuantitySelection.html \"enum in org.dreambot.api.methods.container.impl.bank\") ALL\n\n    * ### Method Detail\n\n      * #### values\n            \n                        public static [BankQuantitySelection](BankQuantitySelection.html \"enum in org.dreambot.api.methods.container.impl.bank\")[] values()\n\nReturns an array containing the constants of this enum type, in the order they\nare declared. This method may be used to iterate over the constants as\nfollows:\n\n            \n                        for (BankQuantitySelection c : BankQuantitySelection.values())\n                System.out.println(c);\n            \n\nReturns:\n\n    an array containing the constants of this enum type, in the order they are declared\n      * #### valueOf\n            \n                        public static [BankQuantitySelection](BankQuantitySelection.html \"enum in org.dreambot.api.methods.container.impl.bank\") valueOf\u200b(java.lang.String name)\n\nReturns the enum constant of this type with the specified name. The string\nmust match _exactly_ an identifier used to declare an enum constant in this\ntype. (Extraneous whitespace characters are not permitted.)\n\nParameters:\n\n    `name` \\- the name of the enum constant to be returned.\nReturns:\n\n    the enum constant with the specified name\nThrows:\n\n    `java.lang.IllegalArgumentException` \\- if this enum type has no constant with the specified name\n    `java.lang.NullPointerException` \\- if the argument is null\n      * #### getSelection\n            \n                        public static [BankQuantitySelection](BankQuantitySelection.html \"enum in org.dreambot.api.methods.container.impl.bank\") getSelection()\n\n      * #### getChildId\n            \n                        public int getChildId()\n\n      * #### toString\n            \n                        public java.lang.String toString()\n\nOverrides:\n\n    `toString` in class `java.lang.Enum<[BankQuantitySelection](BankQuantitySelection.html \"enum in org.dreambot.api.methods.container.impl.bank\")>`\n\nSkip navigation links\n\n  * [Overview](../../../../../../../overview-summary.html)\n  * [Package](package-summary.html)\n  * Class\n  * [Tree](package-tree.html)\n  * [Deprecated](../../../../../../../deprecated-list.html)\n  * [Index](../../../../../../../index-all.html)\n  * [Help](../../../../../../../help-doc.html)\n\n  * [Frames](../../../../../../../index.html?org/dreambot/api/methods/container/impl/bank/BankQuantitySelection.html)\n  * [No Frames](BankQuantitySelection.html)\n\n  * [All Classes](../../../../../../../allclasses-noframe.html)\n\nJavaScript is disabled on your browser.\n\n  * Summary: \n  * Nested | \n  * Enum Constants | \n  * Field | \n  * Method\n\n  * Detail: \n  * Enum Constants | \n  * Field | \n  * Method"
    }
  ],
  "extraction_fallback_used": true
}