{
  "name": "Location",
  "full_name": "org.dreambot.api.methods.world.Location",
  "full_url": "https://dreambot.org/javadocs/org/dreambot/api/methods/world/Location.html",
  "type": "enum",
  "package": "org.dreambot.api.methods.world",
  "description": "Returns the enum constant of this type with the specified name.",
  "page_structure": {
    "type": "enum",
    "format_version": "old",
    "has_summary_tables": true,
    "has_detail_sections": true,
    "has_nested_classes": false
  },
  "inheritance": [
    "Location"
  ],
  "interfaces_implemented": [],
  "nested_classes": [],
  "methods": [
    {
      "name": "Location",
      "return_type": "Location[]",
      "modifiers": [
        "static"
      ],
      "description": "Returns an array containing the constants of this enum type, in the order they are declared.",
      "deprecated": false
    },
    {
      "name": "values",
      "signature": "public static Location[] values()",
      "return_type": "",
      "modifiers": [],
      "description": "Returns an array containing the constants of this enum type, in the order they are declared. This method may be used to iterate over the constants as follows: for (Location c : Location.values()) System.out.println(c);",
      "parameters": [],
      "return": {
        "type": "",
        "description": ""
      },
      "deprecated": false
    },
    {
      "name": "valueOf",
      "signature": "public static Location valueOf\u200b(java.lang.String name)",
      "return_type": "",
      "modifiers": [],
      "description": "Returns the enum constant of this type with the specified name. The string must match exactly an identifier used to declare an enum constant in this type. (Extraneous whitespace characters are not permitted.)",
      "parameters": [],
      "return": {
        "type": "",
        "description": ""
      },
      "deprecated": false
    },
    {
      "name": "getLocation",
      "signature": "public int getLocation()",
      "return_type": "",
      "modifiers": [],
      "description": "",
      "parameters": [],
      "return": {
        "type": "",
        "description": ""
      },
      "deprecated": false
    },
    {
      "name": "getHost",
      "signature": "public java.lang.String getHost()",
      "return_type": "",
      "modifiers": [],
      "description": "",
      "parameters": [],
      "return": {
        "type": "",
        "description": ""
      },
      "deprecated": false
    },
    {
      "name": "matches",
      "signature": "public boolean matches\u200b(int location, java.lang.String host)",
      "return_type": "",
      "modifiers": [],
      "description": "",
      "parameters": [],
      "return": {
        "type": "",
        "description": ""
      },
      "deprecated": false
    },
    {
      "name": "getForTexture",
      "signature": "public static Location getForTexture\u200b(int id)",
      "return_type": "",
      "modifiers": [],
      "description": "",
      "parameters": [],
      "return": {
        "type": "",
        "description": ""
      },
      "deprecated": false
    }
  ],
  "fields": [],
  "constructors": [],
  "enum_constants": [
    {
      "name": "Enum",
      "description": "Constant Summary\n\nEnum Constants  Enum Constant | Description  \n---|---  \n`AUSTRALIA` |    \n`GERMANY` |    \n`UK` |    \n`USA` |    \n`USA_EAST` |    \n`USA_WEST` |    \n    * ### Method Summary\n\nAll Methods [Static Methods](javascript:show\\(1\\);) [Instance Methods](javascript:show\\(2\\);) [Concrete Methods](javascript:show\\(8\\);)  Modifier and Type | Method | Description  \n---|---|---  \n`static [Location](Location.html \"enum in org.dreambot.api.methods.world\")` | `getForTexture\u200b(int id)` |    \n`java.lang.String` | `getHost()` |    \n`int` | `getLocation()` |    \n`boolean` | `matches\u200b(int location, java.lang.String host)` |    \n`static [Location](Location.html \"enum in org.dreambot.api.methods.world\")` | `valueOf\u200b(java.lang.String name)` |  Returns the enum constant of this type with the specified name.  \n`static [Location](Location.html \"enum in org.dreambot.api.methods.world\")[]` | `values()` |  Returns an array containing the constants of this enum type, in the order they are declared.  \n      * ### Methods inherited from class java.lang.Enum\n\n`compareTo, equals, getDeclaringClass, hashCode, name, ordinal, toString,\nvalueOf`\n\n      * ### Methods inherited from class java.lang.Object\n\n`getClass, notify, notifyAll, wait, wait, wait`\n\n  *     * ### Enum Constant Detail\n\n      * #### USA\n            \n                        public static final [Location](Location.html \"enum in org.dreambot.api.methods.world\") USA\n\n      * #### USA_EAST\n            \n                        public static final [Location](Location.html \"enum in org.dreambot.api.methods.world\") USA_EAST\n\n      * #### USA_WEST\n            \n                        public static final [Location](Location.html \"enum in org.dreambot.api.methods.world\") USA_WEST\n\n      * #### UK\n            \n                        public static final [Location](Location.html \"enum in org.dreambot.api.methods.world\") UK\n\n      * #### AUSTRALIA\n            \n                        public static final [Location](Location.html \"enum in org.dreambot.api.methods.world\") AUSTRALIA\n\n      * #### GERMANY\n            \n                        public static final [Location](Location.html \"enum in org.dreambot.api.methods.world\") GERMANY\n\n    * ### Method Detail\n\n      * #### values\n            \n                        public static [Location](Location.html \"enum in org.dreambot.api.methods.world\")[] values()\n\nReturns an array containing the constants of this enum type, in the order they\nare declared. This method may be used to iterate over the constants as\nfollows:\n\n            \n                        for (Location c : Location.values())\n                System.out.println(c);\n            \n\nReturns:\n\n    an array containing the constants of this enum type, in the order they are declared\n      * #### valueOf\n            \n                        public static [Location](Location.html \"enum in org.dreambot.api.methods.world\") valueOf\u200b(java.lang.String name)\n\nReturns the enum constant of this type with the specified name. The string\nmust match _exactly_ an identifier used to declare an enum constant in this\ntype. (Extraneous whitespace characters are not permitted.)\n\nParameters:\n\n    `name` \\- the name of the enum constant to be returned.\nReturns:\n\n    the enum constant with the specified name\nThrows:\n\n    `java.lang.IllegalArgumentException` \\- if this enum type has no constant with the specified name\n    `java.lang.NullPointerException` \\- if the argument is null\n      * #### getLocation\n            \n                        public int getLocation()\n\n      * #### getHost\n            \n                        public java.lang.String getHost()\n\n      * #### matches\n            \n                        public boolean matches\u200b(int location,\n                                   java.lang.String host)\n\n      * #### getForTexture\n            \n                        public static [Location](Location.html \"enum in org.dreambot.api.methods.world\") getForTexture\u200b(int id)\n\nSkip navigation links\n\n  * [Overview](../../../../../overview-summary.html)\n  * [Package](package-summary.html)\n  * Class\n  * [Tree](package-tree.html)\n  * [Deprecated](../../../../../deprecated-list.html)\n  * [Index](../../../../../index-all.html)\n  * [Help](../../../../../help-doc.html)\n\n  * [Frames](../../../../../index.html?org/dreambot/api/methods/world/Location.html)\n  * [No Frames](Location.html)\n\n  * [All Classes](../../../../../allclasses-noframe.html)\n\nJavaScript is disabled on your browser.\n\n  * Summary: \n  * Nested | \n  * Enum Constants | \n  * Field | \n  * Method\n\n  * Detail: \n  * Enum Constants | \n  * Field | \n  * Method"
    }
  ],
  "extraction_fallback_used": true
}