{
  "name": "TabKey",
  "full_name": "org.dreambot.api.methods.hotkeys.TabKey",
  "full_url": "https://dreambot.org/javadocs/org/dreambot/api/methods/hotkeys/TabKey.html",
  "type": "enum",
  "package": "org.dreambot.api.methods.hotkeys",
  "description": "Created by Nezz on 5/24/2016.",
  "page_structure": {
    "type": "enum",
    "format_version": "old",
    "has_summary_tables": true,
    "has_detail_sections": true,
    "has_nested_classes": false
  },
  "inheritance": [
    "TabKey"
  ],
  "interfaces_implemented": [],
  "nested_classes": [],
  "methods": [
    {
      "name": "Hotkey",
      "return_type": "",
      "modifiers": [],
      "description": "",
      "deprecated": false
    },
    {
      "name": "TabKey",
      "return_type": "TabKey[]",
      "modifiers": [
        "static"
      ],
      "description": "Returns an array containing the constants of this enum type, in the order they are declared.",
      "deprecated": false
    },
    {
      "name": "values",
      "signature": "public static TabKey[] values()",
      "return_type": "",
      "modifiers": [],
      "description": "Returns an array containing the constants of this enum type, in the order they are declared. This method may be used to iterate over the constants as follows: for (TabKey c : TabKey.values()) System.out.println(c);",
      "parameters": [],
      "return": {
        "type": "",
        "description": ""
      },
      "deprecated": false
    },
    {
      "name": "valueOf",
      "signature": "public static TabKey valueOf\u200b(java.lang.String name)",
      "return_type": "",
      "modifiers": [],
      "description": "Returns the enum constant of this type with the specified name. The string must match exactly an identifier used to declare an enum constant in this type. (Extraneous whitespace characters are not permitted.)",
      "parameters": [],
      "return": {
        "type": "",
        "description": ""
      },
      "deprecated": false
    },
    {
      "name": "getVal",
      "signature": "public int getVal()",
      "return_type": "",
      "modifiers": [],
      "description": "",
      "parameters": [],
      "return": {
        "type": "",
        "description": ""
      },
      "deprecated": false
    },
    {
      "name": "getHotkey",
      "signature": "public Hotkey getHotkey()",
      "return_type": "",
      "modifiers": [],
      "description": "",
      "parameters": [],
      "return": {
        "type": "",
        "description": ""
      },
      "deprecated": false
    },
    {
      "name": "getKey",
      "signature": "public java.lang.String getKey()",
      "return_type": "",
      "modifiers": [],
      "description": "",
      "parameters": [],
      "return": {
        "type": "",
        "description": ""
      },
      "deprecated": false
    },
    {
      "name": "getKeyValue",
      "signature": "public int getKeyValue()",
      "return_type": "",
      "modifiers": [],
      "description": "",
      "parameters": [],
      "return": {
        "type": "",
        "description": ""
      },
      "deprecated": false
    }
  ],
  "fields": [],
  "constructors": [],
  "enum_constants": [
    {
      "name": "Enum",
      "description": "Constant Summary\n\nEnum Constants  Enum Constant | Description  \n---|---  \n`ACCOUNT_MANAGEMENT` |    \n`CLAN` |    \n`COMBAT` |    \n`EMOTES` |    \n`EQUIPMENT` |    \n`FRIENDS` |    \n`IGNORE` |    \n`INVENTORY` |    \n`LOGOUT` |    \n`MAGIC` |    \n`MUSIC` |    \n`PRAYER` |    \n`QUESTS` |    \n`SETTINGS` |    \n`SKILLS` |    \n    * ### Method Summary\n\nAll Methods [Static Methods](javascript:show\\(1\\);) [Instance Methods](javascript:show\\(2\\);) [Concrete Methods](javascript:show\\(8\\);)  Modifier and Type | Method | Description  \n---|---|---  \n`[Hotkey](Hotkey.html \"enum in org.dreambot.api.methods.hotkeys\")` | `getHotkey()` |    \n`java.lang.String` | `getKey()` |    \n`int` | `getKeyValue()` |    \n`int` | `getVal()` |    \n`static [TabKey](TabKey.html \"enum in org.dreambot.api.methods.hotkeys\")` | `valueOf\u200b(java.lang.String name)` |  Returns the enum constant of this type with the specified name.  \n`static [TabKey](TabKey.html \"enum in org.dreambot.api.methods.hotkeys\")[]` | `values()` |  Returns an array containing the constants of this enum type, in the order they are declared.  \n      * ### Methods inherited from class java.lang.Enum\n\n`compareTo, equals, getDeclaringClass, hashCode, name, ordinal, toString,\nvalueOf`\n\n      * ### Methods inherited from class java.lang.Object\n\n`getClass, notify, notifyAll, wait, wait, wait`\n\n  *     * ### Enum Constant Detail\n\n      * #### COMBAT\n            \n                        public static final [TabKey](TabKey.html \"enum in org.dreambot.api.methods.hotkeys\") COMBAT\n\n      * #### PRAYER\n            \n                        public static final [TabKey](TabKey.html \"enum in org.dreambot.api.methods.hotkeys\") PRAYER\n\n      * #### SETTINGS\n            \n                        public static final [TabKey](TabKey.html \"enum in org.dreambot.api.methods.hotkeys\") SETTINGS\n\n      * #### SKILLS\n            \n                        public static final [TabKey](TabKey.html \"enum in org.dreambot.api.methods.hotkeys\") SKILLS\n\n      * #### MAGIC\n            \n                        public static final [TabKey](TabKey.html \"enum in org.dreambot.api.methods.hotkeys\") MAGIC\n\n      * #### EMOTES\n            \n                        public static final [TabKey](TabKey.html \"enum in org.dreambot.api.methods.hotkeys\") EMOTES\n\n      * #### QUESTS\n            \n                        public static final [TabKey](TabKey.html \"enum in org.dreambot.api.methods.hotkeys\") QUESTS\n\n      * #### FRIENDS\n            \n                        public static final [TabKey](TabKey.html \"enum in org.dreambot.api.methods.hotkeys\") FRIENDS\n\n      * #### CLAN\n            \n                        public static final [TabKey](TabKey.html \"enum in org.dreambot.api.methods.hotkeys\") CLAN\n\n      * #### INVENTORY\n            \n                        public static final [TabKey](TabKey.html \"enum in org.dreambot.api.methods.hotkeys\") INVENTORY\n\n      * #### IGNORE\n            \n                        public static final [TabKey](TabKey.html \"enum in org.dreambot.api.methods.hotkeys\") IGNORE\n\n      * #### ACCOUNT_MANAGEMENT\n            \n                        public static final [TabKey](TabKey.html \"enum in org.dreambot.api.methods.hotkeys\") ACCOUNT_MANAGEMENT\n\n      * #### MUSIC\n            \n                        public static final [TabKey](TabKey.html \"enum in org.dreambot.api.methods.hotkeys\") MUSIC\n\n      * #### EQUIPMENT\n            \n                        public static final [TabKey](TabKey.html \"enum in org.dreambot.api.methods.hotkeys\") EQUIPMENT\n\n      * #### LOGOUT\n            \n                        public static final [TabKey](TabKey.html \"enum in org.dreambot.api.methods.hotkeys\") LOGOUT\n\n    * ### Method Detail\n\n      * #### values\n            \n                        public static [TabKey](TabKey.html \"enum in org.dreambot.api.methods.hotkeys\")[] values()\n\nReturns an array containing the constants of this enum type, in the order they\nare declared. This method may be used to iterate over the constants as\nfollows:\n\n            \n                        for (TabKey c : TabKey.values())\n                System.out.println(c);\n            \n\nReturns:\n\n    an array containing the constants of this enum type, in the order they are declared\n      * #### valueOf\n            \n                        public static [TabKey](TabKey.html \"enum in org.dreambot.api.methods.hotkeys\") valueOf\u200b(java.lang.String name)\n\nReturns the enum constant of this type with the specified name. The string\nmust match _exactly_ an identifier used to declare an enum constant in this\ntype. (Extraneous whitespace characters are not permitted.)\n\nParameters:\n\n    `name` \\- the name of the enum constant to be returned.\nReturns:\n\n    the enum constant with the specified name\nThrows:\n\n    `java.lang.IllegalArgumentException` \\- if this enum type has no constant with the specified name\n    `java.lang.NullPointerException` \\- if the argument is null\n      * #### getVal\n            \n                        public int getVal()\n\n      * #### getHotkey\n            \n                        public [Hotkey](Hotkey.html \"enum in org.dreambot.api.methods.hotkeys\") getHotkey()\n\n      * #### getKey\n            \n                        public java.lang.String getKey()\n\n      * #### getKeyValue\n            \n                        public int getKeyValue()\n\nSkip navigation links\n\n  * [Overview](../../../../../overview-summary.html)\n  * [Package](package-summary.html)\n  * Class\n  * [Tree](package-tree.html)\n  * [Deprecated](../../../../../deprecated-list.html)\n  * [Index](../../../../../index-all.html)\n  * [Help](../../../../../help-doc.html)\n\n  * [Frames](../../../../../index.html?org/dreambot/api/methods/hotkeys/TabKey.html)\n  * [No Frames](TabKey.html)\n\n  * [All Classes](../../../../../allclasses-noframe.html)\n\nJavaScript is disabled on your browser.\n\n  * Summary: \n  * Nested | \n  * Enum Constants | \n  * Field | \n  * Method\n\n  * Detail: \n  * Enum Constants | \n  * Field | \n  * Method"
    }
  ],
  "extraction_fallback_used": true
}