{
  "name": "ForumRank",
  "full_name": "org.dreambot.api.methods.ForumRank",
  "full_url": "https://dreambot.org/javadocs/org/dreambot/api/methods/ForumRank.html",
  "type": "enum",
  "package": "org.dreambot.api.methods",
  "description": "Created by Nezz on 4/6/2015.",
  "page_structure": {
    "type": "enum",
    "format_version": "old",
    "has_summary_tables": true,
    "has_detail_sections": true,
    "has_nested_classes": false
  },
  "inheritance": [
    "ForumRank"
  ],
  "interfaces_implemented": [],
  "nested_classes": [],
  "methods": [
    {
      "name": "ForumRank",
      "return_type": "ForumRank[]",
      "modifiers": [
        "static"
      ],
      "description": "Returns an array containing the constants of this enum type, in the order they are declared.",
      "deprecated": false
    },
    {
      "name": "values",
      "signature": "public static ForumRank[] values()",
      "return_type": "",
      "modifiers": [],
      "description": "Returns an array containing the constants of this enum type, in the order they are declared. This method may be used to iterate over the constants as follows: for (ForumRank c : ForumRank.values()) System.out.println(c);",
      "parameters": [],
      "return": {
        "type": "",
        "description": ""
      },
      "deprecated": false
    },
    {
      "name": "valueOf",
      "signature": "public static ForumRank valueOf\u200b(java.lang.String name)",
      "return_type": "",
      "modifiers": [],
      "description": "Returns the enum constant of this type with the specified name. The string must match exactly an identifier used to declare an enum constant in this type. (Extraneous whitespace characters are not permitted.)",
      "parameters": [],
      "return": {
        "type": "",
        "description": ""
      },
      "deprecated": false
    },
    {
      "name": "getRanksString",
      "signature": "public static java.lang.String getRanksString\u200b(int... values)",
      "return_type": "",
      "modifiers": [],
      "description": "",
      "parameters": [],
      "return": {
        "type": "",
        "description": ""
      },
      "deprecated": false
    },
    {
      "name": "getRanks",
      "signature": "public static ForumRank[] getRanks\u200b(int... values)",
      "return_type": "",
      "modifiers": [],
      "description": "",
      "parameters": [],
      "return": {
        "type": "",
        "description": ""
      },
      "deprecated": false
    },
    {
      "name": "getValue",
      "signature": "public int getValue()",
      "return_type": "",
      "modifiers": [],
      "description": "",
      "parameters": [],
      "return": {
        "type": "",
        "description": ""
      },
      "deprecated": false
    },
    {
      "name": "getTabCount",
      "signature": "public int getTabCount()",
      "return_type": "",
      "modifiers": [],
      "description": "",
      "parameters": [],
      "return": {
        "type": "",
        "description": ""
      },
      "deprecated": false
    },
    {
      "name": "isVIP",
      "signature": "public boolean isVIP()",
      "return_type": "",
      "modifiers": [],
      "description": "",
      "parameters": [],
      "return": {
        "type": "",
        "description": ""
      },
      "deprecated": false
    },
    {
      "name": "isSponsor",
      "signature": "public boolean isSponsor()",
      "return_type": "",
      "modifiers": [],
      "description": "",
      "parameters": [],
      "return": {
        "type": "",
        "description": ""
      },
      "deprecated": false
    }
  ],
  "fields": [],
  "constructors": [],
  "enum_constants": [
    {
      "name": "Enum",
      "description": "Constant Summary\n\nEnum Constants  Enum Constant | Description  \n---|---  \n`ADMINISTRATOR` |    \n`ADVERTISER` |    \n`BANNED` |    \n`BANNED_2` |    \n`CHAT_MODERATOR` |    \n`DESIGNER` |    \n`DEVELOPER` |    \n`DOCS_CONTRIBUTOR` |    \n`ELITE_DONOR` |    \n`EX_STAFF` |    \n`FARMER` |    \n`FIFTY_DONOR` |    \n`FIVE_HUNDRED_DONOR` |    \n`GLOBAL_MODERATOR` |    \n`LEAD_DESIGNER` |    \n`LIFETIME_SPONSOR` |    \n`MEMBERS` |    \n`MIDDLE_MAN` |    \n`NEW_MEMBER` |    \n`NULL` |    \n`ONE_HUNDRED_DONOR` |    \n`SCHOLAR` |    \n`SCRIPTER` |    \n`SCRIPTER_PLUS` |    \n`SCRIPTER_PLUS_PLUS` |    \n`SDN_MANAGER` |    \n`SPONSOR` |    \n`STAFF_ADVISOR` |    \n`SUPER_MODERATOR` |    \n`TEMP` |    \n`THREE_HUNDRED_DONOR` |    \n`TRADE_WITH_CAUTION` |    \n`TRIAL_MODERATOR` |    \n`TWENTY_FIVE_DONOR` |    \n`VALIDATING` |    \n`VIP` |    \n    * ### Method Summary\n\nAll Methods [Static Methods](javascript:show\\(1\\);) [Instance Methods](javascript:show\\(2\\);) [Concrete Methods](javascript:show\\(8\\);)  Modifier and Type | Method | Description  \n---|---|---  \n`static [ForumRank](ForumRank.html \"enum in org.dreambot.api.methods\")[]` | `getRanks\u200b(int... values)` |    \n`static java.lang.String` | `getRanksString\u200b(int... values)` |    \n`static java.lang.String` | `getRanksString\u200b([ForumRank](ForumRank.html \"enum in org.dreambot.api.methods\")[] ranks)` |    \n`int` | `getTabCount()` |    \n`int` | `getValue()` |    \n`boolean` | `isSponsor()` |    \n`boolean` | `isVIP()` |    \n`static [ForumRank](ForumRank.html \"enum in org.dreambot.api.methods\")` | `valueOf\u200b(java.lang.String name)` |  Returns the enum constant of this type with the specified name.  \n`static [ForumRank](ForumRank.html \"enum in org.dreambot.api.methods\")[]` | `values()` |  Returns an array containing the constants of this enum type, in the order they are declared.  \n      * ### Methods inherited from class java.lang.Enum\n\n`compareTo, equals, getDeclaringClass, hashCode, name, ordinal, toString,\nvalueOf`\n\n      * ### Methods inherited from class java.lang.Object\n\n`getClass, notify, notifyAll, wait, wait, wait`\n\n  *     * ### Enum Constant Detail\n\n      * #### VALIDATING\n            \n                        public static final [ForumRank](ForumRank.html \"enum in org.dreambot.api.methods\") VALIDATING\n\n      * #### MEMBERS\n            \n                        public static final [ForumRank](ForumRank.html \"enum in org.dreambot.api.methods\") MEMBERS\n\n      * #### ADMINISTRATOR\n            \n                        public static final [ForumRank](ForumRank.html \"enum in org.dreambot.api.methods\") ADMINISTRATOR\n\n      * #### BANNED\n            \n                        public static final [ForumRank](ForumRank.html \"enum in org.dreambot.api.methods\") BANNED\n\n      * #### GLOBAL_MODERATOR\n            \n                        public static final [ForumRank](ForumRank.html \"enum in org.dreambot.api.methods\") GLOBAL_MODERATOR\n\n      * #### VIP\n            \n                        public static final [ForumRank](ForumRank.html \"enum in org.dreambot.api.methods\") VIP\n\n      * #### SPONSOR\n            \n                        public static final [ForumRank](ForumRank.html \"enum in org.dreambot.api.methods\") SPONSOR\n\n      * #### DEVELOPER\n            \n                        public static final [ForumRank](ForumRank.html \"enum in org.dreambot.api.methods\") DEVELOPER\n\n      * #### TWENTY_FIVE_DONOR\n            \n                        public static final [ForumRank](ForumRank.html \"enum in org.dreambot.api.methods\") TWENTY_FIVE_DONOR\n\n      * #### FIFTY_DONOR\n            \n                        public static final [ForumRank](ForumRank.html \"enum in org.dreambot.api.methods\") FIFTY_DONOR\n\n      * #### ONE_HUNDRED_DONOR\n            \n                        public static final [ForumRank](ForumRank.html \"enum in org.dreambot.api.methods\") ONE_HUNDRED_DONOR\n\n      * #### CHAT_MODERATOR\n            \n                        public static final [ForumRank](ForumRank.html \"enum in org.dreambot.api.methods\") CHAT_MODERATOR\n\n      * #### SUPER_MODERATOR\n            \n                        public static final [ForumRank](ForumRank.html \"enum in org.dreambot.api.methods\") SUPER_MODERATOR\n\n      * #### SCHOLAR\n            \n                        public static final [ForumRank](ForumRank.html \"enum in org.dreambot.api.methods\") SCHOLAR\n\n      * #### TRADE_WITH_CAUTION\n            \n                        public static final [ForumRank](ForumRank.html \"enum in org.dreambot.api.methods\") TRADE_WITH_CAUTION\n\n      * #### SCRIPTER\n            \n                        public static final [ForumRank](ForumRank.html \"enum in org.dreambot.api.methods\") SCRIPTER\n\n      * #### NEW_MEMBER\n            \n                        public static final [ForumRank](ForumRank.html \"enum in org.dreambot.api.methods\") NEW_MEMBER\n\n      * #### SCRIPTER_PLUS\n            \n                        public static final [ForumRank](ForumRank.html \"enum in org.dreambot.api.methods\") SCRIPTER_PLUS\n\n      * #### SCRIPTER_PLUS_PLUS\n            \n                        public static final [ForumRank](ForumRank.html \"enum in org.dreambot.api.methods\") SCRIPTER_PLUS_PLUS\n\n      * #### EX_STAFF\n            \n                        public static final [ForumRank](ForumRank.html \"enum in org.dreambot.api.methods\") EX_STAFF\n\n      * #### DESIGNER\n            \n                        public static final [ForumRank](ForumRank.html \"enum in org.dreambot.api.methods\") DESIGNER\n\n      * #### LEAD_DESIGNER\n            \n                        public static final [ForumRank](ForumRank.html \"enum in org.dreambot.api.methods\") LEAD_DESIGNER\n\n      * #### STAFF_ADVISOR\n            \n                        public static final [ForumRank](ForumRank.html \"enum in org.dreambot.api.methods\") STAFF_ADVISOR\n\n      * #### MIDDLE_MAN\n            \n                        public static final [ForumRank](ForumRank.html \"enum in org.dreambot.api.methods\") MIDDLE_MAN\n\n      * #### TRIAL_MODERATOR\n            \n                        public static final [ForumRank](ForumRank.html \"enum in org.dreambot.api.methods\") TRIAL_MODERATOR\n\n      * #### ADVERTISER\n            \n                        public static final [ForumRank](ForumRank.html \"enum in org.dreambot.api.methods\") ADVERTISER\n\n      * #### LIFETIME_SPONSOR\n            \n                        public static final [ForumRank](ForumRank.html \"enum in org.dreambot.api.methods\") LIFETIME_SPONSOR\n\n      * #### ELITE_DONOR\n            \n                        public static final [ForumRank](ForumRank.html \"enum in org.dreambot.api.methods\") ELITE_DONOR\n\n      * #### FIVE_HUNDRED_DONOR\n            \n                        public static final [ForumRank](ForumRank.html \"enum in org.dreambot.api.methods\") FIVE_HUNDRED_DONOR\n\n      * #### FARMER\n            \n                        public static final [ForumRank](ForumRank.html \"enum in org.dreambot.api.methods\") FARMER\n\n      * #### SDN_MANAGER\n            \n                        public static final [ForumRank](ForumRank.html \"enum in org.dreambot.api.methods\") SDN_MANAGER\n\n      * #### DOCS_CONTRIBUTOR\n            \n                        public static final [ForumRank](ForumRank.html \"enum in org.dreambot.api.methods\") DOCS_CONTRIBUTOR\n\n      * #### THREE_HUNDRED_DONOR\n            \n                        public static final [ForumRank](ForumRank.html \"enum in org.dreambot.api.methods\") THREE_HUNDRED_DONOR\n\n      * #### NULL\n            \n                        public static final [ForumRank](ForumRank.html \"enum in org.dreambot.api.methods\") NULL\n\n      * #### BANNED_2\n            \n                        public static final [ForumRank](ForumRank.html \"enum in org.dreambot.api.methods\") BANNED_2\n\n      * #### TEMP\n            \n                        public static final [ForumRank](ForumRank.html \"enum in org.dreambot.api.methods\") TEMP\n\n    * ### Method Detail\n\n      * #### values\n            \n                        public static [ForumRank](ForumRank.html \"enum in org.dreambot.api.methods\")[] values()\n\nReturns an array containing the constants of this enum type, in the order they\nare declared. This method may be used to iterate over the constants as\nfollows:\n\n            \n                        for (ForumRank c : ForumRank.values())\n                System.out.println(c);\n            \n\nReturns:\n\n    an array containing the constants of this enum type, in the order they are declared\n      * #### valueOf\n            \n                        public static [ForumRank](ForumRank.html \"enum in org.dreambot.api.methods\") valueOf\u200b(java.lang.String name)\n\nReturns the enum constant of this type with the specified name. The string\nmust match _exactly_ an identifier used to declare an enum constant in this\ntype. (Extraneous whitespace characters are not permitted.)\n\nParameters:\n\n    `name` \\- the name of the enum constant to be returned.\nReturns:\n\n    the enum constant with the specified name\nThrows:\n\n    `java.lang.IllegalArgumentException` \\- if this enum type has no constant with the specified name\n    `java.lang.NullPointerException` \\- if the argument is null\n      * #### getRanksString\n            \n                        public static java.lang.String getRanksString\u200b(int... values)\n\n      * #### getRanksString\n            \n                        public static java.lang.String getRanksString\u200b([ForumRank](ForumRank.html \"enum in org.dreambot.api.methods\")[] ranks)\n\n      * #### getRanks\n            \n                        public static [ForumRank](ForumRank.html \"enum in org.dreambot.api.methods\")[] getRanks\u200b(int... values)\n\n      * #### getValue\n            \n                        public int getValue()\n\n      * #### getTabCount\n            \n                        public int getTabCount()\n\n      * #### isVIP\n            \n                        public boolean isVIP()\n\n      * #### isSponsor\n            \n                        public boolean isSponsor()\n\nSkip navigation links\n\n  * [Overview](../../../../overview-summary.html)\n  * [Package](package-summary.html)\n  * Class\n  * [Tree](package-tree.html)\n  * [Deprecated](../../../../deprecated-list.html)\n  * [Index](../../../../index-all.html)\n  * [Help](../../../../help-doc.html)\n\n  * [Frames](../../../../index.html?org/dreambot/api/methods/ForumRank.html)\n  * [No Frames](ForumRank.html)\n\n  * [All Classes](../../../../allclasses-noframe.html)\n\nJavaScript is disabled on your browser.\n\n  * Summary: \n  * Nested | \n  * Enum Constants | \n  * Field | \n  * Method\n\n  * Detail: \n  * Enum Constants | \n  * Field | \n  * Method"
    }
  ],
  "extraction_fallback_used": true
}