{
  "name": "Skill",
  "full_name": "org.dreambot.api.methods.skills.Skill",
  "full_url": "https://dreambot.org/javadocs/org/dreambot/api/methods/skills/Skill.html",
  "type": "enum",
  "package": "org.dreambot.api.methods.skills",
  "description": "Gets the skill that corresponds to the unique id.",
  "page_structure": {
    "type": "enum",
    "format_version": "old",
    "has_summary_tables": true,
    "has_detail_sections": true,
    "has_nested_classes": false
  },
  "inheritance": [
    "Skill"
  ],
  "interfaces_implemented": [],
  "nested_classes": [],
  "methods": [
    {
      "name": "Skill",
      "return_type": "Skill[]",
      "modifiers": [
        "static"
      ],
      "description": "Returns an array containing the constants of this enum type, in the order they are declared.",
      "deprecated": false
    },
    {
      "name": "values",
      "signature": "public static Skill[] values()",
      "return_type": "",
      "modifiers": [],
      "description": "Returns an array containing the constants of this enum type, in the order they are declared. This method may be used to iterate over the constants as follows: for (Skill c : Skill.values()) System.out.println(c);",
      "parameters": [],
      "return": {
        "type": "",
        "description": ""
      },
      "deprecated": false
    },
    {
      "name": "valueOf",
      "signature": "public static Skill valueOf\u200b(java.lang.String name)",
      "return_type": "",
      "modifiers": [],
      "description": "Returns the enum constant of this type with the specified name. The string must match exactly an identifier used to declare an enum constant in this type. (Extraneous whitespace characters are not permitted.)",
      "parameters": [],
      "return": {
        "type": "",
        "description": ""
      },
      "deprecated": false
    },
    {
      "name": "forId",
      "signature": "public static @Nullable Skill forId\u200b(int id)",
      "return_type": "",
      "modifiers": [],
      "description": "Gets the skill that corresponds to the unique id.",
      "parameters": [],
      "return": {
        "type": "",
        "description": ""
      },
      "deprecated": false
    },
    {
      "name": "getId",
      "signature": "public int getId()",
      "return_type": "",
      "modifiers": [],
      "description": "Gets the skill's unique id.",
      "parameters": [],
      "return": {
        "type": "",
        "description": ""
      },
      "deprecated": false
    },
    {
      "name": "getChildWidget",
      "signature": "public int getChildWidget()",
      "return_type": "",
      "modifiers": [],
      "description": "Gets the skill's child widget id.",
      "parameters": [],
      "return": {
        "type": "",
        "description": ""
      },
      "deprecated": false
    },
    {
      "name": "getName",
      "signature": "public @NonNull java.lang.String getName()",
      "return_type": "",
      "modifiers": [],
      "description": "Gets the skill's name.",
      "parameters": [],
      "return": {
        "type": "",
        "description": ""
      },
      "deprecated": false
    },
    {
      "name": "toString",
      "signature": "public java.lang.String toString()",
      "return_type": "",
      "modifiers": [],
      "description": "",
      "parameters": [],
      "return": {
        "type": "",
        "description": ""
      },
      "deprecated": false
    },
    {
      "name": "getBoostedLevel",
      "signature": "public int getBoostedLevel()",
      "return_type": "",
      "modifiers": [],
      "description": "",
      "parameters": [],
      "return": {
        "type": "",
        "description": ""
      },
      "deprecated": false
    },
    {
      "name": "getLevel",
      "signature": "public int getLevel()",
      "return_type": "",
      "modifiers": [],
      "description": "",
      "parameters": [],
      "return": {
        "type": "",
        "description": ""
      },
      "deprecated": false
    },
    {
      "name": "getExperience",
      "signature": "public int getExperience()",
      "return_type": "",
      "modifiers": [],
      "description": "",
      "parameters": [],
      "return": {
        "type": "",
        "description": ""
      },
      "deprecated": false
    },
    {
      "name": "getExperienceToLevel",
      "signature": "public int getExperienceToLevel()",
      "return_type": "",
      "modifiers": [],
      "description": "",
      "parameters": [],
      "return": {
        "type": "",
        "description": ""
      },
      "deprecated": false
    }
  ],
  "fields": [],
  "constructors": [],
  "enum_constants": [
    {
      "name": "Enum",
      "description": "Constant Summary\n\nEnum Constants  Enum Constant | Description  \n---|---  \n`AGILITY` |    \n`ATTACK` |    \n`CONSTRUCTION` |    \n`COOKING` |    \n`CRAFTING` |    \n`DEFENCE` |    \n`FARMING` |    \n`FIREMAKING` |    \n`FISHING` |    \n`FLETCHING` |    \n`HERBLORE` |    \n`HITPOINTS` |    \n`HUNTER` |    \n`MAGIC` |    \n`MINING` |    \n`PRAYER` |    \n`RANGED` |    \n`RUNECRAFTING` |    \n`SLAYER` |    \n`SMITHING` |    \n`STRENGTH` |    \n`THIEVING` |    \n`WOODCUTTING` |    \n    * ### Method Summary\n\nAll Methods [Static Methods](javascript:show\\(1\\);) [Instance Methods](javascript:show\\(2\\);) [Concrete Methods](javascript:show\\(8\\);)  Modifier and Type | Method | Description  \n---|---|---  \n`static @Nullable [Skill](Skill.html \"enum in org.dreambot.api.methods.skills\")` | `forId\u200b(int id)` |  Gets the skill that corresponds to the unique id.  \n`int` | `getBoostedLevel()` |    \n`int` | `getChildWidget()` |  Gets the skill's child widget id.  \n`int` | `getExperience()` |    \n`int` | `getExperienceToLevel()` |    \n`int` | `getId()` |  Gets the skill's unique id.  \n`int` | `getLevel()` |    \n`@NonNull java.lang.String` | `getName()` |  Gets the skill's name.  \n`java.lang.String` | `toString()` |    \n`static [Skill](Skill.html \"enum in org.dreambot.api.methods.skills\")` | `valueOf\u200b(java.lang.String name)` |  Returns the enum constant of this type with the specified name.  \n`static [Skill](Skill.html \"enum in org.dreambot.api.methods.skills\")[]` | `values()` |  Returns an array containing the constants of this enum type, in the order they are declared.  \n      * ### Methods inherited from class java.lang.Enum\n\n`compareTo, equals, getDeclaringClass, hashCode, name, ordinal, valueOf`\n\n      * ### Methods inherited from class java.lang.Object\n\n`getClass, notify, notifyAll, wait, wait, wait`\n\n  *     * ### Enum Constant Detail\n\n      * #### ATTACK\n            \n                        @SerializedName(\"Attack\")\n            public static final [Skill](Skill.html \"enum in org.dreambot.api.methods.skills\") ATTACK\n\n      * #### DEFENCE\n            \n                        @SerializedName(\"Defence\")\n            public static final [Skill](Skill.html \"enum in org.dreambot.api.methods.skills\") DEFENCE\n\n      * #### STRENGTH\n            \n                        @SerializedName(\"Strength\")\n            public static final [Skill](Skill.html \"enum in org.dreambot.api.methods.skills\") STRENGTH\n\n      * #### HITPOINTS\n            \n                        @SerializedName(\"Hitpoints\")\n            public static final [Skill](Skill.html \"enum in org.dreambot.api.methods.skills\") HITPOINTS\n\n      * #### RANGED\n            \n                        @SerializedName(\"Ranged\")\n            public static final [Skill](Skill.html \"enum in org.dreambot.api.methods.skills\") RANGED\n\n      * #### PRAYER\n            \n                        @SerializedName(\"Prayer\")\n            public static final [Skill](Skill.html \"enum in org.dreambot.api.methods.skills\") PRAYER\n\n      * #### MAGIC\n            \n                        @SerializedName(\"Magic\")\n            public static final [Skill](Skill.html \"enum in org.dreambot.api.methods.skills\") MAGIC\n\n      * #### COOKING\n            \n                        @SerializedName(\"Cooking\")\n            public static final [Skill](Skill.html \"enum in org.dreambot.api.methods.skills\") COOKING\n\n      * #### WOODCUTTING\n            \n                        @SerializedName(\"Woodcutting\")\n            public static final [Skill](Skill.html \"enum in org.dreambot.api.methods.skills\") WOODCUTTING\n\n      * #### FLETCHING\n            \n                        @SerializedName(\"Fletching\")\n            public static final [Skill](Skill.html \"enum in org.dreambot.api.methods.skills\") FLETCHING\n\n      * #### FISHING\n            \n                        @SerializedName(\"Fishing\")\n            public static final [Skill](Skill.html \"enum in org.dreambot.api.methods.skills\") FISHING\n\n      * #### FIREMAKING\n            \n                        @SerializedName(\"Firemaking\")\n            public static final [Skill](Skill.html \"enum in org.dreambot.api.methods.skills\") FIREMAKING\n\n      * #### CRAFTING\n            \n                        @SerializedName(\"Crafting\")\n            public static final [Skill](Skill.html \"enum in org.dreambot.api.methods.skills\") CRAFTING\n\n      * #### SMITHING\n            \n                        @SerializedName(\"Smithing\")\n            public static final [Skill](Skill.html \"enum in org.dreambot.api.methods.skills\") SMITHING\n\n      * #### MINING\n            \n                        @SerializedName(\"Mining\")\n            public static final [Skill](Skill.html \"enum in org.dreambot.api.methods.skills\") MINING\n\n      * #### HERBLORE\n            \n                        @SerializedName(\"Herblore\")\n            public static final [Skill](Skill.html \"enum in org.dreambot.api.methods.skills\") HERBLORE\n\n      * #### AGILITY\n            \n                        @SerializedName(\"Agility\")\n            public static final [Skill](Skill.html \"enum in org.dreambot.api.methods.skills\") AGILITY\n\n      * #### THIEVING\n            \n                        @SerializedName(\"Thieving\")\n            public static final [Skill](Skill.html \"enum in org.dreambot.api.methods.skills\") THIEVING\n\n      * #### SLAYER\n            \n                        @SerializedName(\"Slayer\")\n            public static final [Skill](Skill.html \"enum in org.dreambot.api.methods.skills\") SLAYER\n\n      * #### FARMING\n            \n                        @SerializedName(\"Farming\")\n            public static final [Skill](Skill.html \"enum in org.dreambot.api.methods.skills\") FARMING\n\n      * #### RUNECRAFTING\n            \n                        @SerializedName(\"Runecrafting\")\n            public static final [Skill](Skill.html \"enum in org.dreambot.api.methods.skills\") RUNECRAFTING\n\n      * #### HUNTER\n            \n                        @SerializedName(\"Hunter\")\n            public static final [Skill](Skill.html \"enum in org.dreambot.api.methods.skills\") HUNTER\n\n      * #### CONSTRUCTION\n            \n                        @SerializedName(\"Construction\")\n            public static final [Skill](Skill.html \"enum in org.dreambot.api.methods.skills\") CONSTRUCTION\n\n    * ### Method Detail\n\n      * #### values\n            \n                        public static [Skill](Skill.html \"enum in org.dreambot.api.methods.skills\")[] values()\n\nReturns an array containing the constants of this enum type, in the order they\nare declared. This method may be used to iterate over the constants as\nfollows:\n\n            \n                        for (Skill c : Skill.values())\n                System.out.println(c);\n            \n\nReturns:\n\n    an array containing the constants of this enum type, in the order they are declared\n      * #### valueOf\n            \n                        public static [Skill](Skill.html \"enum in org.dreambot.api.methods.skills\") valueOf\u200b(java.lang.String name)\n\nReturns the enum constant of this type with the specified name. The string\nmust match _exactly_ an identifier used to declare an enum constant in this\ntype. (Extraneous whitespace characters are not permitted.)\n\nParameters:\n\n    `name` \\- the name of the enum constant to be returned.\nReturns:\n\n    the enum constant with the specified name\nThrows:\n\n    `java.lang.IllegalArgumentException` \\- if this enum type has no constant with the specified name\n    `java.lang.NullPointerException` \\- if the argument is null\n      * #### forId\n            \n                        public static @Nullable [Skill](Skill.html \"enum in org.dreambot.api.methods.skills\") forId\u200b(int id)\n\nGets the skill that corresponds to the unique id.\n\nParameters:\n\n    `id` \\- The unique skill id.\nReturns:\n\n    The skill that corresponds to the unique id.\n      * #### getId\n            \n                        public int getId()\n\nGets the skill's unique id.\n\nReturns:\n\n    The skill's unique id.\n      * #### getChildWidget\n            \n                        public int getChildWidget()\n\nGets the skill's child widget id.\n\nReturns:\n\n    The skill's child widget id.\n      * #### getName\n            \n                        public @NonNull java.lang.String getName()\n\nGets the skill's name.\n\nReturns:\n\n    The skill's name.\n      * #### toString\n            \n                        public java.lang.String toString()\n\nOverrides:\n\n    `toString` in class `java.lang.Enum<[Skill](Skill.html \"enum in org.dreambot.api.methods.skills\")>`\n      * #### getBoostedLevel\n            \n                        public int getBoostedLevel()\n\n      * #### getLevel\n            \n                        public int getLevel()\n\n      * #### getExperience\n            \n                        public int getExperience()\n\n      * #### getExperienceToLevel\n            \n                        public int getExperienceToLevel()\n\nSkip navigation links\n\n  * [Overview](../../../../../overview-summary.html)\n  * [Package](package-summary.html)\n  * Class\n  * [Tree](package-tree.html)\n  * [Deprecated](../../../../../deprecated-list.html)\n  * [Index](../../../../../index-all.html)\n  * [Help](../../../../../help-doc.html)\n\n  * [Frames](../../../../../index.html?org/dreambot/api/methods/skills/Skill.html)\n  * [No Frames](Skill.html)\n\n  * [All Classes](../../../../../allclasses-noframe.html)\n\nJavaScript is disabled on your browser.\n\n  * Summary: \n  * Nested | \n  * Enum Constants | \n  * Field | \n  * Method\n\n  * Detail: \n  * Enum Constants | \n  * Field | \n  * Method"
    }
  ],
  "extraction_fallback_used": true
}