{
  "name": "ItemTeleport",
  "full_name": "org.dreambot.api.methods.walking.web.node.impl.teleports.ItemTeleport",
  "full_url": "https://dreambot.org/javadocs/org/dreambot/api/methods/walking/web/node/impl/teleports/ItemTeleport.html",
  "type": "enum",
  "package": "org.dreambot.api.methods.walking.web.node.impl.teleports",
  "description": "Deprecated.",
  "page_structure": {
    "type": "enum",
    "format_version": "old",
    "has_summary_tables": true,
    "has_detail_sections": true,
    "has_nested_classes": false
  },
  "inheritance": [
    "ItemTeleport"
  ],
  "interfaces_implemented": [],
  "nested_classes": [],
  "methods": [
    {
      "name": "Item",
      "return_type": "",
      "modifiers": [],
      "description": "",
      "deprecated": false
    },
    {
      "name": "Filter",
      "return_type": "",
      "modifiers": [],
      "description": "",
      "deprecated": false
    },
    {
      "name": "ItemTeleport",
      "return_type": "ItemTeleport[]",
      "modifiers": [
        "static"
      ],
      "description": "Returns an array containing the constants of this enum type, in the order they are declared.",
      "deprecated": false
    },
    {
      "name": "values",
      "signature": "public static ItemTeleport[] values()",
      "return_type": "",
      "modifiers": [],
      "description": "Returns an array containing the constants of this enum type, in the order they are declared. This method may be used to iterate over the constants as follows: for (ItemTeleport c : ItemTeleport.values()) System.out.println(c);",
      "parameters": [],
      "return": {
        "type": "",
        "description": ""
      },
      "deprecated": false
    },
    {
      "name": "valueOf",
      "signature": "public static ItemTeleport valueOf\u200b(java.lang.String name)",
      "return_type": "",
      "modifiers": [],
      "description": "Returns the enum constant of this type with the specified name. The string must match exactly an identifier used to declare an enum constant in this type. (Extraneous whitespace characters are not permitted.)",
      "parameters": [],
      "return": {
        "type": "",
        "description": ""
      },
      "deprecated": false
    },
    {
      "name": "hasRequirements",
      "signature": "public boolean hasRequirements()",
      "return_type": "",
      "modifiers": [],
      "description": "",
      "parameters": [],
      "return": {
        "type": "",
        "description": ""
      },
      "deprecated": false
    },
    {
      "name": "canUse",
      "signature": "public boolean canUse()",
      "return_type": "",
      "modifiers": [],
      "description": "",
      "parameters": [],
      "return": {
        "type": "",
        "description": ""
      },
      "deprecated": false
    },
    {
      "name": "execute",
      "signature": "public boolean execute()",
      "return_type": "",
      "modifiers": [],
      "description": "",
      "parameters": [],
      "return": {
        "type": "",
        "description": ""
      },
      "deprecated": false
    },
    {
      "name": "getItemFilter",
      "signature": "public Filter<Item> getItemFilter()",
      "return_type": "",
      "modifiers": [],
      "description": "",
      "parameters": [],
      "return": {
        "type": "",
        "description": ""
      },
      "deprecated": false
    },
    {
      "name": "getInventoryItem",
      "signature": "public Item getInventoryItem()",
      "return_type": "",
      "modifiers": [],
      "description": "",
      "parameters": [],
      "return": {
        "type": "",
        "description": ""
      },
      "deprecated": false
    },
    {
      "name": "getEquipmentItem",
      "signature": "public Item getEquipmentItem()",
      "return_type": "",
      "modifiers": [],
      "description": "",
      "parameters": [],
      "return": {
        "type": "",
        "description": ""
      },
      "deprecated": false
    },
    {
      "name": "getLowest",
      "signature": "public Item getLowest\u200b(boolean useBank)",
      "return_type": "",
      "modifiers": [],
      "description": "",
      "parameters": [],
      "return": {
        "type": "",
        "description": ""
      },
      "deprecated": false
    },
    {
      "name": "setChronicleHasCharges",
      "signature": "public static void setChronicleHasCharges\u200b(boolean chronicleHasCharges)",
      "return_type": "",
      "modifiers": [],
      "description": "",
      "parameters": [],
      "return": {
        "type": "",
        "description": ""
      },
      "deprecated": false
    },
    {
      "name": "getX",
      "signature": "public int getX()",
      "return_type": "",
      "modifiers": [],
      "description": "",
      "parameters": [],
      "return": {
        "type": "",
        "description": ""
      },
      "deprecated": false
    },
    {
      "name": "getY",
      "signature": "public int getY()",
      "return_type": "",
      "modifiers": [],
      "description": "",
      "parameters": [],
      "return": {
        "type": "",
        "description": ""
      },
      "deprecated": false
    },
    {
      "name": "getZ",
      "signature": "public int getZ()",
      "return_type": "",
      "modifiers": [],
      "description": "",
      "parameters": [],
      "return": {
        "type": "",
        "description": ""
      },
      "deprecated": false
    }
  ],
  "fields": [],
  "constructors": [],
  "enum_constants": [
    {
      "name": "Enum",
      "description": "Constant Summary\n\nEnum Constants  Enum Constant | Description  \n---|---  \n`AIR_ALTAR` |    \n`AL_KHARID` |    \n`ALDARIN_POH_OUTSIDE_TAB` |    \n`ANCIENT_VAULT` |    \n`ANNAKARL_TAB` |    \n`APE_ATOLL_TAB` |    \n`ARCEUUS_LIBRARY_TAB` |    \n`ARDOUGNE_CLOAK_1_MONASTERY` |    \n`ARDOUGNE_CLOAK_2_MONASTERY` |    \n`ARDOUGNE_CLOAK_3_MONASTERY` |    \n`ARDOUGNE_CLOAK_4_MONASTERY` |    \n`ARDOUGNE_TAB` |    \n`BANDIT_CAMP` |    \n`BARBARIAN_ASSAULT` |    \n`BARBARIAN_TAB` |    \n`BARROWS_TAB` |    \n`BATTLEFRONT_TAB` |    \n`BRIMHAVEN_POH_OUTSIDE_TAB` |    \n`BURGH_MORYTANIA_LEGS_3` |    \n`BURGH_MORYTANIA_LEGS_4` |    \n`BURTHORPE_GAMES_ROOM` |    \n`CALCIFIED_MOTH` |    \n`CAMELOT_TAB` |    \n`CARRALLANGAR_TAB` |  Deprecated.  \n`CARRALLANGER_TAB` |    \n`CASTLE_WARS` |    \n`CATHERBY_TAB` |    \n`CEMETERY_TAB` |    \n`CHAMPIONS_GUILD` |    \n`CHAOS_TEMPLE` |    \n`CHRONICLE` |    \n`CIVITAS_ILLA_FORTIS` |    \n`COOKING_GUILD` |    \n`CORPOREAL_BEAST` |    \n`CRAFTING_GUILD` |    \n`DAREEYAK_TAB` |    \n`DARK_BEASTS` |    \n`DARKMEYER` |    \n`DESERT_EAGLE_STATION` |    \n`DIGSITE` |    \n`DIGSITE_SCROLL` |    \n`DONDAKAN` |    \n`DRAYNOR_MANOR_TAB` |    \n`DRAYNOR_VILLAGE` |    \n`DUEL_ARENA` |  Deprecated.  \n`EARTH_ALTAR` |    \n`ECTOFUNTUS` |    \n`EDGEVILLE` |    \n`EDGEVILLE_MONASTERY` |    \n`EMIRS_ARENA` |    \n`FALADOR_PARK` |    \n`FALADOR_TAB` |    \n`FARMING_GUILD` |    \n`FELDIP_HILLS_SCROLL` |    \n`FENKENSTRAINS_CASTLE_TAB` |    \n`FEROX_ENCLAVE` |    \n`FIRE_ALTAR` |    \n`FISHING_GUILD_NECK` |    \n`FISHING_GUILD_TAB` |    \n`FREMENNIK_SLAYER_DUNGEON` |    \n`FREMENNIK_SLAYER_DUNGEON_OUTSIDE` |  Deprecated.  \n`GHORROCK_DUNGEON` |    \n`GHORROCK_TAB` |    \n`GRAND_EXCHANGE` |    \n`GRAND_EXCHANGE_VARROCK_TAB` |    \n`GRAND_TREE` |    \n`HARMONY_ISLAND_TAB` |    \n`HOSIDIUS_POH_OUTSIDE_TAB` |    \n`HOUSE_ON_THE_HILL` |    \n`ICE_PLATEAU_TAB` |    \n`ICY_BASALT_WEISS` |    \n`IORWERTH_CAMP_SCROLL` |    \n`JORRALS_OUTPOST` |    \n`KARAMJA` |    \n`KARAMJA_GLOVES_3_GEM_MINE` |    \n`KARAMJA_GLOVES_4_GEM_MINE` |    \n`KARAMJA_GLOVES_4_SLAYER_MASTER` |    \n`KHARYRLL_TAB` |    \n`KHAZARD_TAB` |    \n`KOUREND_CASTLE_TAB` |    \n`LASSAR_TAB` |    \n`LASSAR_UNDERCITY` |    \n`LAVA_MAZE` |    \n`LITHKREN` |    \n`LLETYA_ETERNAL_TELEPORT_CRYSTAL` |    \n`LLETYA_TELEPORT_CRYSTAL` |    \n`LUMBERYARD_SCROLL` |    \n`LUMBRIDGE_TAB` |    \n`LUNAR_ISLE_SCROLL` |    \n`MIND_ALTAR_TAB` |    \n`MINING_GUILD` |    \n`MISCELLANIA` |    \n`MOONCLAN_TAB` |    \n`MORTTON_SCROLL` |    \n`MOS_LEHARMLESS_SCROLL` |    \n`NARDAH_SCROLL` |    \n`OURANIA_TAB` |    \n`PADDEWWA_TAB` |    \n`PEST_CONTROL_SCROLL` |    \n`PISCATORIS_SCROLL` |    \n`POLLNIVNEACH_POH_OUTSIDE_TAB` |    \n`PRIFDDINAS_ETERNAL_TELEPORT_CRYSTAL` |    \n`PRIFDDINAS_TELEPORT_CRYSTAL` |    \n`PRIFFDDINAS_POH_OUTSIDE_TAB` |    \n`RANGING_GUILD` |    \n`RELLEKKA_LYRE` |    \n`RELLEKKA_POH_OUTSIDE_TAB` |    \n`REVENANT_CAVE_SCROLL` |    \n`RIMMINGTON_POH_OUTSIDE_TAB` |    \n`SALVE_GRAVEYARD_TAB` |    \n`SENNTISTEN_TAB` |    \n`SLAYER_TOWER` |    \n`SLEPE` |    \n`STRONGHOLD_SLAYER_CAVE` |    \n`TAI_BWO_WANNAI_SCROLL` |    \n`TAVERLY_POH_OUTSIDE_TAB` |    \n`TEARS_OF_GUTHIX` |    \n`THE_SCAR` |    \n`THE_STRANGLEWOOD` |    \n`TROLLHEIM` |    \n`TROLLHEIM_TAB` |    \n`VARROCK_TAB` |    \n`VER_SINHAZA` |    \n`WARRIORS_GUILD` |    \n`WATCHTOWER_TAB` |    \n`WATER_ALTAR` |    \n`WATERBIRTH_TAB` |    \n`WATSON_SCROLL` |    \n`WEST_ARDOUGNE_TAB` |    \n`WILDERNESS_CRABS_TELEPORT` |    \n`WINTERTODT_CAMP` |    \n`WIZARDS_TOWER` |    \n`WOODCUTTING_GUILD` |    \n`XERICS_GLADE` |    \n`XERICS_HEART` |    \n`XERICS_INFERNO` |    \n`XERICS_LOOKOUT` |    \n`YANILLE_POH_OUTSIDE_TAB` |    \n`ZULANDRA_SCROLL` |    \n    * ### Method Summary\n\nAll Methods [Static Methods](javascript:show\\(1\\);) [Instance Methods](javascript:show\\(2\\);) [Concrete Methods](javascript:show\\(8\\);)  Modifier and Type | Method | Description  \n---|---|---  \n`boolean` | `canUse()` |    \n`boolean` | `execute()` |    \n`[Item](../../../../../../wrappers/items/Item.html \"class in org.dreambot.api.wrappers.items\")` | `getEquipmentItem()` |    \n`[Item](../../../../../../wrappers/items/Item.html \"class in org.dreambot.api.wrappers.items\")` | `getInventoryItem()` |    \n`[Filter](../../../../../filter/Filter.html \"interface in org.dreambot.api.methods.filter\")<[Item](../../../../../../wrappers/items/Item.html \"class in org.dreambot.api.wrappers.items\")>` | `getItemFilter()` |    \n`[Item](../../../../../../wrappers/items/Item.html \"class in org.dreambot.api.wrappers.items\")` | `getLowest\u200b(boolean useBank)` |    \n`int` | `getX()` |    \n`int` | `getY()` |    \n`int` | `getZ()` |    \n`boolean` | `hasRequirements()` |    \n`static void` | `setChronicleHasCharges\u200b(boolean chronicleHasCharges)` |    \n`static [ItemTeleport](ItemTeleport.html \"enum in org.dreambot.api.methods.walking.web.node.impl.teleports\")` | `valueOf\u200b(java.lang.String name)` |  Returns the enum constant of this type with the specified name.  \n`static [ItemTeleport](ItemTeleport.html \"enum in org.dreambot.api.methods.walking.web.node.impl.teleports\")[]` | `values()` |  Returns an array containing the constants of this enum type, in the order they are declared.  \n      * ### Methods inherited from class java.lang.Enum\n\n`compareTo, equals, getDeclaringClass, hashCode, name, ordinal, toString,\nvalueOf`\n\n      * ### Methods inherited from class java.lang.Object\n\n`getClass, notify, notifyAll, wait, wait, wait`\n\n  *     * ### Enum Constant Detail\n\n      * #### CHRONICLE\n            \n                        public static final [ItemTeleport](ItemTeleport.html \"enum in org.dreambot.api.methods.walking.web.node.impl.teleports\") CHRONICLE\n\n      * #### BARBARIAN_ASSAULT\n            \n                        public static final [ItemTeleport](ItemTeleport.html \"enum in org.dreambot.api.methods.walking.web.node.impl.teleports\") BARBARIAN_ASSAULT\n\n      * #### BURTHORPE_GAMES_ROOM\n            \n                        public static final [ItemTeleport](ItemTeleport.html \"enum in org.dreambot.api.methods.walking.web.node.impl.teleports\") BURTHORPE_GAMES_ROOM\n\n      * #### TEARS_OF_GUTHIX\n            \n                        public static final [ItemTeleport](ItemTeleport.html \"enum in org.dreambot.api.methods.walking.web.node.impl.teleports\") TEARS_OF_GUTHIX\n\n      * #### CORPOREAL_BEAST\n            \n                        public static final [ItemTeleport](ItemTeleport.html \"enum in org.dreambot.api.methods.walking.web.node.impl.teleports\") CORPOREAL_BEAST\n\n      * #### WINTERTODT_CAMP\n            \n                        public static final [ItemTeleport](ItemTeleport.html \"enum in org.dreambot.api.methods.walking.web.node.impl.teleports\") WINTERTODT_CAMP\n\n      * #### DUEL_ARENA\n            \n                        @Deprecated\n            public static final [ItemTeleport](ItemTeleport.html \"enum in org.dreambot.api.methods.walking.web.node.impl.teleports\") DUEL_ARENA\n\nDeprecated.\n\n      * #### EMIRS_ARENA\n            \n                        public static final [ItemTeleport](ItemTeleport.html \"enum in org.dreambot.api.methods.walking.web.node.impl.teleports\") EMIRS_ARENA\n\n      * #### FEROX_ENCLAVE\n            \n                        public static final [ItemTeleport](ItemTeleport.html \"enum in org.dreambot.api.methods.walking.web.node.impl.teleports\") FEROX_ENCLAVE\n\n      * #### CASTLE_WARS\n            \n                        public static final [ItemTeleport](ItemTeleport.html \"enum in org.dreambot.api.methods.walking.web.node.impl.teleports\") CASTLE_WARS\n\n      * #### WARRIORS_GUILD\n            \n                        public static final [ItemTeleport](ItemTeleport.html \"enum in org.dreambot.api.methods.walking.web.node.impl.teleports\") WARRIORS_GUILD\n\n      * #### CHAMPIONS_GUILD\n            \n                        public static final [ItemTeleport](ItemTeleport.html \"enum in org.dreambot.api.methods.walking.web.node.impl.teleports\") CHAMPIONS_GUILD\n\n      * #### EDGEVILLE_MONASTERY\n            \n                        public static final [ItemTeleport](ItemTeleport.html \"enum in org.dreambot.api.methods.walking.web.node.impl.teleports\") EDGEVILLE_MONASTERY\n\n      * #### RANGING_GUILD\n            \n                        public static final [ItemTeleport](ItemTeleport.html \"enum in org.dreambot.api.methods.walking.web.node.impl.teleports\") RANGING_GUILD\n\n      * #### FISHING_GUILD_NECK\n            \n                        public static final [ItemTeleport](ItemTeleport.html \"enum in org.dreambot.api.methods.walking.web.node.impl.teleports\") FISHING_GUILD_NECK\n\n      * #### MINING_GUILD\n            \n                        public static final [ItemTeleport](ItemTeleport.html \"enum in org.dreambot.api.methods.walking.web.node.impl.teleports\") MINING_GUILD\n\n      * #### CRAFTING_GUILD\n            \n                        public static final [ItemTeleport](ItemTeleport.html \"enum in org.dreambot.api.methods.walking.web.node.impl.teleports\") CRAFTING_GUILD\n\n      * #### COOKING_GUILD\n            \n                        public static final [ItemTeleport](ItemTeleport.html \"enum in org.dreambot.api.methods.walking.web.node.impl.teleports\") COOKING_GUILD\n\n      * #### WOODCUTTING_GUILD\n            \n                        public static final [ItemTeleport](ItemTeleport.html \"enum in org.dreambot.api.methods.walking.web.node.impl.teleports\") WOODCUTTING_GUILD\n\n      * #### FARMING_GUILD\n            \n                        public static final [ItemTeleport](ItemTeleport.html \"enum in org.dreambot.api.methods.walking.web.node.impl.teleports\") FARMING_GUILD\n\n      * #### EDGEVILLE\n            \n                        public static final [ItemTeleport](ItemTeleport.html \"enum in org.dreambot.api.methods.walking.web.node.impl.teleports\") EDGEVILLE\n\n      * #### KARAMJA\n            \n                        public static final [ItemTeleport](ItemTeleport.html \"enum in org.dreambot.api.methods.walking.web.node.impl.teleports\") KARAMJA\n\n      * #### DRAYNOR_VILLAGE\n            \n                        public static final [ItemTeleport](ItemTeleport.html \"enum in org.dreambot.api.methods.walking.web.node.impl.teleports\") DRAYNOR_VILLAGE\n\n      * #### AL_KHARID\n            \n                        public static final [ItemTeleport](ItemTeleport.html \"enum in org.dreambot.api.methods.walking.web.node.impl.teleports\") AL_KHARID\n\n      * #### MISCELLANIA\n            \n                        public static final [ItemTeleport](ItemTeleport.html \"enum in org.dreambot.api.methods.walking.web.node.impl.teleports\") MISCELLANIA\n\n      * #### GRAND_EXCHANGE\n            \n                        public static final [ItemTeleport](ItemTeleport.html \"enum in org.dreambot.api.methods.walking.web.node.impl.teleports\") GRAND_EXCHANGE\n\n      * #### FALADOR_PARK\n            \n                        public static final [ItemTeleport](ItemTeleport.html \"enum in org.dreambot.api.methods.walking.web.node.impl.teleports\") FALADOR_PARK\n\n      * #### DONDAKAN\n            \n                        public static final [ItemTeleport](ItemTeleport.html \"enum in org.dreambot.api.methods.walking.web.node.impl.teleports\") DONDAKAN\n\n      * #### SLAYER_TOWER\n            \n                        public static final [ItemTeleport](ItemTeleport.html \"enum in org.dreambot.api.methods.walking.web.node.impl.teleports\") SLAYER_TOWER\n\n      * #### FREMENNIK_SLAYER_DUNGEON\n            \n                        public static final [ItemTeleport](ItemTeleport.html \"enum in org.dreambot.api.methods.walking.web.node.impl.teleports\") FREMENNIK_SLAYER_DUNGEON\n\n      * #### FREMENNIK_SLAYER_DUNGEON_OUTSIDE\n            \n                        @Deprecated\n            public static final [ItemTeleport](ItemTeleport.html \"enum in org.dreambot.api.methods.walking.web.node.impl.teleports\") FREMENNIK_SLAYER_DUNGEON_OUTSIDE\n\nDeprecated.\n\n      * #### STRONGHOLD_SLAYER_CAVE\n            \n                        public static final [ItemTeleport](ItemTeleport.html \"enum in org.dreambot.api.methods.walking.web.node.impl.teleports\") STRONGHOLD_SLAYER_CAVE\n\n      * #### DARK_BEASTS\n            \n                        public static final [ItemTeleport](ItemTeleport.html \"enum in org.dreambot.api.methods.walking.web.node.impl.teleports\") DARK_BEASTS\n\n      * #### DIGSITE\n            \n                        public static final [ItemTeleport](ItemTeleport.html \"enum in org.dreambot.api.methods.walking.web.node.impl.teleports\") DIGSITE\n\n      * #### HOUSE_ON_THE_HILL\n            \n                        public static final [ItemTeleport](ItemTeleport.html \"enum in org.dreambot.api.methods.walking.web.node.impl.teleports\") HOUSE_ON_THE_HILL\n\n      * #### LITHKREN\n            \n                        public static final [ItemTeleport](ItemTeleport.html \"enum in org.dreambot.api.methods.walking.web.node.impl.teleports\") LITHKREN\n\n      * #### WIZARDS_TOWER\n            \n                        public static final [ItemTeleport](ItemTeleport.html \"enum in org.dreambot.api.methods.walking.web.node.impl.teleports\") WIZARDS_TOWER\n\n      * #### JORRALS_OUTPOST\n            \n                        public static final [ItemTeleport](ItemTeleport.html \"enum in org.dreambot.api.methods.walking.web.node.impl.teleports\") JORRALS_OUTPOST\n\n      * #### DESERT_EAGLE_STATION\n            \n                        public static final [ItemTeleport](ItemTeleport.html \"enum in org.dreambot.api.methods.walking.web.node.impl.teleports\") DESERT_EAGLE_STATION\n\n      * #### CHAOS_TEMPLE\n            \n                        public static final [ItemTeleport](ItemTeleport.html \"enum in org.dreambot.api.methods.walking.web.node.impl.teleports\") CHAOS_TEMPLE\n\n      * #### BANDIT_CAMP\n            \n                        public static final [ItemTeleport](ItemTeleport.html \"enum in org.dreambot.api.methods.walking.web.node.impl.teleports\") BANDIT_CAMP\n\n      * #### LAVA_MAZE\n            \n                        public static final [ItemTeleport](ItemTeleport.html \"enum in org.dreambot.api.methods.walking.web.node.impl.teleports\") LAVA_MAZE\n\n      * #### XERICS_LOOKOUT\n            \n                        public static final [ItemTeleport](ItemTeleport.html \"enum in org.dreambot.api.methods.walking.web.node.impl.teleports\") XERICS_LOOKOUT\n\n      * #### XERICS_GLADE\n            \n                        public static final [ItemTeleport](ItemTeleport.html \"enum in org.dreambot.api.methods.walking.web.node.impl.teleports\") XERICS_GLADE\n\n      * #### XERICS_INFERNO\n            \n                        public static final [ItemTeleport](ItemTeleport.html \"enum in org.dreambot.api.methods.walking.web.node.impl.teleports\") XERICS_INFERNO\n\n      * #### XERICS_HEART\n            \n                        public static final [ItemTeleport](ItemTeleport.html \"enum in org.dreambot.api.methods.walking.web.node.impl.teleports\") XERICS_HEART\n\n      * #### VER_SINHAZA\n            \n                        public static final [ItemTeleport](ItemTeleport.html \"enum in org.dreambot.api.methods.walking.web.node.impl.teleports\") VER_SINHAZA\n\n      * #### DARKMEYER\n            \n                        public static final [ItemTeleport](ItemTeleport.html \"enum in org.dreambot.api.methods.walking.web.node.impl.teleports\") DARKMEYER\n\n      * #### SLEPE\n            \n                        public static final [ItemTeleport](ItemTeleport.html \"enum in org.dreambot.api.methods.walking.web.node.impl.teleports\") SLEPE\n\n      * #### ANCIENT_VAULT\n            \n                        public static final [ItemTeleport](ItemTeleport.html \"enum in org.dreambot.api.methods.walking.web.node.impl.teleports\") ANCIENT_VAULT\n\n      * #### THE_SCAR\n            \n                        public static final [ItemTeleport](ItemTeleport.html \"enum in org.dreambot.api.methods.walking.web.node.impl.teleports\") THE_SCAR\n\n      * #### GHORROCK_DUNGEON\n            \n                        public static final [ItemTeleport](ItemTeleport.html \"enum in org.dreambot.api.methods.walking.web.node.impl.teleports\") GHORROCK_DUNGEON\n\n      * #### LASSAR_UNDERCITY\n            \n                        public static final [ItemTeleport](ItemTeleport.html \"enum in org.dreambot.api.methods.walking.web.node.impl.teleports\") LASSAR_UNDERCITY\n\n      * #### THE_STRANGLEWOOD\n            \n                        public static final [ItemTeleport](ItemTeleport.html \"enum in org.dreambot.api.methods.walking.web.node.impl.teleports\") THE_STRANGLEWOOD\n\n      * #### AIR_ALTAR\n            \n                        public static final [ItemTeleport](ItemTeleport.html \"enum in org.dreambot.api.methods.walking.web.node.impl.teleports\") AIR_ALTAR\n\n      * #### WATER_ALTAR\n            \n                        public static final [ItemTeleport](ItemTeleport.html \"enum in org.dreambot.api.methods.walking.web.node.impl.teleports\") WATER_ALTAR\n\n      * #### EARTH_ALTAR\n            \n                        public static final [ItemTeleport](ItemTeleport.html \"enum in org.dreambot.api.methods.walking.web.node.impl.teleports\") EARTH_ALTAR\n\n      * #### FIRE_ALTAR\n            \n                        public static final [ItemTeleport](ItemTeleport.html \"enum in org.dreambot.api.methods.walking.web.node.impl.teleports\") FIRE_ALTAR\n\n      * #### BURGH_MORYTANIA_LEGS_3\n            \n                        public static final [ItemTeleport](ItemTeleport.html \"enum in org.dreambot.api.methods.walking.web.node.impl.teleports\") BURGH_MORYTANIA_LEGS_3\n\n      * #### BURGH_MORYTANIA_LEGS_4\n            \n                        public static final [ItemTeleport](ItemTeleport.html \"enum in org.dreambot.api.methods.walking.web.node.impl.teleports\") BURGH_MORYTANIA_LEGS_4\n\n      * #### KARAMJA_GLOVES_3_GEM_MINE\n            \n                        public static final [ItemTeleport](ItemTeleport.html \"enum in org.dreambot.api.methods.walking.web.node.impl.teleports\") KARAMJA_GLOVES_3_GEM_MINE\n\n      * #### KARAMJA_GLOVES_4_GEM_MINE\n            \n                        public static final [ItemTeleport](ItemTeleport.html \"enum in org.dreambot.api.methods.walking.web.node.impl.teleports\") KARAMJA_GLOVES_4_GEM_MINE\n\n      * #### KARAMJA_GLOVES_4_SLAYER_MASTER\n            \n                        public static final [ItemTeleport](ItemTeleport.html \"enum in org.dreambot.api.methods.walking.web.node.impl.teleports\") KARAMJA_GLOVES_4_SLAYER_MASTER\n\n      * #### ARDOUGNE_CLOAK_1_MONASTERY\n            \n                        public static final [ItemTeleport](ItemTeleport.html \"enum in org.dreambot.api.methods.walking.web.node.impl.teleports\") ARDOUGNE_CLOAK_1_MONASTERY\n\n      * #### ARDOUGNE_CLOAK_2_MONASTERY\n            \n                        public static final [ItemTeleport](ItemTeleport.html \"enum in org.dreambot.api.methods.walking.web.node.impl.teleports\") ARDOUGNE_CLOAK_2_MONASTERY\n\n      * #### ARDOUGNE_CLOAK_3_MONASTERY\n            \n                        public static final [ItemTeleport](ItemTeleport.html \"enum in org.dreambot.api.methods.walking.web.node.impl.teleports\") ARDOUGNE_CLOAK_3_MONASTERY\n\n      * #### ARDOUGNE_CLOAK_4_MONASTERY\n            \n                        public static final [ItemTeleport](ItemTeleport.html \"enum in org.dreambot.api.methods.walking.web.node.impl.teleports\") ARDOUGNE_CLOAK_4_MONASTERY\n\n      * #### TROLLHEIM\n            \n                        public static final [ItemTeleport](ItemTeleport.html \"enum in org.dreambot.api.methods.walking.web.node.impl.teleports\") TROLLHEIM\n\n      * #### VARROCK_TAB\n            \n                        public static final [ItemTeleport](ItemTeleport.html \"enum in org.dreambot.api.methods.walking.web.node.impl.teleports\") VARROCK_TAB\n\n      * #### GRAND_EXCHANGE_VARROCK_TAB\n            \n                        public static final [ItemTeleport](ItemTeleport.html \"enum in org.dreambot.api.methods.walking.web.node.impl.teleports\") GRAND_EXCHANGE_VARROCK_TAB\n\n      * #### LUMBRIDGE_TAB\n            \n                        public static final [ItemTeleport](ItemTeleport.html \"enum in org.dreambot.api.methods.walking.web.node.impl.teleports\") LUMBRIDGE_TAB\n\n      * #### FALADOR_TAB\n            \n                        public static final [ItemTeleport](ItemTeleport.html \"enum in org.dreambot.api.methods.walking.web.node.impl.teleports\") FALADOR_TAB\n\n      * #### CAMELOT_TAB\n            \n                        public static final [ItemTeleport](ItemTeleport.html \"enum in org.dreambot.api.methods.walking.web.node.impl.teleports\") CAMELOT_TAB\n\n      * #### KOUREND_CASTLE_TAB\n            \n                        public static final [ItemTeleport](ItemTeleport.html \"enum in org.dreambot.api.methods.walking.web.node.impl.teleports\") KOUREND_CASTLE_TAB\n\n      * #### ARDOUGNE_TAB\n            \n                        public static final [ItemTeleport](ItemTeleport.html \"enum in org.dreambot.api.methods.walking.web.node.impl.teleports\") ARDOUGNE_TAB\n\n      * #### WATCHTOWER_TAB\n            \n                        public static final [ItemTeleport](ItemTeleport.html \"enum in org.dreambot.api.methods.walking.web.node.impl.teleports\") WATCHTOWER_TAB\n\n      * #### PADDEWWA_TAB\n            \n                        public static final [ItemTeleport](ItemTeleport.html \"enum in org.dreambot.api.methods.walking.web.node.impl.teleports\") PADDEWWA_TAB\n\n      * #### SENNTISTEN_TAB\n            \n                        public static final [ItemTeleport](ItemTeleport.html \"enum in org.dreambot.api.methods.walking.web.node.impl.teleports\") SENNTISTEN_TAB\n\n      * #### ANNAKARL_TAB\n            \n                        public static final [ItemTeleport](ItemTeleport.html \"enum in org.dreambot.api.methods.walking.web.node.impl.teleports\") ANNAKARL_TAB\n\n      * #### CARRALLANGER_TAB\n            \n                        public static final [ItemTeleport](ItemTeleport.html \"enum in org.dreambot.api.methods.walking.web.node.impl.teleports\") CARRALLANGER_TAB\n\n      * #### CARRALLANGAR_TAB\n            \n                        @Deprecated\n            public static final [ItemTeleport](ItemTeleport.html \"enum in org.dreambot.api.methods.walking.web.node.impl.teleports\") CARRALLANGAR_TAB\n\nDeprecated.\n\n      * #### DAREEYAK_TAB\n            \n                        public static final [ItemTeleport](ItemTeleport.html \"enum in org.dreambot.api.methods.walking.web.node.impl.teleports\") DAREEYAK_TAB\n\n      * #### GHORROCK_TAB\n            \n                        public static final [ItemTeleport](ItemTeleport.html \"enum in org.dreambot.api.methods.walking.web.node.impl.teleports\") GHORROCK_TAB\n\n      * #### KHARYRLL_TAB\n            \n                        public static final [ItemTeleport](ItemTeleport.html \"enum in org.dreambot.api.methods.walking.web.node.impl.teleports\") KHARYRLL_TAB\n\n      * #### LASSAR_TAB\n            \n                        public static final [ItemTeleport](ItemTeleport.html \"enum in org.dreambot.api.methods.walking.web.node.impl.teleports\") LASSAR_TAB\n\n      * #### MOONCLAN_TAB\n            \n                        public static final [ItemTeleport](ItemTeleport.html \"enum in org.dreambot.api.methods.walking.web.node.impl.teleports\") MOONCLAN_TAB\n\n      * #### OURANIA_TAB\n            \n                        public static final [ItemTeleport](ItemTeleport.html \"enum in org.dreambot.api.methods.walking.web.node.impl.teleports\") OURANIA_TAB\n\n      * #### WATERBIRTH_TAB\n            \n                        public static final [ItemTeleport](ItemTeleport.html \"enum in org.dreambot.api.methods.walking.web.node.impl.teleports\") WATERBIRTH_TAB\n\n      * #### BARBARIAN_TAB\n            \n                        public static final [ItemTeleport](ItemTeleport.html \"enum in org.dreambot.api.methods.walking.web.node.impl.teleports\") BARBARIAN_TAB\n\n      * #### KHAZARD_TAB\n            \n                        public static final [ItemTeleport](ItemTeleport.html \"enum in org.dreambot.api.methods.walking.web.node.impl.teleports\") KHAZARD_TAB\n\n      * #### FISHING_GUILD_TAB\n            \n                        public static final [ItemTeleport](ItemTeleport.html \"enum in org.dreambot.api.methods.walking.web.node.impl.teleports\") FISHING_GUILD_TAB\n\n      * #### CATHERBY_TAB\n            \n                        public static final [ItemTeleport](ItemTeleport.html \"enum in org.dreambot.api.methods.walking.web.node.impl.teleports\") CATHERBY_TAB\n\n      * #### ICE_PLATEAU_TAB\n            \n                        public static final [ItemTeleport](ItemTeleport.html \"enum in org.dreambot.api.methods.walking.web.node.impl.teleports\") ICE_PLATEAU_TAB\n\n      * #### ARCEUUS_LIBRARY_TAB\n            \n                        public static final [ItemTeleport](ItemTeleport.html \"enum in org.dreambot.api.methods.walking.web.node.impl.teleports\") ARCEUUS_LIBRARY_TAB\n\n      * #### DRAYNOR_MANOR_TAB\n            \n                        public static final [ItemTeleport](ItemTeleport.html \"enum in org.dreambot.api.methods.walking.web.node.impl.teleports\") DRAYNOR_MANOR_TAB\n\n      * #### BATTLEFRONT_TAB\n            \n                        public static final [ItemTeleport](ItemTeleport.html \"enum in org.dreambot.api.methods.walking.web.node.impl.teleports\") BATTLEFRONT_TAB\n\n      * #### MIND_ALTAR_TAB\n            \n                        public static final [ItemTeleport](ItemTeleport.html \"enum in org.dreambot.api.methods.walking.web.node.impl.teleports\") MIND_ALTAR_TAB\n\n      * #### SALVE_GRAVEYARD_TAB\n            \n                        public static final [ItemTeleport](ItemTeleport.html \"enum in org.dreambot.api.methods.walking.web.node.impl.teleports\") SALVE_GRAVEYARD_TAB\n\n      * #### FENKENSTRAINS_CASTLE_TAB\n            \n                        public static final [ItemTeleport](ItemTeleport.html \"enum in org.dreambot.api.methods.walking.web.node.impl.teleports\") FENKENSTRAINS_CASTLE_TAB\n\n      * #### WEST_ARDOUGNE_TAB\n            \n                        public static final [ItemTeleport](ItemTeleport.html \"enum in org.dreambot.api.methods.walking.web.node.impl.teleports\") WEST_ARDOUGNE_TAB\n\n      * #### HARMONY_ISLAND_TAB\n            \n                        public static final [ItemTeleport](ItemTeleport.html \"enum in org.dreambot.api.methods.walking.web.node.impl.teleports\") HARMONY_ISLAND_TAB\n\n      * #### CEMETERY_TAB\n            \n                        public static final [ItemTeleport](ItemTeleport.html \"enum in org.dreambot.api.methods.walking.web.node.impl.teleports\") CEMETERY_TAB\n\n      * #### BARROWS_TAB\n            \n                        public static final [ItemTeleport](ItemTeleport.html \"enum in org.dreambot.api.methods.walking.web.node.impl.teleports\") BARROWS_TAB\n\n      * #### APE_ATOLL_TAB\n            \n                        public static final [ItemTeleport](ItemTeleport.html \"enum in org.dreambot.api.methods.walking.web.node.impl.teleports\") APE_ATOLL_TAB\n\n      * #### WILDERNESS_CRABS_TELEPORT\n            \n                        public static final [ItemTeleport](ItemTeleport.html \"enum in org.dreambot.api.methods.walking.web.node.impl.teleports\") WILDERNESS_CRABS_TELEPORT\n\n      * #### CIVITAS_ILLA_FORTIS\n            \n                        public static final [ItemTeleport](ItemTeleport.html \"enum in org.dreambot.api.methods.walking.web.node.impl.teleports\") CIVITAS_ILLA_FORTIS\n\n      * #### TROLLHEIM_TAB\n            \n                        public static final [ItemTeleport](ItemTeleport.html \"enum in org.dreambot.api.methods.walking.web.node.impl.teleports\") TROLLHEIM_TAB\n\n      * #### RIMMINGTON_POH_OUTSIDE_TAB\n            \n                        public static final [ItemTeleport](ItemTeleport.html \"enum in org.dreambot.api.methods.walking.web.node.impl.teleports\") RIMMINGTON_POH_OUTSIDE_TAB\n\n      * #### TAVERLY_POH_OUTSIDE_TAB\n            \n                        public static final [ItemTeleport](ItemTeleport.html \"enum in org.dreambot.api.methods.walking.web.node.impl.teleports\") TAVERLY_POH_OUTSIDE_TAB\n\n      * #### POLLNIVNEACH_POH_OUTSIDE_TAB\n            \n                        public static final [ItemTeleport](ItemTeleport.html \"enum in org.dreambot.api.methods.walking.web.node.impl.teleports\") POLLNIVNEACH_POH_OUTSIDE_TAB\n\n      * #### HOSIDIUS_POH_OUTSIDE_TAB\n            \n                        public static final [ItemTeleport](ItemTeleport.html \"enum in org.dreambot.api.methods.walking.web.node.impl.teleports\") HOSIDIUS_POH_OUTSIDE_TAB\n\n      * #### RELLEKKA_POH_OUTSIDE_TAB\n            \n                        public static final [ItemTeleport](ItemTeleport.html \"enum in org.dreambot.api.methods.walking.web.node.impl.teleports\") RELLEKKA_POH_OUTSIDE_TAB\n\n      * #### BRIMHAVEN_POH_OUTSIDE_TAB\n            \n                        public static final [ItemTeleport](ItemTeleport.html \"enum in org.dreambot.api.methods.walking.web.node.impl.teleports\") BRIMHAVEN_POH_OUTSIDE_TAB\n\n      * #### YANILLE_POH_OUTSIDE_TAB\n            \n                        public static final [ItemTeleport](ItemTeleport.html \"enum in org.dreambot.api.methods.walking.web.node.impl.teleports\") YANILLE_POH_OUTSIDE_TAB\n\n      * #### PRIFFDDINAS_POH_OUTSIDE_TAB\n            \n                        public static final [ItemTeleport](ItemTeleport.html \"enum in org.dreambot.api.methods.walking.web.node.impl.teleports\") PRIFFDDINAS_POH_OUTSIDE_TAB\n\n      * #### ALDARIN_POH_OUTSIDE_TAB\n            \n                        public static final [ItemTeleport](ItemTeleport.html \"enum in org.dreambot.api.methods.walking.web.node.impl.teleports\") ALDARIN_POH_OUTSIDE_TAB\n\n      * #### DIGSITE_SCROLL\n            \n                        public static final [ItemTeleport](ItemTeleport.html \"enum in org.dreambot.api.methods.walking.web.node.impl.teleports\") DIGSITE_SCROLL\n\n      * #### IORWERTH_CAMP_SCROLL\n            \n                        public static final [ItemTeleport](ItemTeleport.html \"enum in org.dreambot.api.methods.walking.web.node.impl.teleports\") IORWERTH_CAMP_SCROLL\n\n      * #### FELDIP_HILLS_SCROLL\n            \n                        public static final [ItemTeleport](ItemTeleport.html \"enum in org.dreambot.api.methods.walking.web.node.impl.teleports\") FELDIP_HILLS_SCROLL\n\n      * #### LUMBERYARD_SCROLL\n            \n                        public static final [ItemTeleport](ItemTeleport.html \"enum in org.dreambot.api.methods.walking.web.node.impl.teleports\") LUMBERYARD_SCROLL\n\n      * #### LUNAR_ISLE_SCROLL\n            \n                        public static final [ItemTeleport](ItemTeleport.html \"enum in org.dreambot.api.methods.walking.web.node.impl.teleports\") LUNAR_ISLE_SCROLL\n\n      * #### MORTTON_SCROLL\n            \n                        public static final [ItemTeleport](ItemTeleport.html \"enum in org.dreambot.api.methods.walking.web.node.impl.teleports\") MORTTON_SCROLL\n\n      * #### MOS_LEHARMLESS_SCROLL\n            \n                        public static final [ItemTeleport](ItemTeleport.html \"enum in org.dreambot.api.methods.walking.web.node.impl.teleports\") MOS_LEHARMLESS_SCROLL\n\n      * #### NARDAH_SCROLL\n            \n                        public static final [ItemTeleport](ItemTeleport.html \"enum in org.dreambot.api.methods.walking.web.node.impl.teleports\") NARDAH_SCROLL\n\n      * #### PEST_CONTROL_SCROLL\n            \n                        public static final [ItemTeleport](ItemTeleport.html \"enum in org.dreambot.api.methods.walking.web.node.impl.teleports\") PEST_CONTROL_SCROLL\n\n      * #### PISCATORIS_SCROLL\n            \n                        public static final [ItemTeleport](ItemTeleport.html \"enum in org.dreambot.api.methods.walking.web.node.impl.teleports\") PISCATORIS_SCROLL\n\n      * #### TAI_BWO_WANNAI_SCROLL\n            \n                        public static final [ItemTeleport](ItemTeleport.html \"enum in org.dreambot.api.methods.walking.web.node.impl.teleports\") TAI_BWO_WANNAI_SCROLL\n\n      * #### ZULANDRA_SCROLL\n            \n                        public static final [ItemTeleport](ItemTeleport.html \"enum in org.dreambot.api.methods.walking.web.node.impl.teleports\") ZULANDRA_SCROLL\n\n      * #### REVENANT_CAVE_SCROLL\n            \n                        public static final [ItemTeleport](ItemTeleport.html \"enum in org.dreambot.api.methods.walking.web.node.impl.teleports\") REVENANT_CAVE_SCROLL\n\n      * #### WATSON_SCROLL\n            \n                        public static final [ItemTeleport](ItemTeleport.html \"enum in org.dreambot.api.methods.walking.web.node.impl.teleports\") WATSON_SCROLL\n\n      * #### GRAND_TREE\n            \n                        public static final [ItemTeleport](ItemTeleport.html \"enum in org.dreambot.api.methods.walking.web.node.impl.teleports\") GRAND_TREE\n\n      * #### ECTOFUNTUS\n            \n                        public static final [ItemTeleport](ItemTeleport.html \"enum in org.dreambot.api.methods.walking.web.node.impl.teleports\") ECTOFUNTUS\n\n      * #### RELLEKKA_LYRE\n            \n                        public static final [ItemTeleport](ItemTeleport.html \"enum in org.dreambot.api.methods.walking.web.node.impl.teleports\") RELLEKKA_LYRE\n\n      * #### LLETYA_TELEPORT_CRYSTAL\n            \n                        public static final [ItemTeleport](ItemTeleport.html \"enum in org.dreambot.api.methods.walking.web.node.impl.teleports\") LLETYA_TELEPORT_CRYSTAL\n\n      * #### PRIFDDINAS_TELEPORT_CRYSTAL\n            \n                        public static final [ItemTeleport](ItemTeleport.html \"enum in org.dreambot.api.methods.walking.web.node.impl.teleports\") PRIFDDINAS_TELEPORT_CRYSTAL\n\n      * #### LLETYA_ETERNAL_TELEPORT_CRYSTAL\n            \n                        public static final [ItemTeleport](ItemTeleport.html \"enum in org.dreambot.api.methods.walking.web.node.impl.teleports\") LLETYA_ETERNAL_TELEPORT_CRYSTAL\n\n      * #### PRIFDDINAS_ETERNAL_TELEPORT_CRYSTAL\n            \n                        public static final [ItemTeleport](ItemTeleport.html \"enum in org.dreambot.api.methods.walking.web.node.impl.teleports\") PRIFDDINAS_ETERNAL_TELEPORT_CRYSTAL\n\n      * #### ICY_BASALT_WEISS\n            \n                        public static final [ItemTeleport](ItemTeleport.html \"enum in org.dreambot.api.methods.walking.web.node.impl.teleports\") ICY_BASALT_WEISS\n\n      * #### CALCIFIED_MOTH\n            \n                        public static final [ItemTeleport](ItemTeleport.html \"enum in org.dreambot.api.methods.walking.web.node.impl.teleports\") CALCIFIED_MOTH\n\n    * ### Method Detail\n\n      * #### values\n            \n                        public static [ItemTeleport](ItemTeleport.html \"enum in org.dreambot.api.methods.walking.web.node.impl.teleports\")[] values()\n\nReturns an array containing the constants of this enum type, in the order they\nare declared. This method may be used to iterate over the constants as\nfollows:\n\n            \n                        for (ItemTeleport c : ItemTeleport.values())\n                System.out.println(c);\n            \n\nReturns:\n\n    an array containing the constants of this enum type, in the order they are declared\n      * #### valueOf\n            \n                        public static [ItemTeleport](ItemTeleport.html \"enum in org.dreambot.api.methods.walking.web.node.impl.teleports\") valueOf\u200b(java.lang.String name)\n\nReturns the enum constant of this type with the specified name. The string\nmust match _exactly_ an identifier used to declare an enum constant in this\ntype. (Extraneous whitespace characters are not permitted.)\n\nParameters:\n\n    `name` \\- the name of the enum constant to be returned.\nReturns:\n\n    the enum constant with the specified name\nThrows:\n\n    `java.lang.IllegalArgumentException` \\- if this enum type has no constant with the specified name\n    `java.lang.NullPointerException` \\- if the argument is null\n      * #### hasRequirements\n            \n                        public boolean hasRequirements()\n\nSpecified by:\n\n    `[hasRequirements](Teleport.html#hasRequirements\\(\\))` in interface `[Teleport](Teleport.html \"interface in org.dreambot.api.methods.walking.web.node.impl.teleports\")`\n      * #### canUse\n            \n                        public boolean canUse()\n\n      * #### execute\n            \n                        public boolean execute()\n\nSpecified by:\n\n    `[execute](Teleport.html#execute\\(\\))` in interface `[Teleport](Teleport.html \"interface in org.dreambot.api.methods.walking.web.node.impl.teleports\")`\n      * #### getItemFilter\n            \n                        public [Filter](../../../../../filter/Filter.html \"interface in org.dreambot.api.methods.filter\")<[Item](../../../../../../wrappers/items/Item.html \"class in org.dreambot.api.wrappers.items\")> getItemFilter()\n\n      * #### getInventoryItem\n            \n                        public [Item](../../../../../../wrappers/items/Item.html \"class in org.dreambot.api.wrappers.items\") getInventoryItem()\n\n      * #### getEquipmentItem\n            \n                        public [Item](../../../../../../wrappers/items/Item.html \"class in org.dreambot.api.wrappers.items\") getEquipmentItem()\n\n      * #### getLowest\n            \n                        public [Item](../../../../../../wrappers/items/Item.html \"class in org.dreambot.api.wrappers.items\") getLowest\u200b(boolean useBank)\n\n      * #### setChronicleHasCharges\n            \n                        public static void setChronicleHasCharges\u200b(boolean chronicleHasCharges)\n\n      * #### getX\n            \n                        public int getX()\n\nSpecified by:\n\n    `[getX](Teleport.html#getX\\(\\))` in interface `[Teleport](Teleport.html \"interface in org.dreambot.api.methods.walking.web.node.impl.teleports\")`\n      * #### getY\n            \n                        public int getY()\n\nSpecified by:\n\n    `[getY](Teleport.html#getY\\(\\))` in interface `[Teleport](Teleport.html \"interface in org.dreambot.api.methods.walking.web.node.impl.teleports\")`\n      * #### getZ\n            \n                        public int getZ()\n\nSpecified by:\n\n    `[getZ](Teleport.html#getZ\\(\\))` in interface `[Teleport](Teleport.html \"interface in org.dreambot.api.methods.walking.web.node.impl.teleports\")`\n\nSkip navigation links\n\n  * [Overview](../../../../../../../../../overview-summary.html)\n  * [Package](package-summary.html)\n  * Class\n  * [Tree](package-tree.html)\n  * [Deprecated](../../../../../../../../../deprecated-list.html)\n  * [Index](../../../../../../../../../index-all.html)\n  * [Help](../../../../../../../../../help-doc.html)\n\n  * [Frames](../../../../../../../../../index.html?org/dreambot/api/methods/walking/web/node/impl/teleports/ItemTeleport.html)\n  * [No Frames](ItemTeleport.html)\n\n  * [All Classes](../../../../../../../../../allclasses-noframe.html)\n\nJavaScript is disabled on your browser.\n\n  * Summary: \n  * Nested | \n  * Enum Constants | \n  * Field | \n  * Method\n\n  * Detail: \n  * Enum Constants | \n  * Field | \n  * Method"
    }
  ],
  "extraction_fallback_used": true
}