{
  "name": "JewelryBox",
  "full_name": "org.dreambot.api.methods.walking.web.node.impl.teleports.poh.JewelryBox",
  "full_url": "https://dreambot.org/javadocs/org/dreambot/api/methods/walking/web/node/impl/teleports/poh/JewelryBox.html",
  "type": "enum",
  "package": "org.dreambot.api.methods.walking.web.node.impl.teleports.poh",
  "description": "Not currently implemented",
  "page_structure": {
    "type": "enum",
    "format_version": "old",
    "has_summary_tables": true,
    "has_detail_sections": true,
    "has_nested_classes": false
  },
  "inheritance": [
    "JewelryBox"
  ],
  "interfaces_implemented": [],
  "nested_classes": [],
  "methods": [
    {
      "name": "JewelryBox",
      "return_type": "JewelryBox[]",
      "modifiers": [
        "static"
      ],
      "description": "Returns an array containing the constants of this enum type, in the order they are declared.",
      "deprecated": false
    },
    {
      "name": "values",
      "signature": "public static JewelryBox[] values()",
      "return_type": "",
      "modifiers": [],
      "description": "Returns an array containing the constants of this enum type, in the order they are declared. This method may be used to iterate over the constants as follows: for (JewelryBox c : JewelryBox.values()) System.out.println(c);",
      "parameters": [],
      "return": {
        "type": "",
        "description": ""
      },
      "deprecated": false
    },
    {
      "name": "valueOf",
      "signature": "public static JewelryBox valueOf\u200b(java.lang.String name)",
      "return_type": "",
      "modifiers": [],
      "description": "Returns the enum constant of this type with the specified name. The string must match exactly an identifier used to declare an enum constant in this type. (Extraneous whitespace characters are not permitted.)",
      "parameters": [],
      "return": {
        "type": "",
        "description": ""
      },
      "deprecated": false
    },
    {
      "name": "hasRequirements",
      "signature": "public boolean hasRequirements()",
      "return_type": "",
      "modifiers": [],
      "description": "",
      "parameters": [],
      "return": {
        "type": "",
        "description": ""
      },
      "deprecated": false
    },
    {
      "name": "execute",
      "signature": "public boolean execute()",
      "return_type": "",
      "modifiers": [],
      "description": "",
      "parameters": [],
      "return": {
        "type": "",
        "description": ""
      },
      "deprecated": false
    },
    {
      "name": "getBoxLevel",
      "signature": "public int getBoxLevel()",
      "return_type": "",
      "modifiers": [],
      "description": "",
      "parameters": [],
      "return": {
        "type": "",
        "description": ""
      },
      "deprecated": false
    },
    {
      "name": "getAction",
      "signature": "public java.lang.String getAction()",
      "return_type": "",
      "modifiers": [],
      "description": "",
      "parameters": [],
      "return": {
        "type": "",
        "description": ""
      },
      "deprecated": false
    },
    {
      "name": "getX",
      "signature": "public int getX()",
      "return_type": "",
      "modifiers": [],
      "description": "",
      "parameters": [],
      "return": {
        "type": "",
        "description": ""
      },
      "deprecated": false
    },
    {
      "name": "getY",
      "signature": "public int getY()",
      "return_type": "",
      "modifiers": [],
      "description": "",
      "parameters": [],
      "return": {
        "type": "",
        "description": ""
      },
      "deprecated": false
    },
    {
      "name": "getZ",
      "signature": "public int getZ()",
      "return_type": "",
      "modifiers": [],
      "description": "",
      "parameters": [],
      "return": {
        "type": "",
        "description": ""
      },
      "deprecated": false
    }
  ],
  "fields": [],
  "constructors": [],
  "enum_constants": [
    {
      "name": "Enum",
      "description": "Constant Summary\n\nEnum Constants  Enum Constant | Description  \n---|---  \n`AL_KHARID` |    \n`BARBARIAN_ASSAULT` |    \n`BURTHORPE_GAMES_ROOM` |    \n`CASTLE_WARS` |    \n`CHAMPIONS_GUILD` |    \n`COOKING_GUILD` |    \n`CORPOREAL_BEAST` |    \n`CRAFTING_GUILD` |    \n`DONDAKAN` |    \n`DRAYNOR_VILLAGE` |    \n`DUEL_ARENA` |  Deprecated.  \n`EDGEVILLE` |    \n`EDGEVILLE_MONASTERY` |    \n`EMIRS_ARENA` |    \n`FALADOR_PARK` |    \n`FARMING_GUILD` |    \n`FEROX_ENCLAVE` |    \n`FISHING_GUILD_NECK` |    \n`GRAND_EXCHANGE` |    \n`KARAMJA` |    \n`MINING_GUILD` |    \n`MISCELLANIA` |    \n`RANGING_GUILD` |    \n`TEARS_OF_GUTHIX` |    \n`WARRIORS_GUILD` |    \n`WINTERTODT_CAMP` |    \n`WOODCUTTING_GUILD` |    \n    * ### Method Summary\n\nAll Methods [Static Methods](javascript:show\\(1\\);) [Instance Methods](javascript:show\\(2\\);) [Concrete Methods](javascript:show\\(8\\);)  Modifier and Type | Method | Description  \n---|---|---  \n`boolean` | `execute()` |    \n`java.lang.String` | `getAction()` |    \n`int` | `getBoxLevel()` |    \n`int` | `getX()` |    \n`int` | `getY()` |    \n`int` | `getZ()` |    \n`boolean` | `hasRequirements()` |    \n`static [JewelryBox](JewelryBox.html \"enum in org.dreambot.api.methods.walking.web.node.impl.teleports.poh\")` | `valueOf\u200b(java.lang.String name)` |  Returns the enum constant of this type with the specified name.  \n`static [JewelryBox](JewelryBox.html \"enum in org.dreambot.api.methods.walking.web.node.impl.teleports.poh\")[]` | `values()` |  Returns an array containing the constants of this enum type, in the order they are declared.  \n      * ### Methods inherited from class java.lang.Enum\n\n`compareTo, equals, getDeclaringClass, hashCode, name, ordinal, toString,\nvalueOf`\n\n      * ### Methods inherited from class java.lang.Object\n\n`getClass, notify, notifyAll, wait, wait, wait`\n\n  *     * ### Enum Constant Detail\n\n      * #### BARBARIAN_ASSAULT\n            \n                        public static final [JewelryBox](JewelryBox.html \"enum in org.dreambot.api.methods.walking.web.node.impl.teleports.poh\") BARBARIAN_ASSAULT\n\n      * #### BURTHORPE_GAMES_ROOM\n            \n                        public static final [JewelryBox](JewelryBox.html \"enum in org.dreambot.api.methods.walking.web.node.impl.teleports.poh\") BURTHORPE_GAMES_ROOM\n\n      * #### TEARS_OF_GUTHIX\n            \n                        public static final [JewelryBox](JewelryBox.html \"enum in org.dreambot.api.methods.walking.web.node.impl.teleports.poh\") TEARS_OF_GUTHIX\n\n      * #### CORPOREAL_BEAST\n            \n                        public static final [JewelryBox](JewelryBox.html \"enum in org.dreambot.api.methods.walking.web.node.impl.teleports.poh\") CORPOREAL_BEAST\n\n      * #### WINTERTODT_CAMP\n            \n                        public static final [JewelryBox](JewelryBox.html \"enum in org.dreambot.api.methods.walking.web.node.impl.teleports.poh\") WINTERTODT_CAMP\n\n      * #### DUEL_ARENA\n            \n                        @Deprecated\n            public static final [JewelryBox](JewelryBox.html \"enum in org.dreambot.api.methods.walking.web.node.impl.teleports.poh\") DUEL_ARENA\n\nDeprecated.\n\n      * #### EMIRS_ARENA\n            \n                        public static final [JewelryBox](JewelryBox.html \"enum in org.dreambot.api.methods.walking.web.node.impl.teleports.poh\") EMIRS_ARENA\n\n      * #### FEROX_ENCLAVE\n            \n                        public static final [JewelryBox](JewelryBox.html \"enum in org.dreambot.api.methods.walking.web.node.impl.teleports.poh\") FEROX_ENCLAVE\n\n      * #### CASTLE_WARS\n            \n                        public static final [JewelryBox](JewelryBox.html \"enum in org.dreambot.api.methods.walking.web.node.impl.teleports.poh\") CASTLE_WARS\n\n      * #### WARRIORS_GUILD\n            \n                        public static final [JewelryBox](JewelryBox.html \"enum in org.dreambot.api.methods.walking.web.node.impl.teleports.poh\") WARRIORS_GUILD\n\n      * #### CHAMPIONS_GUILD\n            \n                        public static final [JewelryBox](JewelryBox.html \"enum in org.dreambot.api.methods.walking.web.node.impl.teleports.poh\") CHAMPIONS_GUILD\n\n      * #### EDGEVILLE_MONASTERY\n            \n                        public static final [JewelryBox](JewelryBox.html \"enum in org.dreambot.api.methods.walking.web.node.impl.teleports.poh\") EDGEVILLE_MONASTERY\n\n      * #### RANGING_GUILD\n            \n                        public static final [JewelryBox](JewelryBox.html \"enum in org.dreambot.api.methods.walking.web.node.impl.teleports.poh\") RANGING_GUILD\n\n      * #### FISHING_GUILD_NECK\n            \n                        public static final [JewelryBox](JewelryBox.html \"enum in org.dreambot.api.methods.walking.web.node.impl.teleports.poh\") FISHING_GUILD_NECK\n\n      * #### MINING_GUILD\n            \n                        public static final [JewelryBox](JewelryBox.html \"enum in org.dreambot.api.methods.walking.web.node.impl.teleports.poh\") MINING_GUILD\n\n      * #### CRAFTING_GUILD\n            \n                        public static final [JewelryBox](JewelryBox.html \"enum in org.dreambot.api.methods.walking.web.node.impl.teleports.poh\") CRAFTING_GUILD\n\n      * #### COOKING_GUILD\n            \n                        public static final [JewelryBox](JewelryBox.html \"enum in org.dreambot.api.methods.walking.web.node.impl.teleports.poh\") COOKING_GUILD\n\n      * #### WOODCUTTING_GUILD\n            \n                        public static final [JewelryBox](JewelryBox.html \"enum in org.dreambot.api.methods.walking.web.node.impl.teleports.poh\") WOODCUTTING_GUILD\n\n      * #### FARMING_GUILD\n            \n                        public static final [JewelryBox](JewelryBox.html \"enum in org.dreambot.api.methods.walking.web.node.impl.teleports.poh\") FARMING_GUILD\n\n      * #### EDGEVILLE\n            \n                        public static final [JewelryBox](JewelryBox.html \"enum in org.dreambot.api.methods.walking.web.node.impl.teleports.poh\") EDGEVILLE\n\n      * #### KARAMJA\n            \n                        public static final [JewelryBox](JewelryBox.html \"enum in org.dreambot.api.methods.walking.web.node.impl.teleports.poh\") KARAMJA\n\n      * #### DRAYNOR_VILLAGE\n            \n                        public static final [JewelryBox](JewelryBox.html \"enum in org.dreambot.api.methods.walking.web.node.impl.teleports.poh\") DRAYNOR_VILLAGE\n\n      * #### AL_KHARID\n            \n                        public static final [JewelryBox](JewelryBox.html \"enum in org.dreambot.api.methods.walking.web.node.impl.teleports.poh\") AL_KHARID\n\n      * #### MISCELLANIA\n            \n                        public static final [JewelryBox](JewelryBox.html \"enum in org.dreambot.api.methods.walking.web.node.impl.teleports.poh\") MISCELLANIA\n\n      * #### GRAND_EXCHANGE\n            \n                        public static final [JewelryBox](JewelryBox.html \"enum in org.dreambot.api.methods.walking.web.node.impl.teleports.poh\") GRAND_EXCHANGE\n\n      * #### FALADOR_PARK\n            \n                        public static final [JewelryBox](JewelryBox.html \"enum in org.dreambot.api.methods.walking.web.node.impl.teleports.poh\") FALADOR_PARK\n\n      * #### DONDAKAN\n            \n                        public static final [JewelryBox](JewelryBox.html \"enum in org.dreambot.api.methods.walking.web.node.impl.teleports.poh\") DONDAKAN\n\n    * ### Method Detail\n\n      * #### values\n            \n                        public static [JewelryBox](JewelryBox.html \"enum in org.dreambot.api.methods.walking.web.node.impl.teleports.poh\")[] values()\n\nReturns an array containing the constants of this enum type, in the order they\nare declared. This method may be used to iterate over the constants as\nfollows:\n\n            \n                        for (JewelryBox c : JewelryBox.values())\n                System.out.println(c);\n            \n\nReturns:\n\n    an array containing the constants of this enum type, in the order they are declared\n      * #### valueOf\n            \n                        public static [JewelryBox](JewelryBox.html \"enum in org.dreambot.api.methods.walking.web.node.impl.teleports.poh\") valueOf\u200b(java.lang.String name)\n\nReturns the enum constant of this type with the specified name. The string\nmust match _exactly_ an identifier used to declare an enum constant in this\ntype. (Extraneous whitespace characters are not permitted.)\n\nParameters:\n\n    `name` \\- the name of the enum constant to be returned.\nReturns:\n\n    the enum constant with the specified name\nThrows:\n\n    `java.lang.IllegalArgumentException` \\- if this enum type has no constant with the specified name\n    `java.lang.NullPointerException` \\- if the argument is null\n      * #### hasRequirements\n            \n                        public boolean hasRequirements()\n\nSpecified by:\n\n    `[hasRequirements](../Teleport.html#hasRequirements\\(\\))` in interface `[Teleport](../Teleport.html \"interface in org.dreambot.api.methods.walking.web.node.impl.teleports\")`\n      * #### execute\n            \n                        public boolean execute()\n\nSpecified by:\n\n    `[execute](../Teleport.html#execute\\(\\))` in interface `[Teleport](../Teleport.html \"interface in org.dreambot.api.methods.walking.web.node.impl.teleports\")`\n      * #### getBoxLevel\n            \n                        public int getBoxLevel()\n\n      * #### getAction\n            \n                        public java.lang.String getAction()\n\n      * #### getX\n            \n                        public int getX()\n\nSpecified by:\n\n    `[getX](../Teleport.html#getX\\(\\))` in interface `[Teleport](../Teleport.html \"interface in org.dreambot.api.methods.walking.web.node.impl.teleports\")`\n      * #### getY\n            \n                        public int getY()\n\nSpecified by:\n\n    `[getY](../Teleport.html#getY\\(\\))` in interface `[Teleport](../Teleport.html \"interface in org.dreambot.api.methods.walking.web.node.impl.teleports\")`\n      * #### getZ\n            \n                        public int getZ()\n\nSpecified by:\n\n    `[getZ](../Teleport.html#getZ\\(\\))` in interface `[Teleport](../Teleport.html \"interface in org.dreambot.api.methods.walking.web.node.impl.teleports\")`\n\nSkip navigation links\n\n  * [Overview](../../../../../../../../../../overview-summary.html)\n  * [Package](package-summary.html)\n  * Class\n  * [Tree](package-tree.html)\n  * [Deprecated](../../../../../../../../../../deprecated-list.html)\n  * [Index](../../../../../../../../../../index-all.html)\n  * [Help](../../../../../../../../../../help-doc.html)\n\n  * [Frames](../../../../../../../../../../index.html?org/dreambot/api/methods/walking/web/node/impl/teleports/poh/JewelryBox.html)\n  * [No Frames](JewelryBox.html)\n\n  * [All Classes](../../../../../../../../../../allclasses-noframe.html)\n\nJavaScript is disabled on your browser.\n\n  * Summary: \n  * Nested | \n  * Enum Constants | \n  * Field | \n  * Method\n\n  * Detail: \n  * Enum Constants | \n  * Field | \n  * Method"
    }
  ],
  "extraction_fallback_used": true
}