{
  "name": "Arceus",
  "full_name": "org.dreambot.api.methods.magic.Arceus",
  "full_url": "https://dreambot.org/javadocs/org/dreambot/api/methods/magic/Arceus.html",
  "type": "enum",
  "package": "org.dreambot.api.methods.magic",
  "description": "Created by Pandemic",
  "page_structure": {
    "type": "enum",
    "format_version": "old",
    "has_summary_tables": true,
    "has_detail_sections": true,
    "has_nested_classes": false
  },
  "inheritance": [
    "Arceus"
  ],
  "interfaces_implemented": [],
  "nested_classes": [],
  "methods": [
    {
      "name": "Rune",
      "return_type": "",
      "modifiers": [],
      "description": "Deprecated.",
      "deprecated": false
    },
    {
      "name": "Arceus",
      "return_type": "Arceus[]",
      "modifiers": [
        "static"
      ],
      "description": "Deprecated.",
      "deprecated": false
    },
    {
      "name": "values",
      "signature": "public static Arceus[] values()",
      "return_type": "",
      "modifiers": [],
      "description": "Returns an array containing the constants of this enum type, in the order they are declared. This method may be used to iterate over the constants as follows: for (Arceus c : Arceus.values()) System.out.println(c);",
      "parameters": [],
      "return": {
        "type": "",
        "description": ""
      },
      "deprecated": false
    },
    {
      "name": "valueOf",
      "signature": "public static Arceus valueOf\u200b(java.lang.String name)",
      "return_type": "",
      "modifiers": [],
      "description": "Returns the enum constant of this type with the specified name. The string must match exactly an identifier used to declare an enum constant in this type. (Extraneous whitespace characters are not permitted.)",
      "parameters": [],
      "return": {
        "type": "",
        "description": ""
      },
      "deprecated": false
    },
    {
      "name": "getParent",
      "signature": "public int getParent()",
      "return_type": "",
      "modifiers": [],
      "description": "",
      "parameters": [],
      "return": {
        "type": "",
        "description": ""
      },
      "deprecated": false
    },
    {
      "name": "getChild",
      "signature": "public int getChild()",
      "return_type": "",
      "modifiers": [],
      "description": "",
      "parameters": [],
      "return": {
        "type": "",
        "description": ""
      },
      "deprecated": false
    },
    {
      "name": "getLevel",
      "signature": "public int getLevel()",
      "return_type": "",
      "modifiers": [],
      "description": "",
      "parameters": [],
      "return": {
        "type": "",
        "description": ""
      },
      "deprecated": false
    },
    {
      "name": "getCost",
      "signature": "public Rune[] getCost()",
      "return_type": "",
      "modifiers": [],
      "description": "",
      "parameters": [],
      "return": {
        "type": "",
        "description": ""
      },
      "deprecated": false
    },
    {
      "name": "getMagicExp",
      "signature": "public double getMagicExp()",
      "return_type": "",
      "modifiers": [],
      "description": "",
      "parameters": [],
      "return": {
        "type": "",
        "description": ""
      },
      "deprecated": false
    },
    {
      "name": "getPrayerExp",
      "signature": "public double getPrayerExp()",
      "return_type": "",
      "modifiers": [],
      "description": "",
      "parameters": [],
      "return": {
        "type": "",
        "description": ""
      },
      "deprecated": false
    },
    {
      "name": "getMaxHit",
      "signature": "public int getMaxHit()",
      "return_type": "",
      "modifiers": [],
      "description": "",
      "parameters": [],
      "return": {
        "type": "",
        "description": ""
      },
      "deprecated": false
    },
    {
      "name": "toString",
      "signature": "public java.lang.String toString()",
      "return_type": "",
      "modifiers": [],
      "description": "",
      "parameters": [],
      "return": {
        "type": "",
        "description": ""
      },
      "deprecated": false
    }
  ],
  "fields": [],
  "constructors": [],
  "enum_constants": [
    {
      "name": "Enum",
      "description": "Constant Summary\n\nEnum Constants  Enum Constant | Description  \n---|---  \n`ADEPT_REANIMATION` |  Deprecated.    \n`APE_ATOLL_TELEPORT` |  Deprecated.    \n`ARCEUS_HOME_TELEPORT` |  Deprecated.    \n`ARCEUUS_LIBRARY_TELEPORT` |  Deprecated.    \n`BARROWS_TELEPORT` |  Deprecated.    \n`BASIC_REANIMATION` |  Deprecated.    \n`BATTLEFRONT_TELEPORT` |  Deprecated.    \n`CEMETERY_TELEPORT` |  Deprecated.    \n`DARK_DEMONBANE` |  Deprecated.    \n`DARK_LURE` |  Deprecated.    \n`DEATH_CHARGE` |  Deprecated.    \n`DEGRIME` |  Deprecated.    \n`DEMONIC_OFFERING` |  Deprecated.    \n`DRAYNOR_MANOR_TELEPORT` |  Deprecated.    \n`EXPERT_REANIMATION` |  Deprecated.    \n`FENKENSTRAINS_CASTLE_TELEPORT` |  Deprecated.    \n`GHOSTLY_GRASP` |  Deprecated.    \n`GREATER_CORRUPTION` |  Deprecated.    \n`HARMONY_ISLAND_TELEPORT` |  Deprecated.    \n`LESSER_CORRUPTION` |  Deprecated.    \n`LUMBRIDGE_GRAVEYARD_TELEPORT` |  Deprecated.  \n`MARK_OF_DARKNESS` |  Deprecated.    \n`MASTER_REANIMATION` |  Deprecated.    \n`MIND_ALTAR_TELEPORT` |  Deprecated.    \n`REANIMATE_ABYSSAL_CREATURE` |  Deprecated.  \n`REANIMATE_AVIANSIE` |  Deprecated.  \n`REANIMATE_BEAR` |  Deprecated.  \n`REANIMATE_BLOODVELD` |  Deprecated.  \n`REANIMATE_CHAOS_DRUID` |  Deprecated.  \n`REANIMATE_DAGANNOTH` |  Deprecated.  \n`REANIMATE_DEMON` |  Deprecated.  \n`REANIMATE_DOG` |  Deprecated.  \n`REANIMATE_DRAGON` |  Deprecated.  \n`REANIMATE_ELF` |  Deprecated.  \n`REANIMATE_GIANT` |  Deprecated.  \n`REANIMATE_GOBLIN` |  Deprecated.  \n`REANIMATE_HORROR` |  Deprecated.  \n`REANIMATE_IMP` |  Deprecated.  \n`REANIMATE_KALPHITE` |  Deprecated.  \n`REANIMATE_MINOTAUR` |  Deprecated.  \n`REANIMATE_MONKEY` |  Deprecated.  \n`REANIMATE_OGRE` |  Deprecated.  \n`REANIMATE_SCORPTION` |  Deprecated.  \n`REANIMATE_TROLL` |  Deprecated.  \n`REANIMATE_TZHAAR` |  Deprecated.  \n`REANIMATE_UNICORN` |  Deprecated.  \n`RESPAWN_TELEPORT` |  Deprecated.    \n`RESURRECT_CROPS` |  Deprecated.    \n`RESURRECT_GREATER_GHOST` |  Deprecated.    \n`RESURRECT_GREATER_SKELETON` |  Deprecated.    \n`RESURRECT_GREATER_ZOMBIE` |  Deprecated.    \n`RESURRECT_LESSER_GHOST` |  Deprecated.    \n`RESURRECT_LESSER_SKELETON` |  Deprecated.    \n`RESURRECT_LESSER_ZOMBIE` |  Deprecated.    \n`RESURRECT_SUPERIOR_GHOST` |  Deprecated.    \n`RESURRECT_SUPERIOR_SKELETON` |  Deprecated.    \n`RESURRECT_SUPERIOR_ZOMBIE` |  Deprecated.    \n`SALVE_GRAVEYARD_TELEPORT` |  Deprecated.    \n`SHADOW_VEIL` |  Deprecated.    \n`SINISTER_OFFERING` |  Deprecated.    \n`SKELETAL_GRASP` |  Deprecated.    \n`SUPERIOR_DEMONBANE` |  Deprecated.    \n`UNDEAD_GRASP` |  Deprecated.    \n`VILE_VIGOUR` |  Deprecated.    \n`WARD_OF_ARCEUUS` |  Deprecated.    \n`WEST_ARDOUGNE_TELEPORT` |  Deprecated.    \n    * ### Method Summary\n\nAll Methods [Static Methods](javascript:show\\(1\\);) [Instance Methods](javascript:show\\(2\\);) [Concrete Methods](javascript:show\\(8\\);) [Deprecated Methods](javascript:show\\(32\\);)  Modifier and Type | Method | Description  \n---|---|---  \n`int` | `getChild()` |  Deprecated.    \n`[Rune](cost/Rune.html \"class in org.dreambot.api.methods.magic.cost\")[]` | `getCost()` |  Deprecated.    \n`int` | `getLevel()` |  Deprecated.    \n`double` | `getMagicExp()` |  Deprecated.    \n`int` | `getMaxHit()` |  Deprecated.    \n`int` | `getParent()` |  Deprecated.    \n`double` | `getPrayerExp()` |  Deprecated.    \n`java.lang.String` | `toString()` |  Deprecated.    \n`static [Arceus](Arceus.html \"enum in org.dreambot.api.methods.magic\")` | `valueOf\u200b(java.lang.String name)` |  Deprecated. Returns the enum constant of this type with the specified name.  \n`static [Arceus](Arceus.html \"enum in org.dreambot.api.methods.magic\")[]` | `values()` |  Deprecated. Returns an array containing the constants of this enum type, in the order they are declared.  \n      * ### Methods inherited from class java.lang.Enum\n\n`compareTo, equals, getDeclaringClass, hashCode, name, ordinal, valueOf`\n\n      * ### Methods inherited from class java.lang.Object\n\n`getClass, notify, notifyAll, wait, wait, wait`\n\n      * ### Methods inherited from interface org.dreambot.api.methods.magic.[Spell](Spell.html \"interface in org.dreambot.api.methods.magic\")\n\n`[getWidget](Spell.html#getWidget\\(\\))`\n\n  *     * ### Enum Constant Detail\n\n      * #### ARCEUS_HOME_TELEPORT\n            \n                        public static final [Arceus](Arceus.html \"enum in org.dreambot.api.methods.magic\") ARCEUS_HOME_TELEPORT\n\nDeprecated.\n\n      * #### REANIMATE_GOBLIN\n            \n                        @Deprecated\n            public static final [Arceus](Arceus.html \"enum in org.dreambot.api.methods.magic\") REANIMATE_GOBLIN\n\nDeprecated.\n\n      * #### ARCEUUS_LIBRARY_TELEPORT\n            \n                        public static final [Arceus](Arceus.html \"enum in org.dreambot.api.methods.magic\") ARCEUUS_LIBRARY_TELEPORT\n\nDeprecated.\n\n      * #### LUMBRIDGE_GRAVEYARD_TELEPORT\n            \n                        @Deprecated\n            public static final [Arceus](Arceus.html \"enum in org.dreambot.api.methods.magic\") LUMBRIDGE_GRAVEYARD_TELEPORT\n\nDeprecated.\n\n      * #### REANIMATE_MONKEY\n            \n                        @Deprecated\n            public static final [Arceus](Arceus.html \"enum in org.dreambot.api.methods.magic\") REANIMATE_MONKEY\n\nDeprecated.\n\n      * #### REANIMATE_IMP\n            \n                        @Deprecated\n            public static final [Arceus](Arceus.html \"enum in org.dreambot.api.methods.magic\") REANIMATE_IMP\n\nDeprecated.\n\n      * #### REANIMATE_MINOTAUR\n            \n                        @Deprecated\n            public static final [Arceus](Arceus.html \"enum in org.dreambot.api.methods.magic\") REANIMATE_MINOTAUR\n\nDeprecated.\n\n      * #### BASIC_REANIMATION\n            \n                        public static final [Arceus](Arceus.html \"enum in org.dreambot.api.methods.magic\") BASIC_REANIMATION\n\nDeprecated.\n\n      * #### DRAYNOR_MANOR_TELEPORT\n            \n                        public static final [Arceus](Arceus.html \"enum in org.dreambot.api.methods.magic\") DRAYNOR_MANOR_TELEPORT\n\nDeprecated.\n\n      * #### REANIMATE_SCORPTION\n            \n                        @Deprecated\n            public static final [Arceus](Arceus.html \"enum in org.dreambot.api.methods.magic\") REANIMATE_SCORPTION\n\nDeprecated.\n\n      * #### REANIMATE_BEAR\n            \n                        @Deprecated\n            public static final [Arceus](Arceus.html \"enum in org.dreambot.api.methods.magic\") REANIMATE_BEAR\n\nDeprecated.\n\n      * #### REANIMATE_UNICORN\n            \n                        @Deprecated\n            public static final [Arceus](Arceus.html \"enum in org.dreambot.api.methods.magic\") REANIMATE_UNICORN\n\nDeprecated.\n\n      * #### REANIMATE_DOG\n            \n                        @Deprecated\n            public static final [Arceus](Arceus.html \"enum in org.dreambot.api.methods.magic\") REANIMATE_DOG\n\nDeprecated.\n\n      * #### BATTLEFRONT_TELEPORT\n            \n                        public static final [Arceus](Arceus.html \"enum in org.dreambot.api.methods.magic\") BATTLEFRONT_TELEPORT\n\nDeprecated.\n\n      * #### MIND_ALTAR_TELEPORT\n            \n                        public static final [Arceus](Arceus.html \"enum in org.dreambot.api.methods.magic\") MIND_ALTAR_TELEPORT\n\nDeprecated.\n\n      * #### REANIMATE_CHAOS_DRUID\n            \n                        @Deprecated\n            public static final [Arceus](Arceus.html \"enum in org.dreambot.api.methods.magic\") REANIMATE_CHAOS_DRUID\n\nDeprecated.\n\n      * #### RESPAWN_TELEPORT\n            \n                        public static final [Arceus](Arceus.html \"enum in org.dreambot.api.methods.magic\") RESPAWN_TELEPORT\n\nDeprecated.\n\n      * #### REANIMATE_GIANT\n            \n                        @Deprecated\n            public static final [Arceus](Arceus.html \"enum in org.dreambot.api.methods.magic\") REANIMATE_GIANT\n\nDeprecated.\n\n      * #### GHOSTLY_GRASP\n            \n                        public static final [Arceus](Arceus.html \"enum in org.dreambot.api.methods.magic\") GHOSTLY_GRASP\n\nDeprecated.\n\n      * #### RESURRECT_LESSER_GHOST\n            \n                        public static final [Arceus](Arceus.html \"enum in org.dreambot.api.methods.magic\") RESURRECT_LESSER_GHOST\n\nDeprecated.\n\n      * #### RESURRECT_LESSER_SKELETON\n            \n                        public static final [Arceus](Arceus.html \"enum in org.dreambot.api.methods.magic\") RESURRECT_LESSER_SKELETON\n\nDeprecated.\n\n      * #### RESURRECT_LESSER_ZOMBIE\n            \n                        public static final [Arceus](Arceus.html \"enum in org.dreambot.api.methods.magic\") RESURRECT_LESSER_ZOMBIE\n\nDeprecated.\n\n      * #### SALVE_GRAVEYARD_TELEPORT\n            \n                        public static final [Arceus](Arceus.html \"enum in org.dreambot.api.methods.magic\") SALVE_GRAVEYARD_TELEPORT\n\nDeprecated.\n\n      * #### REANIMATE_OGRE\n            \n                        @Deprecated\n            public static final [Arceus](Arceus.html \"enum in org.dreambot.api.methods.magic\") REANIMATE_OGRE\n\nDeprecated.\n\n      * #### REANIMATE_ELF\n            \n                        @Deprecated\n            public static final [Arceus](Arceus.html \"enum in org.dreambot.api.methods.magic\") REANIMATE_ELF\n\nDeprecated.\n\n      * #### REANIMATE_TROLL\n            \n                        @Deprecated\n            public static final [Arceus](Arceus.html \"enum in org.dreambot.api.methods.magic\") REANIMATE_TROLL\n\nDeprecated.\n\n      * #### ADEPT_REANIMATION\n            \n                        public static final [Arceus](Arceus.html \"enum in org.dreambot.api.methods.magic\") ADEPT_REANIMATION\n\nDeprecated.\n\n      * #### FENKENSTRAINS_CASTLE_TELEPORT\n            \n                        public static final [Arceus](Arceus.html \"enum in org.dreambot.api.methods.magic\") FENKENSTRAINS_CASTLE_TELEPORT\n\nDeprecated.\n\n      * #### REANIMATE_HORROR\n            \n                        @Deprecated\n            public static final [Arceus](Arceus.html \"enum in org.dreambot.api.methods.magic\") REANIMATE_HORROR\n\nDeprecated.\n\n      * #### REANIMATE_KALPHITE\n            \n                        @Deprecated\n            public static final [Arceus](Arceus.html \"enum in org.dreambot.api.methods.magic\") REANIMATE_KALPHITE\n\nDeprecated.\n\n      * #### SHADOW_VEIL\n            \n                        public static final [Arceus](Arceus.html \"enum in org.dreambot.api.methods.magic\") SHADOW_VEIL\n\nDeprecated.\n\n      * #### DARK_LURE\n            \n                        public static final [Arceus](Arceus.html \"enum in org.dreambot.api.methods.magic\") DARK_LURE\n\nDeprecated.\n\n      * #### SKELETAL_GRASP\n            \n                        public static final [Arceus](Arceus.html \"enum in org.dreambot.api.methods.magic\") SKELETAL_GRASP\n\nDeprecated.\n\n      * #### RESURRECT_SUPERIOR_GHOST\n            \n                        public static final [Arceus](Arceus.html \"enum in org.dreambot.api.methods.magic\") RESURRECT_SUPERIOR_GHOST\n\nDeprecated.\n\n      * #### RESURRECT_SUPERIOR_SKELETON\n            \n                        public static final [Arceus](Arceus.html \"enum in org.dreambot.api.methods.magic\") RESURRECT_SUPERIOR_SKELETON\n\nDeprecated.\n\n      * #### RESURRECT_SUPERIOR_ZOMBIE\n            \n                        public static final [Arceus](Arceus.html \"enum in org.dreambot.api.methods.magic\") RESURRECT_SUPERIOR_ZOMBIE\n\nDeprecated.\n\n      * #### MARK_OF_DARKNESS\n            \n                        public static final [Arceus](Arceus.html \"enum in org.dreambot.api.methods.magic\") MARK_OF_DARKNESS\n\nDeprecated.\n\n      * #### WEST_ARDOUGNE_TELEPORT\n            \n                        public static final [Arceus](Arceus.html \"enum in org.dreambot.api.methods.magic\") WEST_ARDOUGNE_TELEPORT\n\nDeprecated.\n\n      * #### REANIMATE_DAGANNOTH\n            \n                        @Deprecated\n            public static final [Arceus](Arceus.html \"enum in org.dreambot.api.methods.magic\") REANIMATE_DAGANNOTH\n\nDeprecated.\n\n      * #### REANIMATE_BLOODVELD\n            \n                        @Deprecated\n            public static final [Arceus](Arceus.html \"enum in org.dreambot.api.methods.magic\") REANIMATE_BLOODVELD\n\nDeprecated.\n\n      * #### SUPERIOR_DEMONBANE\n            \n                        public static final [Arceus](Arceus.html \"enum in org.dreambot.api.methods.magic\") SUPERIOR_DEMONBANE\n\nDeprecated.\n\n      * #### LESSER_CORRUPTION\n            \n                        public static final [Arceus](Arceus.html \"enum in org.dreambot.api.methods.magic\") LESSER_CORRUPTION\n\nDeprecated.\n\n      * #### HARMONY_ISLAND_TELEPORT\n            \n                        public static final [Arceus](Arceus.html \"enum in org.dreambot.api.methods.magic\") HARMONY_ISLAND_TELEPORT\n\nDeprecated.\n\n      * #### REANIMATE_TZHAAR\n            \n                        @Deprecated\n            public static final [Arceus](Arceus.html \"enum in org.dreambot.api.methods.magic\") REANIMATE_TZHAAR\n\nDeprecated.\n\n      * #### VILE_VIGOUR\n            \n                        public static final [Arceus](Arceus.html \"enum in org.dreambot.api.methods.magic\") VILE_VIGOUR\n\nDeprecated.\n\n      * #### DEGRIME\n            \n                        public static final [Arceus](Arceus.html \"enum in org.dreambot.api.methods.magic\") DEGRIME\n\nDeprecated.\n\n      * #### CEMETERY_TELEPORT\n            \n                        public static final [Arceus](Arceus.html \"enum in org.dreambot.api.methods.magic\") CEMETERY_TELEPORT\n\nDeprecated.\n\n      * #### REANIMATE_DEMON\n            \n                        @Deprecated\n            public static final [Arceus](Arceus.html \"enum in org.dreambot.api.methods.magic\") REANIMATE_DEMON\n\nDeprecated.\n\n      * #### REANIMATE_AVIANSIE\n            \n                        @Deprecated\n            public static final [Arceus](Arceus.html \"enum in org.dreambot.api.methods.magic\") REANIMATE_AVIANSIE\n\nDeprecated.\n\n      * #### EXPERT_REANIMATION\n            \n                        public static final [Arceus](Arceus.html \"enum in org.dreambot.api.methods.magic\") EXPERT_REANIMATION\n\nDeprecated.\n\n      * #### WARD_OF_ARCEUUS\n            \n                        public static final [Arceus](Arceus.html \"enum in org.dreambot.api.methods.magic\") WARD_OF_ARCEUUS\n\nDeprecated.\n\n      * #### RESURRECT_GREATER_GHOST\n            \n                        public static final [Arceus](Arceus.html \"enum in org.dreambot.api.methods.magic\") RESURRECT_GREATER_GHOST\n\nDeprecated.\n\n      * #### RESURRECT_GREATER_SKELETON\n            \n                        public static final [Arceus](Arceus.html \"enum in org.dreambot.api.methods.magic\") RESURRECT_GREATER_SKELETON\n\nDeprecated.\n\n      * #### RESURRECT_GREATER_ZOMBIE\n            \n                        public static final [Arceus](Arceus.html \"enum in org.dreambot.api.methods.magic\") RESURRECT_GREATER_ZOMBIE\n\nDeprecated.\n\n      * #### RESURRECT_CROPS\n            \n                        public static final [Arceus](Arceus.html \"enum in org.dreambot.api.methods.magic\") RESURRECT_CROPS\n\nDeprecated.\n\n      * #### UNDEAD_GRASP\n            \n                        public static final [Arceus](Arceus.html \"enum in org.dreambot.api.methods.magic\") UNDEAD_GRASP\n\nDeprecated.\n\n      * #### DEATH_CHARGE\n            \n                        public static final [Arceus](Arceus.html \"enum in org.dreambot.api.methods.magic\") DEATH_CHARGE\n\nDeprecated.\n\n      * #### DARK_DEMONBANE\n            \n                        public static final [Arceus](Arceus.html \"enum in org.dreambot.api.methods.magic\") DARK_DEMONBANE\n\nDeprecated.\n\n      * #### BARROWS_TELEPORT\n            \n                        public static final [Arceus](Arceus.html \"enum in org.dreambot.api.methods.magic\") BARROWS_TELEPORT\n\nDeprecated.\n\n      * #### REANIMATE_ABYSSAL_CREATURE\n            \n                        @Deprecated\n            public static final [Arceus](Arceus.html \"enum in org.dreambot.api.methods.magic\") REANIMATE_ABYSSAL_CREATURE\n\nDeprecated.\n\n      * #### DEMONIC_OFFERING\n            \n                        public static final [Arceus](Arceus.html \"enum in org.dreambot.api.methods.magic\") DEMONIC_OFFERING\n\nDeprecated.\n\n      * #### GREATER_CORRUPTION\n            \n                        public static final [Arceus](Arceus.html \"enum in org.dreambot.api.methods.magic\") GREATER_CORRUPTION\n\nDeprecated.\n\n      * #### MASTER_REANIMATION\n            \n                        public static final [Arceus](Arceus.html \"enum in org.dreambot.api.methods.magic\") MASTER_REANIMATION\n\nDeprecated.\n\n      * #### APE_ATOLL_TELEPORT\n            \n                        public static final [Arceus](Arceus.html \"enum in org.dreambot.api.methods.magic\") APE_ATOLL_TELEPORT\n\nDeprecated.\n\n      * #### REANIMATE_DRAGON\n            \n                        @Deprecated\n            public static final [Arceus](Arceus.html \"enum in org.dreambot.api.methods.magic\") REANIMATE_DRAGON\n\nDeprecated.\n\n      * #### SINISTER_OFFERING\n            \n                        public static final [Arceus](Arceus.html \"enum in org.dreambot.api.methods.magic\") SINISTER_OFFERING\n\nDeprecated.\n\n    * ### Method Detail\n\n      * #### values\n            \n                        public static [Arceus](Arceus.html \"enum in org.dreambot.api.methods.magic\")[] values()\n\nDeprecated.\n\nReturns an array containing the constants of this enum type, in the order they\nare declared. This method may be used to iterate over the constants as\nfollows:\n\n            \n                        for (Arceus c : Arceus.values())\n                System.out.println(c);\n            \n\nReturns:\n\n    an array containing the constants of this enum type, in the order they are declared\n      * #### valueOf\n            \n                        public static [Arceus](Arceus.html \"enum in org.dreambot.api.methods.magic\") valueOf\u200b(java.lang.String name)\n\nDeprecated.\n\nReturns the enum constant of this type with the specified name. The string\nmust match _exactly_ an identifier used to declare an enum constant in this\ntype. (Extraneous whitespace characters are not permitted.)\n\nParameters:\n\n    `name` \\- the name of the enum constant to be returned.\nReturns:\n\n    the enum constant with the specified name\nThrows:\n\n    `java.lang.IllegalArgumentException` \\- if this enum type has no constant with the specified name\n    `java.lang.NullPointerException` \\- if the argument is null\n      * #### getParent\n            \n                        public int getParent()\n\nDeprecated.\n\nSpecified by:\n\n    `[getParent](Spell.html#getParent\\(\\))` in interface `[Spell](Spell.html \"interface in org.dreambot.api.methods.magic\")`\n      * #### getChild\n            \n                        public int getChild()\n\nDeprecated.\n\nSpecified by:\n\n    `[getChild](Spell.html#getChild\\(\\))` in interface `[Spell](Spell.html \"interface in org.dreambot.api.methods.magic\")`\n      * #### getLevel\n            \n                        public int getLevel()\n\nDeprecated.\n\nSpecified by:\n\n    `[getLevel](Spell.html#getLevel\\(\\))` in interface `[Spell](Spell.html \"interface in org.dreambot.api.methods.magic\")`\n      * #### getCost\n            \n                        public [Rune](cost/Rune.html \"class in org.dreambot.api.methods.magic.cost\")[] getCost()\n\nDeprecated.\n\nSpecified by:\n\n    `[getCost](Spell.html#getCost\\(\\))` in interface `[Spell](Spell.html \"interface in org.dreambot.api.methods.magic\")`\n      * #### getMagicExp\n            \n                        public double getMagicExp()\n\nDeprecated.\n\n      * #### getPrayerExp\n            \n                        public double getPrayerExp()\n\nDeprecated.\n\n      * #### getMaxHit\n            \n                        public int getMaxHit()\n\nDeprecated.\n\nSpecified by:\n\n    `[getMaxHit](Spell.html#getMaxHit\\(\\))` in interface `[Spell](Spell.html \"interface in org.dreambot.api.methods.magic\")`\n      * #### toString\n            \n                        public java.lang.String toString()\n\nDeprecated.\n\nOverrides:\n\n    `toString` in class `java.lang.Enum<[Arceus](Arceus.html \"enum in org.dreambot.api.methods.magic\")>`\n\nSkip navigation links\n\n  * [Overview](../../../../../overview-summary.html)\n  * [Package](package-summary.html)\n  * Class\n  * [Tree](package-tree.html)\n  * [Deprecated](../../../../../deprecated-list.html)\n  * [Index](../../../../../index-all.html)\n  * [Help](../../../../../help-doc.html)\n\n  * [Frames](../../../../../index.html?org/dreambot/api/methods/magic/Arceus.html)\n  * [No Frames](Arceus.html)\n\n  * [All Classes](../../../../../allclasses-noframe.html)\n\nJavaScript is disabled on your browser.\n\n  * Summary: \n  * Nested | \n  * Enum Constants | \n  * Field | \n  * Method\n\n  * Detail: \n  * Enum Constants | \n  * Field | \n  * Method"
    }
  ],
  "extraction_fallback_used": true
}