{
  "name": "EquipmentSlot",
  "full_name": "org.dreambot.api.methods.container.impl.equipment.EquipmentSlot",
  "full_url": "https://dreambot.org/javadocs/org/dreambot/api/methods/container/impl/equipment/EquipmentSlot.html",
  "type": "enum",
  "package": "org.dreambot.api.methods.container.impl.equipment",
  "description": "Gets the EquipmentSlot based on getRealSlot()",
  "page_structure": {
    "type": "enum",
    "format_version": "old",
    "has_summary_tables": true,
    "has_detail_sections": true,
    "has_nested_classes": false
  },
  "inheritance": [
    "EquipmentSlot"
  ],
  "interfaces_implemented": [],
  "nested_classes": [],
  "methods": [
    {
      "name": "EquipmentSlot",
      "return_type": "EquipmentSlot[]",
      "modifiers": [
        "static"
      ],
      "description": "Returns an array containing the constants of this enum type, in the order they are declared.",
      "deprecated": false
    },
    {
      "name": "values",
      "signature": "public static EquipmentSlot[] values()",
      "return_type": "",
      "modifiers": [],
      "description": "Returns an array containing the constants of this enum type, in the order they are declared. This method may be used to iterate over the constants as follows: for (EquipmentSlot c : EquipmentSlot.values()) System.out.println(c);",
      "parameters": [],
      "return": {
        "type": "",
        "description": ""
      },
      "deprecated": false
    },
    {
      "name": "valueOf",
      "signature": "public static EquipmentSlot valueOf\u200b(java.lang.String name)",
      "return_type": "",
      "modifiers": [],
      "description": "Returns the enum constant of this type with the specified name. The string must match exactly an identifier used to declare an enum constant in this type. (Extraneous whitespace characters are not permitted.)",
      "parameters": [],
      "return": {
        "type": "",
        "description": ""
      },
      "deprecated": false
    },
    {
      "name": "resetBaseChildId",
      "signature": "public static void resetBaseChildId()",
      "return_type": "",
      "modifiers": [],
      "description": "",
      "parameters": [],
      "return": {
        "type": "",
        "description": ""
      },
      "deprecated": false
    },
    {
      "name": "forSlotId",
      "signature": "public static EquipmentSlot forSlotId\u200b(int id)",
      "return_type": "",
      "modifiers": [],
      "description": "Gets the EquipmentSlot based on getRealSlot()",
      "parameters": [],
      "return": {
        "type": "",
        "description": ""
      },
      "deprecated": false
    },
    {
      "name": "forOriginalSlotId",
      "signature": "public static EquipmentSlot forOriginalSlotId\u200b(int id)",
      "return_type": "",
      "modifiers": [],
      "description": "",
      "parameters": [],
      "return": {
        "type": "",
        "description": ""
      },
      "deprecated": false
    },
    {
      "name": "getSlot",
      "signature": "public int getSlot()",
      "return_type": "",
      "modifiers": [],
      "description": "Gets the slot index of the equipment",
      "parameters": [],
      "return": {
        "type": "",
        "description": ""
      },
      "deprecated": false
    },
    {
      "name": "getRealSlot",
      "signature": "public int getRealSlot()",
      "return_type": "",
      "modifiers": [],
      "description": "Gets the real slot of the equipment, used for the item tables",
      "parameters": [],
      "return": {
        "type": "",
        "description": ""
      },
      "deprecated": false
    },
    {
      "name": "getActions",
      "signature": "public java.lang.String[] getActions()",
      "return_type": "",
      "modifiers": [],
      "description": "Gets the actions of the Equipment currently in this slot",
      "parameters": [],
      "return": {
        "type": "",
        "description": ""
      },
      "deprecated": false
    },
    {
      "name": "getChildWidget",
      "signature": "public int getChildWidget()",
      "return_type": "",
      "modifiers": [],
      "description": "Gets the WidgetChild ID of the Equipment",
      "parameters": [],
      "return": {
        "type": "",
        "description": ""
      },
      "deprecated": false
    },
    {
      "name": "getPosition",
      "signature": "public java.awt.Rectangle getPosition()",
      "return_type": "",
      "modifiers": [],
      "description": "",
      "parameters": [],
      "return": {
        "type": "",
        "description": ""
      },
      "deprecated": false
    },
    {
      "name": "hasAction",
      "signature": "public boolean hasAction\u200b(java.lang.String action)",
      "return_type": "",
      "modifiers": [],
      "description": "",
      "parameters": [],
      "return": {
        "type": "",
        "description": ""
      },
      "deprecated": false
    }
  ],
  "fields": [],
  "constructors": [],
  "enum_constants": [
    {
      "name": "Enum",
      "description": "Constant Summary\n\nEnum Constants  Enum Constant | Description  \n---|---  \n`AMULET` |    \n`ARROWS` |    \n`CAPE` |    \n`CHEST` |    \n`FEET` |    \n`HANDS` |    \n`HAT` |    \n`LEGS` |    \n`RING` |    \n`SHIELD` |    \n`WEAPON` |    \n    * ### Method Summary\n\nAll Methods [Static Methods](javascript:show\\(1\\);) [Instance Methods](javascript:show\\(2\\);) [Concrete Methods](javascript:show\\(8\\);)  Modifier and Type | Method | Description  \n---|---|---  \n`static [EquipmentSlot](EquipmentSlot.html \"enum in org.dreambot.api.methods.container.impl.equipment\")` | `forOriginalSlotId\u200b(int id)` |    \n`static [EquipmentSlot](EquipmentSlot.html \"enum in org.dreambot.api.methods.container.impl.equipment\")` | `forSlotId\u200b(int id)` |  Gets the EquipmentSlot based on `getRealSlot()`  \n`java.lang.String[]` | `getActions()` |  Gets the actions of the Equipment currently in this slot  \n`int` | `getChildWidget()` |  Gets the WidgetChild ID of the Equipment  \n`java.awt.Rectangle` | `getPosition()` |    \n`int` | `getRealSlot()` |  Gets the real slot of the equipment, used for the item tables  \n`int` | `getSlot()` |  Gets the slot index of the equipment  \n`boolean` | `hasAction\u200b(java.lang.String action)` |    \n`static void` | `resetBaseChildId()` |    \n`static [EquipmentSlot](EquipmentSlot.html \"enum in org.dreambot.api.methods.container.impl.equipment\")` | `valueOf\u200b(java.lang.String name)` |  Returns the enum constant of this type with the specified name.  \n`static [EquipmentSlot](EquipmentSlot.html \"enum in org.dreambot.api.methods.container.impl.equipment\")[]` | `values()` |  Returns an array containing the constants of this enum type, in the order they are declared.  \n      * ### Methods inherited from class java.lang.Enum\n\n`compareTo, equals, getDeclaringClass, hashCode, name, ordinal, toString,\nvalueOf`\n\n      * ### Methods inherited from class java.lang.Object\n\n`getClass, notify, notifyAll, wait, wait, wait`\n\n  *     * ### Enum Constant Detail\n\n      * #### HAT\n            \n                        public static final [EquipmentSlot](EquipmentSlot.html \"enum in org.dreambot.api.methods.container.impl.equipment\") HAT\n\n      * #### CAPE\n            \n                        public static final [EquipmentSlot](EquipmentSlot.html \"enum in org.dreambot.api.methods.container.impl.equipment\") CAPE\n\n      * #### AMULET\n            \n                        public static final [EquipmentSlot](EquipmentSlot.html \"enum in org.dreambot.api.methods.container.impl.equipment\") AMULET\n\n      * #### WEAPON\n            \n                        public static final [EquipmentSlot](EquipmentSlot.html \"enum in org.dreambot.api.methods.container.impl.equipment\") WEAPON\n\n      * #### CHEST\n            \n                        public static final [EquipmentSlot](EquipmentSlot.html \"enum in org.dreambot.api.methods.container.impl.equipment\") CHEST\n\n      * #### SHIELD\n            \n                        public static final [EquipmentSlot](EquipmentSlot.html \"enum in org.dreambot.api.methods.container.impl.equipment\") SHIELD\n\n      * #### LEGS\n            \n                        public static final [EquipmentSlot](EquipmentSlot.html \"enum in org.dreambot.api.methods.container.impl.equipment\") LEGS\n\n      * #### HANDS\n            \n                        public static final [EquipmentSlot](EquipmentSlot.html \"enum in org.dreambot.api.methods.container.impl.equipment\") HANDS\n\n      * #### FEET\n            \n                        public static final [EquipmentSlot](EquipmentSlot.html \"enum in org.dreambot.api.methods.container.impl.equipment\") FEET\n\n      * #### RING\n            \n                        public static final [EquipmentSlot](EquipmentSlot.html \"enum in org.dreambot.api.methods.container.impl.equipment\") RING\n\n      * #### ARROWS\n            \n                        public static final [EquipmentSlot](EquipmentSlot.html \"enum in org.dreambot.api.methods.container.impl.equipment\") ARROWS\n\n    * ### Method Detail\n\n      * #### values\n            \n                        public static [EquipmentSlot](EquipmentSlot.html \"enum in org.dreambot.api.methods.container.impl.equipment\")[] values()\n\nReturns an array containing the constants of this enum type, in the order they\nare declared. This method may be used to iterate over the constants as\nfollows:\n\n            \n                        for (EquipmentSlot c : EquipmentSlot.values())\n                System.out.println(c);\n            \n\nReturns:\n\n    an array containing the constants of this enum type, in the order they are declared\n      * #### valueOf\n            \n                        public static [EquipmentSlot](EquipmentSlot.html \"enum in org.dreambot.api.methods.container.impl.equipment\") valueOf\u200b(java.lang.String name)\n\nReturns the enum constant of this type with the specified name. The string\nmust match _exactly_ an identifier used to declare an enum constant in this\ntype. (Extraneous whitespace characters are not permitted.)\n\nParameters:\n\n    `name` \\- the name of the enum constant to be returned.\nReturns:\n\n    the enum constant with the specified name\nThrows:\n\n    `java.lang.IllegalArgumentException` \\- if this enum type has no constant with the specified name\n    `java.lang.NullPointerException` \\- if the argument is null\n      * #### resetBaseChildId\n            \n                        public static void resetBaseChildId()\n\n      * #### forSlotId\n            \n                        public static [EquipmentSlot](EquipmentSlot.html \"enum in org.dreambot.api.methods.container.impl.equipment\") forSlotId\u200b(int id)\n\nGets the EquipmentSlot based on `getRealSlot()`\n\nParameters:\n\n    `id` \\- Slot number\nReturns:\n\n    EquipmentSlot that matches that slot or null\n      * #### forOriginalSlotId\n            \n                        public static [EquipmentSlot](EquipmentSlot.html \"enum in org.dreambot.api.methods.container.impl.equipment\") forOriginalSlotId\u200b(int id)\n\n      * #### getSlot\n            \n                        public int getSlot()\n\nGets the slot index of the equipment\n\nReturns:\n\n    Integer value of the slot\n      * #### getRealSlot\n            \n                        public int getRealSlot()\n\nGets the real slot of the equipment, used for the item tables\n\nReturns:\n\n    Integer value of the real slot\n      * #### getActions\n            \n                        public java.lang.String[] getActions()\n\nGets the actions of the Equipment currently in this slot\n\nReturns:\n\n    Actions of the equipment or null if we're not able to access it\n      * #### getChildWidget\n            \n                        public int getChildWidget()\n\nGets the WidgetChild ID of the Equipment\n\nReturns:\n\n    WidgetChild ID of the Equipment\n      * #### getPosition\n            \n                        public java.awt.Rectangle getPosition()\n\n      * #### hasAction\n            \n                        public boolean hasAction\u200b(java.lang.String action)\n\nSkip navigation links\n\n  * [Overview](../../../../../../../overview-summary.html)\n  * [Package](package-summary.html)\n  * Class\n  * [Tree](package-tree.html)\n  * [Deprecated](../../../../../../../deprecated-list.html)\n  * [Index](../../../../../../../index-all.html)\n  * [Help](../../../../../../../help-doc.html)\n\n  * [Frames](../../../../../../../index.html?org/dreambot/api/methods/container/impl/equipment/EquipmentSlot.html)\n  * [No Frames](EquipmentSlot.html)\n\n  * [All Classes](../../../../../../../allclasses-noframe.html)\n\nJavaScript is disabled on your browser.\n\n  * Summary: \n  * Nested | \n  * Enum Constants | \n  * Field | \n  * Method\n\n  * Detail: \n  * Enum Constants | \n  * Field | \n  * Method"
    }
  ],
  "extraction_fallback_used": true
}