{
  "name": "HousePortal",
  "full_name": "org.dreambot.api.methods.walking.web.node.impl.teleports.poh.HousePortal",
  "full_url": "https://dreambot.org/javadocs/org/dreambot/api/methods/walking/web/node/impl/teleports/poh/HousePortal.html",
  "type": "enum",
  "package": "org.dreambot.api.methods.walking.web.node.impl.teleports.poh",
  "description": "Deprecated.",
  "page_structure": {
    "type": "enum",
    "format_version": "old",
    "has_summary_tables": true,
    "has_detail_sections": true,
    "has_nested_classes": false
  },
  "inheritance": [
    "HousePortal"
  ],
  "interfaces_implemented": [],
  "nested_classes": [],
  "methods": [
    {
      "name": "Tile",
      "return_type": "",
      "modifiers": [],
      "description": "",
      "deprecated": false
    },
    {
      "name": "HousePortal",
      "return_type": "HousePortal[]",
      "modifiers": [
        "static"
      ],
      "description": "Returns an array containing the constants of this enum type, in the order they are declared.",
      "deprecated": false
    },
    {
      "name": "values",
      "signature": "public static HousePortal[] values()",
      "return_type": "",
      "modifiers": [],
      "description": "Returns an array containing the constants of this enum type, in the order they are declared. This method may be used to iterate over the constants as follows: for (HousePortal c : HousePortal.values()) System.out.println(c);",
      "parameters": [],
      "return": {
        "type": "",
        "description": ""
      },
      "deprecated": false
    },
    {
      "name": "valueOf",
      "signature": "public static HousePortal valueOf\u200b(java.lang.String name)",
      "return_type": "",
      "modifiers": [],
      "description": "Returns the enum constant of this type with the specified name. The string must match exactly an identifier used to declare an enum constant in this type. (Extraneous whitespace characters are not permitted.)",
      "parameters": [],
      "return": {
        "type": "",
        "description": ""
      },
      "deprecated": false
    },
    {
      "name": "getX",
      "signature": "public int getX()",
      "return_type": "",
      "modifiers": [],
      "description": "",
      "parameters": [],
      "return": {
        "type": "",
        "description": ""
      },
      "deprecated": false
    },
    {
      "name": "getY",
      "signature": "public int getY()",
      "return_type": "",
      "modifiers": [],
      "description": "",
      "parameters": [],
      "return": {
        "type": "",
        "description": ""
      },
      "deprecated": false
    },
    {
      "name": "getZ",
      "signature": "public int getZ()",
      "return_type": "",
      "modifiers": [],
      "description": "",
      "parameters": [],
      "return": {
        "type": "",
        "description": ""
      },
      "deprecated": false
    },
    {
      "name": "hasRequirements",
      "signature": "public boolean hasRequirements()",
      "return_type": "",
      "modifiers": [],
      "description": "",
      "parameters": [],
      "return": {
        "type": "",
        "description": ""
      },
      "deprecated": false
    },
    {
      "name": "execute",
      "signature": "public boolean execute()",
      "return_type": "",
      "modifiers": [],
      "description": "",
      "parameters": [],
      "return": {
        "type": "",
        "description": ""
      },
      "deprecated": false
    },
    {
      "name": "getDestination",
      "signature": "public Tile getDestination()",
      "return_type": "",
      "modifiers": [],
      "description": "",
      "parameters": [],
      "return": {
        "type": "",
        "description": ""
      },
      "deprecated": false
    },
    {
      "name": "getPortalName",
      "signature": "public java.lang.String getPortalName()",
      "return_type": "",
      "modifiers": [],
      "description": "",
      "parameters": [],
      "return": {
        "type": "",
        "description": ""
      },
      "deprecated": false
    },
    {
      "name": "getNexusTarget",
      "signature": "public java.lang.String getNexusTarget()",
      "return_type": "",
      "modifiers": [],
      "description": "",
      "parameters": [],
      "return": {
        "type": "",
        "description": ""
      },
      "deprecated": false
    }
  ],
  "fields": [],
  "constructors": [],
  "enum_constants": [
    {
      "name": "Enum",
      "description": "Constant Summary\n\nEnum Constants  Enum Constant | Description  \n---|---  \n`ANNAKARL` |    \n`APE_ATOLL_DUNGEON` |    \n`ARCEUUS_LIBRARY` |    \n`BARROWS` |    \n`BATTLEFRONT` |    \n`CAMELOT` |    \n`CARRALLANGAR` |  Deprecated.  \n`CARRALLANGER` |    \n`CATHERBY` |    \n`CEMETERY` |    \n`DRAYNOR_MANOR` |    \n`EAST_ARDOUGNE` |    \n`FALADOR` |    \n`FENKENSTRAINS_CASTLE` |    \n`FISHING_GUILD` |    \n`GHORROCK` |    \n`HARMONY_ISLAND` |    \n`KHARYRLL` |    \n`KOUREND` |    \n`LUMBRIDGE` |    \n`LUNAR_ISLE` |    \n`MARIM` |    \n`MIND_ALTAR` |    \n`SALVE_GRAVEYARD` |    \n`SENNTISTEN` |    \n`TROLL_STRONGHOLD` |    \n`VARROCK` |    \n`WATERBIRTH_ISLAND` |    \n`WEST_ARDOUGNE` |    \n    * ### Method Summary\n\nAll Methods [Static Methods](javascript:show\\(1\\);) [Instance Methods](javascript:show\\(2\\);) [Concrete Methods](javascript:show\\(8\\);)  Modifier and Type | Method | Description  \n---|---|---  \n`boolean` | `execute()` |    \n`[Tile](../../../../../../map/Tile.html \"class in org.dreambot.api.methods.map\")` | `getDestination()` |    \n`java.lang.String` | `getNexusTarget()` |    \n`java.lang.String` | `getPortalName()` |    \n`int` | `getX()` |    \n`int` | `getY()` |    \n`int` | `getZ()` |    \n`boolean` | `hasRequirements()` |    \n`static [HousePortal](HousePortal.html \"enum in org.dreambot.api.methods.walking.web.node.impl.teleports.poh\")` | `valueOf\u200b(java.lang.String name)` |  Returns the enum constant of this type with the specified name.  \n`static [HousePortal](HousePortal.html \"enum in org.dreambot.api.methods.walking.web.node.impl.teleports.poh\")[]` | `values()` |  Returns an array containing the constants of this enum type, in the order they are declared.  \n      * ### Methods inherited from class java.lang.Enum\n\n`compareTo, equals, getDeclaringClass, hashCode, name, ordinal, toString,\nvalueOf`\n\n      * ### Methods inherited from class java.lang.Object\n\n`getClass, notify, notifyAll, wait, wait, wait`\n\n  *     * ### Enum Constant Detail\n\n      * #### ARCEUUS_LIBRARY\n            \n                        public static final [HousePortal](HousePortal.html \"enum in org.dreambot.api.methods.walking.web.node.impl.teleports.poh\") ARCEUUS_LIBRARY\n\n      * #### DRAYNOR_MANOR\n            \n                        public static final [HousePortal](HousePortal.html \"enum in org.dreambot.api.methods.walking.web.node.impl.teleports.poh\") DRAYNOR_MANOR\n\n      * #### BATTLEFRONT\n            \n                        public static final [HousePortal](HousePortal.html \"enum in org.dreambot.api.methods.walking.web.node.impl.teleports.poh\") BATTLEFRONT\n\n      * #### VARROCK\n            \n                        public static final [HousePortal](HousePortal.html \"enum in org.dreambot.api.methods.walking.web.node.impl.teleports.poh\") VARROCK\n\n      * #### MIND_ALTAR\n            \n                        public static final [HousePortal](HousePortal.html \"enum in org.dreambot.api.methods.walking.web.node.impl.teleports.poh\") MIND_ALTAR\n\n      * #### LUMBRIDGE\n            \n                        public static final [HousePortal](HousePortal.html \"enum in org.dreambot.api.methods.walking.web.node.impl.teleports.poh\") LUMBRIDGE\n\n      * #### FALADOR\n            \n                        public static final [HousePortal](HousePortal.html \"enum in org.dreambot.api.methods.walking.web.node.impl.teleports.poh\") FALADOR\n\n      * #### SALVE_GRAVEYARD\n            \n                        public static final [HousePortal](HousePortal.html \"enum in org.dreambot.api.methods.walking.web.node.impl.teleports.poh\") SALVE_GRAVEYARD\n\n      * #### CAMELOT\n            \n                        public static final [HousePortal](HousePortal.html \"enum in org.dreambot.api.methods.walking.web.node.impl.teleports.poh\") CAMELOT\n\n      * #### FENKENSTRAINS_CASTLE\n            \n                        public static final [HousePortal](HousePortal.html \"enum in org.dreambot.api.methods.walking.web.node.impl.teleports.poh\") FENKENSTRAINS_CASTLE\n\n      * #### EAST_ARDOUGNE\n            \n                        public static final [HousePortal](HousePortal.html \"enum in org.dreambot.api.methods.walking.web.node.impl.teleports.poh\") EAST_ARDOUGNE\n\n      * #### SENNTISTEN\n            \n                        public static final [HousePortal](HousePortal.html \"enum in org.dreambot.api.methods.walking.web.node.impl.teleports.poh\") SENNTISTEN\n\n      * #### WEST_ARDOUGNE\n            \n                        public static final [HousePortal](HousePortal.html \"enum in org.dreambot.api.methods.walking.web.node.impl.teleports.poh\") WEST_ARDOUGNE\n\n      * #### MARIM\n            \n                        public static final [HousePortal](HousePortal.html \"enum in org.dreambot.api.methods.walking.web.node.impl.teleports.poh\") MARIM\n\n      * #### HARMONY_ISLAND\n            \n                        public static final [HousePortal](HousePortal.html \"enum in org.dreambot.api.methods.walking.web.node.impl.teleports.poh\") HARMONY_ISLAND\n\n      * #### KHARYRLL\n            \n                        public static final [HousePortal](HousePortal.html \"enum in org.dreambot.api.methods.walking.web.node.impl.teleports.poh\") KHARYRLL\n\n      * #### LUNAR_ISLE\n            \n                        public static final [HousePortal](HousePortal.html \"enum in org.dreambot.api.methods.walking.web.node.impl.teleports.poh\") LUNAR_ISLE\n\n      * #### KOUREND\n            \n                        public static final [HousePortal](HousePortal.html \"enum in org.dreambot.api.methods.walking.web.node.impl.teleports.poh\") KOUREND\n\n      * #### CEMETERY\n            \n                        public static final [HousePortal](HousePortal.html \"enum in org.dreambot.api.methods.walking.web.node.impl.teleports.poh\") CEMETERY\n\n      * #### WATERBIRTH_ISLAND\n            \n                        public static final [HousePortal](HousePortal.html \"enum in org.dreambot.api.methods.walking.web.node.impl.teleports.poh\") WATERBIRTH_ISLAND\n\n      * #### BARROWS\n            \n                        public static final [HousePortal](HousePortal.html \"enum in org.dreambot.api.methods.walking.web.node.impl.teleports.poh\") BARROWS\n\n      * #### CARRALLANGAR\n            \n                        @Deprecated\n            public static final [HousePortal](HousePortal.html \"enum in org.dreambot.api.methods.walking.web.node.impl.teleports.poh\") CARRALLANGAR\n\nDeprecated.\n\n      * #### CARRALLANGER\n            \n                        public static final [HousePortal](HousePortal.html \"enum in org.dreambot.api.methods.walking.web.node.impl.teleports.poh\") CARRALLANGER\n\n      * #### FISHING_GUILD\n            \n                        public static final [HousePortal](HousePortal.html \"enum in org.dreambot.api.methods.walking.web.node.impl.teleports.poh\") FISHING_GUILD\n\n      * #### CATHERBY\n            \n                        public static final [HousePortal](HousePortal.html \"enum in org.dreambot.api.methods.walking.web.node.impl.teleports.poh\") CATHERBY\n\n      * #### ANNAKARL\n            \n                        public static final [HousePortal](HousePortal.html \"enum in org.dreambot.api.methods.walking.web.node.impl.teleports.poh\") ANNAKARL\n\n      * #### APE_ATOLL_DUNGEON\n            \n                        public static final [HousePortal](HousePortal.html \"enum in org.dreambot.api.methods.walking.web.node.impl.teleports.poh\") APE_ATOLL_DUNGEON\n\n      * #### GHORROCK\n            \n                        public static final [HousePortal](HousePortal.html \"enum in org.dreambot.api.methods.walking.web.node.impl.teleports.poh\") GHORROCK\n\n      * #### TROLL_STRONGHOLD\n            \n                        public static final [HousePortal](HousePortal.html \"enum in org.dreambot.api.methods.walking.web.node.impl.teleports.poh\") TROLL_STRONGHOLD\n\n    * ### Method Detail\n\n      * #### values\n            \n                        public static [HousePortal](HousePortal.html \"enum in org.dreambot.api.methods.walking.web.node.impl.teleports.poh\")[] values()\n\nReturns an array containing the constants of this enum type, in the order they\nare declared. This method may be used to iterate over the constants as\nfollows:\n\n            \n                        for (HousePortal c : HousePortal.values())\n                System.out.println(c);\n            \n\nReturns:\n\n    an array containing the constants of this enum type, in the order they are declared\n      * #### valueOf\n            \n                        public static [HousePortal](HousePortal.html \"enum in org.dreambot.api.methods.walking.web.node.impl.teleports.poh\") valueOf\u200b(java.lang.String name)\n\nReturns the enum constant of this type with the specified name. The string\nmust match _exactly_ an identifier used to declare an enum constant in this\ntype. (Extraneous whitespace characters are not permitted.)\n\nParameters:\n\n    `name` \\- the name of the enum constant to be returned.\nReturns:\n\n    the enum constant with the specified name\nThrows:\n\n    `java.lang.IllegalArgumentException` \\- if this enum type has no constant with the specified name\n    `java.lang.NullPointerException` \\- if the argument is null\n      * #### getX\n            \n                        public int getX()\n\nSpecified by:\n\n    `[getX](../Teleport.html#getX\\(\\))` in interface `[Teleport](../Teleport.html \"interface in org.dreambot.api.methods.walking.web.node.impl.teleports\")`\n      * #### getY\n            \n                        public int getY()\n\nSpecified by:\n\n    `[getY](../Teleport.html#getY\\(\\))` in interface `[Teleport](../Teleport.html \"interface in org.dreambot.api.methods.walking.web.node.impl.teleports\")`\n      * #### getZ\n            \n                        public int getZ()\n\nSpecified by:\n\n    `[getZ](../Teleport.html#getZ\\(\\))` in interface `[Teleport](../Teleport.html \"interface in org.dreambot.api.methods.walking.web.node.impl.teleports\")`\n      * #### hasRequirements\n            \n                        public boolean hasRequirements()\n\nSpecified by:\n\n    `[hasRequirements](../Teleport.html#hasRequirements\\(\\))` in interface `[Teleport](../Teleport.html \"interface in org.dreambot.api.methods.walking.web.node.impl.teleports\")`\n      * #### execute\n            \n                        public boolean execute()\n\nSpecified by:\n\n    `[execute](../Teleport.html#execute\\(\\))` in interface `[Teleport](../Teleport.html \"interface in org.dreambot.api.methods.walking.web.node.impl.teleports\")`\n      * #### getDestination\n            \n                        public [Tile](../../../../../../map/Tile.html \"class in org.dreambot.api.methods.map\") getDestination()\n\n      * #### getPortalName\n            \n                        public java.lang.String getPortalName()\n\n      * #### getNexusTarget\n            \n                        public java.lang.String getNexusTarget()\n\nSkip navigation links\n\n  * [Overview](../../../../../../../../../../overview-summary.html)\n  * [Package](package-summary.html)\n  * Class\n  * [Tree](package-tree.html)\n  * [Deprecated](../../../../../../../../../../deprecated-list.html)\n  * [Index](../../../../../../../../../../index-all.html)\n  * [Help](../../../../../../../../../../help-doc.html)\n\n  * [Frames](../../../../../../../../../../index.html?org/dreambot/api/methods/walking/web/node/impl/teleports/poh/HousePortal.html)\n  * [No Frames](HousePortal.html)\n\n  * [All Classes](../../../../../../../../../../allclasses-noframe.html)\n\nJavaScript is disabled on your browser.\n\n  * Summary: \n  * Nested | \n  * Enum Constants | \n  * Field | \n  * Method\n\n  * Detail: \n  * Enum Constants | \n  * Field | \n  * Method"
    }
  ],
  "extraction_fallback_used": true
}