{
  "name": "ShiftKeys",
  "full_name": "org.dreambot.api.utilities.ShiftKeys",
  "full_url": "https://dreambot.org/javadocs/org/dreambot/api/utilities/ShiftKeys.html",
  "type": "enum",
  "package": "org.dreambot.api.utilities",
  "description": "Returns the enum constant of this type with the specified name.",
  "page_structure": {
    "type": "enum",
    "format_version": "old",
    "has_summary_tables": true,
    "has_detail_sections": true,
    "has_nested_classes": false
  },
  "inheritance": [
    "ShiftKeys"
  ],
  "interfaces_implemented": [],
  "nested_classes": [],
  "methods": [
    {
      "name": "ShiftKeys",
      "return_type": "ShiftKeys[]",
      "modifiers": [
        "static"
      ],
      "description": "Returns an array containing the constants of this enum type, in the order they are declared.",
      "deprecated": false
    },
    {
      "name": "values",
      "signature": "public static ShiftKeys[] values()",
      "return_type": "",
      "modifiers": [],
      "description": "Returns an array containing the constants of this enum type, in the order they are declared. This method may be used to iterate over the constants as follows: for (ShiftKeys c : ShiftKeys.values()) System.out.println(c);",
      "parameters": [],
      "return": {
        "type": "",
        "description": ""
      },
      "deprecated": false
    },
    {
      "name": "valueOf",
      "signature": "public static ShiftKeys valueOf\u200b(java.lang.String name)",
      "return_type": "",
      "modifiers": [],
      "description": "Returns the enum constant of this type with the specified name. The string must match exactly an identifier used to declare an enum constant in this type. (Extraneous whitespace characters are not permitted.)",
      "parameters": [],
      "return": {
        "type": "",
        "description": ""
      },
      "deprecated": false
    },
    {
      "name": "getKey",
      "signature": "public static ShiftKeys getKey\u200b(char character)",
      "return_type": "",
      "modifiers": [],
      "description": "",
      "parameters": [],
      "return": {
        "type": "",
        "description": ""
      },
      "deprecated": false
    },
    {
      "name": "contains",
      "signature": "public static boolean contains\u200b(char character)",
      "return_type": "",
      "modifiers": [],
      "description": "",
      "parameters": [],
      "return": {
        "type": "",
        "description": ""
      },
      "deprecated": false
    },
    {
      "name": "getCharacter",
      "signature": "public char getCharacter()",
      "return_type": "",
      "modifiers": [],
      "description": "",
      "parameters": [],
      "return": {
        "type": "",
        "description": ""
      },
      "deprecated": false
    },
    {
      "name": "getCode",
      "signature": "public int getCode()",
      "return_type": "",
      "modifiers": [],
      "description": "",
      "parameters": [],
      "return": {
        "type": "",
        "description": ""
      },
      "deprecated": false
    }
  ],
  "fields": [],
  "constructors": [],
  "enum_constants": [
    {
      "name": "Enum",
      "description": "Constant Summary\n\nEnum Constants  Enum Constant | Description  \n---|---  \n`ADDITION` |    \n`AMPERSAND` |    \n`AMPERSAT` |    \n`ANGLE_BRACKET_CLOSE` |    \n`ANGLE_BRACKET_OPEN` |    \n`ASTERISK` |    \n`BRACE_CLOSE` |    \n`BRACE_OPEN` |    \n`CIRCUMFLEX` |    \n`COLON` |    \n`DASH` |    \n`DOLLAR_SIGN` |    \n`EURO` |    \n`EXCLAMATION_MARK` |    \n`OCTOTHORPE` |    \n`PARENTHESIS_CLOSE` |    \n`PARENTHESIS_OPEN` |    \n`PERCENT` |    \n`POUNDS_STERLING` |    \n`QUESTION_MARK` |    \n`QUOTATION_MARK` |    \n`SHEFFER_STROKE` |    \n`TILDE` |    \n    * ### Method Summary\n\nAll Methods [Static Methods](javascript:show\\(1\\);) [Instance Methods](javascript:show\\(2\\);) [Concrete Methods](javascript:show\\(8\\);)  Modifier and Type | Method | Description  \n---|---|---  \n`static boolean` | `contains\u200b(char character)` |    \n`char` | `getCharacter()` |    \n`int` | `getCode()` |    \n`static [ShiftKeys](ShiftKeys.html \"enum in org.dreambot.api.utilities\")` | `getKey\u200b(char character)` |    \n`static [ShiftKeys](ShiftKeys.html \"enum in org.dreambot.api.utilities\")` | `valueOf\u200b(java.lang.String name)` |  Returns the enum constant of this type with the specified name.  \n`static [ShiftKeys](ShiftKeys.html \"enum in org.dreambot.api.utilities\")[]` | `values()` |  Returns an array containing the constants of this enum type, in the order they are declared.  \n      * ### Methods inherited from class java.lang.Enum\n\n`compareTo, equals, getDeclaringClass, hashCode, name, ordinal, toString,\nvalueOf`\n\n      * ### Methods inherited from class java.lang.Object\n\n`getClass, notify, notifyAll, wait, wait, wait`\n\n  *     * ### Enum Constant Detail\n\n      * #### EXCLAMATION_MARK\n            \n                        public static final [ShiftKeys](ShiftKeys.html \"enum in org.dreambot.api.utilities\") EXCLAMATION_MARK\n\n      * #### AMPERSAT\n            \n                        public static final [ShiftKeys](ShiftKeys.html \"enum in org.dreambot.api.utilities\") AMPERSAT\n\n      * #### OCTOTHORPE\n            \n                        public static final [ShiftKeys](ShiftKeys.html \"enum in org.dreambot.api.utilities\") OCTOTHORPE\n\n      * #### DOLLAR_SIGN\n            \n                        public static final [ShiftKeys](ShiftKeys.html \"enum in org.dreambot.api.utilities\") DOLLAR_SIGN\n\n      * #### POUNDS_STERLING\n            \n                        public static final [ShiftKeys](ShiftKeys.html \"enum in org.dreambot.api.utilities\") POUNDS_STERLING\n\n      * #### EURO\n            \n                        public static final [ShiftKeys](ShiftKeys.html \"enum in org.dreambot.api.utilities\") EURO\n\n      * #### PERCENT\n            \n                        public static final [ShiftKeys](ShiftKeys.html \"enum in org.dreambot.api.utilities\") PERCENT\n\n      * #### CIRCUMFLEX\n            \n                        public static final [ShiftKeys](ShiftKeys.html \"enum in org.dreambot.api.utilities\") CIRCUMFLEX\n\n      * #### AMPERSAND\n            \n                        public static final [ShiftKeys](ShiftKeys.html \"enum in org.dreambot.api.utilities\") AMPERSAND\n\n      * #### ASTERISK\n            \n                        public static final [ShiftKeys](ShiftKeys.html \"enum in org.dreambot.api.utilities\") ASTERISK\n\n      * #### PARENTHESIS_OPEN\n            \n                        public static final [ShiftKeys](ShiftKeys.html \"enum in org.dreambot.api.utilities\") PARENTHESIS_OPEN\n\n      * #### PARENTHESIS_CLOSE\n            \n                        public static final [ShiftKeys](ShiftKeys.html \"enum in org.dreambot.api.utilities\") PARENTHESIS_CLOSE\n\n      * #### DASH\n            \n                        public static final [ShiftKeys](ShiftKeys.html \"enum in org.dreambot.api.utilities\") DASH\n\n      * #### ADDITION\n            \n                        public static final [ShiftKeys](ShiftKeys.html \"enum in org.dreambot.api.utilities\") ADDITION\n\n      * #### BRACE_OPEN\n            \n                        public static final [ShiftKeys](ShiftKeys.html \"enum in org.dreambot.api.utilities\") BRACE_OPEN\n\n      * #### BRACE_CLOSE\n            \n                        public static final [ShiftKeys](ShiftKeys.html \"enum in org.dreambot.api.utilities\") BRACE_CLOSE\n\n      * #### COLON\n            \n                        public static final [ShiftKeys](ShiftKeys.html \"enum in org.dreambot.api.utilities\") COLON\n\n      * #### QUOTATION_MARK\n            \n                        public static final [ShiftKeys](ShiftKeys.html \"enum in org.dreambot.api.utilities\") QUOTATION_MARK\n\n      * #### ANGLE_BRACKET_OPEN\n            \n                        public static final [ShiftKeys](ShiftKeys.html \"enum in org.dreambot.api.utilities\") ANGLE_BRACKET_OPEN\n\n      * #### ANGLE_BRACKET_CLOSE\n            \n                        public static final [ShiftKeys](ShiftKeys.html \"enum in org.dreambot.api.utilities\") ANGLE_BRACKET_CLOSE\n\n      * #### QUESTION_MARK\n            \n                        public static final [ShiftKeys](ShiftKeys.html \"enum in org.dreambot.api.utilities\") QUESTION_MARK\n\n      * #### TILDE\n            \n                        public static final [ShiftKeys](ShiftKeys.html \"enum in org.dreambot.api.utilities\") TILDE\n\n      * #### SHEFFER_STROKE\n            \n                        public static final [ShiftKeys](ShiftKeys.html \"enum in org.dreambot.api.utilities\") SHEFFER_STROKE\n\n    * ### Method Detail\n\n      * #### values\n            \n                        public static [ShiftKeys](ShiftKeys.html \"enum in org.dreambot.api.utilities\")[] values()\n\nReturns an array containing the constants of this enum type, in the order they\nare declared. This method may be used to iterate over the constants as\nfollows:\n\n            \n                        for (ShiftKeys c : ShiftKeys.values())\n                System.out.println(c);\n            \n\nReturns:\n\n    an array containing the constants of this enum type, in the order they are declared\n      * #### valueOf\n            \n                        public static [ShiftKeys](ShiftKeys.html \"enum in org.dreambot.api.utilities\") valueOf\u200b(java.lang.String name)\n\nReturns the enum constant of this type with the specified name. The string\nmust match _exactly_ an identifier used to declare an enum constant in this\ntype. (Extraneous whitespace characters are not permitted.)\n\nParameters:\n\n    `name` \\- the name of the enum constant to be returned.\nReturns:\n\n    the enum constant with the specified name\nThrows:\n\n    `java.lang.IllegalArgumentException` \\- if this enum type has no constant with the specified name\n    `java.lang.NullPointerException` \\- if the argument is null\n      * #### getKey\n            \n                        public static [ShiftKeys](ShiftKeys.html \"enum in org.dreambot.api.utilities\") getKey\u200b(char character)\n\n      * #### contains\n            \n                        public static boolean contains\u200b(char character)\n\n      * #### getCharacter\n            \n                        public char getCharacter()\n\n      * #### getCode\n            \n                        public int getCode()\n\nSkip navigation links\n\n  * [Overview](../../../../overview-summary.html)\n  * [Package](package-summary.html)\n  * Class\n  * [Tree](package-tree.html)\n  * [Deprecated](../../../../deprecated-list.html)\n  * [Index](../../../../index-all.html)\n  * [Help](../../../../help-doc.html)\n\n  * [Frames](../../../../index.html?org/dreambot/api/utilities/ShiftKeys.html)\n  * [No Frames](ShiftKeys.html)\n\n  * [All Classes](../../../../allclasses-noframe.html)\n\nJavaScript is disabled on your browser.\n\n  * Summary: \n  * Nested | \n  * Enum Constants | \n  * Field | \n  * Method\n\n  * Detail: \n  * Enum Constants | \n  * Field | \n  * Method"
    }
  ],
  "extraction_fallback_used": true
}