{
  "name": "BankTab",
  "full_name": "org.dreambot.api.methods.container.impl.bank.BankTab",
  "full_url": "https://dreambot.org/javadocs/org/dreambot/api/methods/container/impl/bank/BankTab.html",
  "type": "enum",
  "package": "org.dreambot.api.methods.container.impl.bank",
  "description": "Enum holding Bank Tab information such as configs and widget ID's",
  "page_structure": {
    "type": "enum",
    "format_version": "old",
    "has_summary_tables": true,
    "has_detail_sections": true,
    "has_nested_classes": false
  },
  "inheritance": [
    "BankTab"
  ],
  "interfaces_implemented": [],
  "nested_classes": [],
  "methods": [
    {
      "name": "BankTab",
      "return_type": "BankTab[]",
      "modifiers": [
        "static"
      ],
      "description": "Returns an array containing the constants of this enum type, in the order they are declared.",
      "deprecated": false
    },
    {
      "name": "WidgetChild",
      "return_type": "WidgetChild",
      "modifiers": [
        "@Nullable"
      ],
      "description": "",
      "deprecated": false
    },
    {
      "name": "values",
      "signature": "public static BankTab[] values()",
      "return_type": "",
      "modifiers": [],
      "description": "Returns an array containing the constants of this enum type, in the order they are declared. This method may be used to iterate over the constants as follows: for (BankTab c : BankTab.values()) System.out.println(c);",
      "parameters": [],
      "return": {
        "type": "",
        "description": ""
      },
      "deprecated": false
    },
    {
      "name": "valueOf",
      "signature": "public static BankTab valueOf\u200b(java.lang.String name)",
      "return_type": "",
      "modifiers": [],
      "description": "Returns the enum constant of this type with the specified name. The string must match exactly an identifier used to declare an enum constant in this type. (Extraneous whitespace characters are not permitted.)",
      "parameters": [],
      "return": {
        "type": "",
        "description": ""
      },
      "deprecated": false
    },
    {
      "name": "getID",
      "signature": "public int getID()",
      "return_type": "",
      "modifiers": [],
      "description": "Gets the ID of the BankTab",
      "parameters": [],
      "return": {
        "type": "",
        "description": ""
      },
      "deprecated": false
    },
    {
      "name": "getChild",
      "signature": "public int getChild()",
      "return_type": "",
      "modifiers": [],
      "description": "Gets the grand child WidgetChild ID of the BankTab",
      "parameters": [],
      "return": {
        "type": "",
        "description": ""
      },
      "deprecated": false
    },
    {
      "name": "getConfig",
      "signature": "public int getConfig()",
      "return_type": "",
      "modifiers": [],
      "description": "Gets the config value for the BankTab",
      "parameters": [],
      "return": {
        "type": "",
        "description": ""
      },
      "deprecated": false
    },
    {
      "name": "getWidgetChild",
      "signature": "public @Nullable WidgetChild getWidgetChild()",
      "return_type": "",
      "modifiers": [],
      "description": "",
      "parameters": [],
      "return": {
        "type": "",
        "description": ""
      },
      "deprecated": false
    },
    {
      "name": "isOpen",
      "signature": "public boolean isOpen()",
      "return_type": "",
      "modifiers": [],
      "description": "",
      "parameters": [],
      "return": {
        "type": "",
        "description": ""
      },
      "deprecated": false
    },
    {
      "name": "count",
      "signature": "public int count()",
      "return_type": "",
      "modifiers": [],
      "description": "",
      "parameters": [],
      "return": {
        "type": "",
        "description": ""
      },
      "deprecated": false
    },
    {
      "name": "open",
      "signature": "public boolean open()",
      "return_type": "",
      "modifiers": [],
      "description": "",
      "parameters": [],
      "return": {
        "type": "",
        "description": ""
      },
      "deprecated": false
    },
    {
      "name": "getOpen",
      "signature": "public static @Nullable BankTab getOpen()",
      "return_type": "",
      "modifiers": [],
      "description": "",
      "parameters": [],
      "return": {
        "type": "",
        "description": ""
      },
      "deprecated": false
    }
  ],
  "fields": [],
  "constructors": [],
  "enum_constants": [
    {
      "name": "Enum",
      "description": "Constant Summary\n\nEnum Constants  Enum Constant | Description  \n---|---  \n`EIGHTH_TAB` |    \n`FIFTH_TAB` |    \n`FIRST_TAB` |    \n`FOURTH_TAB` |    \n`MAIN_TAB` |    \n`NINTH_TAB` |    \n`SECOND_TAB` |    \n`SEVENTH_TAB` |    \n`SIXTH_TAB` |    \n`THIRD_TAB` |    \n    * ### Method Summary\n\nAll Methods [Static Methods](javascript:show\\(1\\);) [Instance Methods](javascript:show\\(2\\);) [Concrete Methods](javascript:show\\(8\\);)  Modifier and Type | Method | Description  \n---|---|---  \n`int` | `count()` |    \n`int` | `getChild()` |  Gets the grand child WidgetChild ID of the BankTab  \n`int` | `getConfig()` |  Gets the config value for the BankTab  \n`int` | `getID()` |  Gets the ID of the BankTab  \n`static @Nullable [BankTab](BankTab.html \"enum in org.dreambot.api.methods.container.impl.bank\")` | `getOpen()` |    \n`@Nullable [WidgetChild](../../../../wrappers/widgets/WidgetChild.html \"class in org.dreambot.api.wrappers.widgets\")` | `getWidgetChild()` |    \n`boolean` | `isOpen()` |    \n`boolean` | `open()` |    \n`static [BankTab](BankTab.html \"enum in org.dreambot.api.methods.container.impl.bank\")` | `valueOf\u200b(java.lang.String name)` |  Returns the enum constant of this type with the specified name.  \n`static [BankTab](BankTab.html \"enum in org.dreambot.api.methods.container.impl.bank\")[]` | `values()` |  Returns an array containing the constants of this enum type, in the order they are declared.  \n      * ### Methods inherited from class java.lang.Enum\n\n`compareTo, equals, getDeclaringClass, hashCode, name, ordinal, toString,\nvalueOf`\n\n      * ### Methods inherited from class java.lang.Object\n\n`getClass, notify, notifyAll, wait, wait, wait`\n\n  *     * ### Enum Constant Detail\n\n      * #### MAIN_TAB\n            \n                        public static final [BankTab](BankTab.html \"enum in org.dreambot.api.methods.container.impl.bank\") MAIN_TAB\n\n      * #### FIRST_TAB\n            \n                        public static final [BankTab](BankTab.html \"enum in org.dreambot.api.methods.container.impl.bank\") FIRST_TAB\n\n      * #### SECOND_TAB\n            \n                        public static final [BankTab](BankTab.html \"enum in org.dreambot.api.methods.container.impl.bank\") SECOND_TAB\n\n      * #### THIRD_TAB\n            \n                        public static final [BankTab](BankTab.html \"enum in org.dreambot.api.methods.container.impl.bank\") THIRD_TAB\n\n      * #### FOURTH_TAB\n            \n                        public static final [BankTab](BankTab.html \"enum in org.dreambot.api.methods.container.impl.bank\") FOURTH_TAB\n\n      * #### FIFTH_TAB\n            \n                        public static final [BankTab](BankTab.html \"enum in org.dreambot.api.methods.container.impl.bank\") FIFTH_TAB\n\n      * #### SIXTH_TAB\n            \n                        public static final [BankTab](BankTab.html \"enum in org.dreambot.api.methods.container.impl.bank\") SIXTH_TAB\n\n      * #### SEVENTH_TAB\n            \n                        public static final [BankTab](BankTab.html \"enum in org.dreambot.api.methods.container.impl.bank\") SEVENTH_TAB\n\n      * #### EIGHTH_TAB\n            \n                        public static final [BankTab](BankTab.html \"enum in org.dreambot.api.methods.container.impl.bank\") EIGHTH_TAB\n\n      * #### NINTH_TAB\n            \n                        public static final [BankTab](BankTab.html \"enum in org.dreambot.api.methods.container.impl.bank\") NINTH_TAB\n\n    * ### Method Detail\n\n      * #### values\n            \n                        public static [BankTab](BankTab.html \"enum in org.dreambot.api.methods.container.impl.bank\")[] values()\n\nReturns an array containing the constants of this enum type, in the order they\nare declared. This method may be used to iterate over the constants as\nfollows:\n\n            \n                        for (BankTab c : BankTab.values())\n                System.out.println(c);\n            \n\nReturns:\n\n    an array containing the constants of this enum type, in the order they are declared\n      * #### valueOf\n            \n                        public static [BankTab](BankTab.html \"enum in org.dreambot.api.methods.container.impl.bank\") valueOf\u200b(java.lang.String name)\n\nReturns the enum constant of this type with the specified name. The string\nmust match _exactly_ an identifier used to declare an enum constant in this\ntype. (Extraneous whitespace characters are not permitted.)\n\nParameters:\n\n    `name` \\- the name of the enum constant to be returned.\nReturns:\n\n    the enum constant with the specified name\nThrows:\n\n    `java.lang.IllegalArgumentException` \\- if this enum type has no constant with the specified name\n    `java.lang.NullPointerException` \\- if the argument is null\n      * #### getID\n            \n                        public int getID()\n\nGets the ID of the BankTab\n\nReturns:\n\n    ID of the BankTab\n      * #### getChild\n            \n                        public int getChild()\n\nGets the grand child WidgetChild ID of the BankTab\n\nReturns:\n\n    Id of the grand child of the bank tab\n      * #### getConfig\n            \n                        public int getConfig()\n\nGets the config value for the BankTab\n\nReturns:\n\n    Integer value of the config for the BankTab\n      * #### getWidgetChild\n            \n                        public @Nullable [WidgetChild](../../../../wrappers/widgets/WidgetChild.html \"class in org.dreambot.api.wrappers.widgets\") getWidgetChild()\n\n      * #### isOpen\n            \n                        public boolean isOpen()\n\n      * #### count\n            \n                        public int count()\n\n      * #### open\n            \n                        public boolean open()\n\n      * #### getOpen\n            \n                        public static @Nullable [BankTab](BankTab.html \"enum in org.dreambot.api.methods.container.impl.bank\") getOpen()\n\nSkip navigation links\n\n  * [Overview](../../../../../../../overview-summary.html)\n  * [Package](package-summary.html)\n  * Class\n  * [Tree](package-tree.html)\n  * [Deprecated](../../../../../../../deprecated-list.html)\n  * [Index](../../../../../../../index-all.html)\n  * [Help](../../../../../../../help-doc.html)\n\n  * [Frames](../../../../../../../index.html?org/dreambot/api/methods/container/impl/bank/BankTab.html)\n  * [No Frames](BankTab.html)\n\n  * [All Classes](../../../../../../../allclasses-noframe.html)\n\nJavaScript is disabled on your browser.\n\n  * Summary: \n  * Nested | \n  * Enum Constants | \n  * Field | \n  * Method\n\n  * Detail: \n  * Enum Constants | \n  * Field | \n  * Method"
    }
  ],
  "extraction_fallback_used": true
}