{
  "name": "Tab",
  "full_name": "org.dreambot.api.methods.tabs.Tab",
  "full_url": "https://dreambot.org/javadocs/org/dreambot/api/methods/tabs/Tab.html",
  "type": "enum",
  "package": "org.dreambot.api.methods.tabs",
  "description": "Returns the enum constant of this type with the specified name.",
  "page_structure": {
    "type": "enum",
    "format_version": "old",
    "has_summary_tables": true,
    "has_detail_sections": true,
    "has_nested_classes": false
  },
  "inheritance": [
    "Tab"
  ],
  "interfaces_implemented": [],
  "nested_classes": [],
  "methods": [
    {
      "name": "Tab",
      "return_type": "Tab[]",
      "modifiers": [
        "static"
      ],
      "description": "Returns an array containing the constants of this enum type, in the order they are declared.",
      "deprecated": false
    },
    {
      "name": "WidgetChild",
      "return_type": "WidgetChild",
      "modifiers": [
        "@Nullable"
      ],
      "description": "",
      "deprecated": false
    },
    {
      "name": "values",
      "signature": "public static Tab[] values()",
      "return_type": "",
      "modifiers": [],
      "description": "Returns an array containing the constants of this enum type, in the order they are declared. This method may be used to iterate over the constants as follows: for (Tab c : Tab.values()) System.out.println(c);",
      "parameters": [],
      "return": {
        "type": "",
        "description": ""
      },
      "deprecated": false
    },
    {
      "name": "valueOf",
      "signature": "public static Tab valueOf\u200b(java.lang.String name)",
      "return_type": "",
      "modifiers": [],
      "description": "Returns the enum constant of this type with the specified name. The string must match exactly an identifier used to declare an enum constant in this type. (Extraneous whitespace characters are not permitted.)",
      "parameters": [],
      "return": {
        "type": "",
        "description": ""
      },
      "deprecated": false
    },
    {
      "name": "get",
      "signature": "public @Nullable Tab get\u200b(int id)",
      "return_type": "",
      "modifiers": [],
      "description": "",
      "parameters": [],
      "return": {
        "type": "",
        "description": ""
      },
      "deprecated": false
    },
    {
      "name": "getWidgetChild",
      "signature": "public @Nullable WidgetChild getWidgetChild()",
      "return_type": "",
      "modifiers": [],
      "description": "",
      "parameters": [],
      "return": {
        "type": "",
        "description": ""
      },
      "deprecated": false
    },
    {
      "name": "getId",
      "signature": "public int getId()",
      "return_type": "",
      "modifiers": [],
      "description": "",
      "parameters": [],
      "return": {
        "type": "",
        "description": ""
      },
      "deprecated": false
    },
    {
      "name": "getParentId",
      "signature": "public int getParentId()",
      "return_type": "",
      "modifiers": [],
      "description": "",
      "parameters": [],
      "return": {
        "type": "",
        "description": ""
      },
      "deprecated": false
    },
    {
      "name": "getIndex",
      "signature": "public int getIndex()",
      "return_type": "",
      "modifiers": [],
      "description": "",
      "parameters": [],
      "return": {
        "type": "",
        "description": ""
      },
      "deprecated": false
    },
    {
      "name": "getKeyEvent",
      "signature": "public int getKeyEvent()",
      "return_type": "",
      "modifiers": [],
      "description": "",
      "parameters": [],
      "return": {
        "type": "",
        "description": ""
      },
      "deprecated": false
    },
    {
      "name": "isDisabled",
      "signature": "public boolean isDisabled()",
      "return_type": "",
      "modifiers": [],
      "description": "",
      "parameters": [],
      "return": {
        "type": "",
        "description": ""
      },
      "deprecated": false
    },
    {
      "name": "isOpen",
      "signature": "public boolean isOpen()",
      "return_type": "",
      "modifiers": [],
      "description": "",
      "parameters": [],
      "return": {
        "type": "",
        "description": ""
      },
      "deprecated": false
    },
    {
      "name": "open",
      "signature": "public boolean open()",
      "return_type": "",
      "modifiers": [],
      "description": "",
      "parameters": [],
      "return": {
        "type": "",
        "description": ""
      },
      "deprecated": false
    },
    {
      "name": "toString",
      "signature": "public java.lang.String toString()",
      "return_type": "",
      "modifiers": [],
      "description": "",
      "parameters": [],
      "return": {
        "type": "",
        "description": ""
      },
      "deprecated": false
    }
  ],
  "fields": [],
  "constructors": [],
  "enum_constants": [
    {
      "name": "Enum",
      "description": "Constant Summary\n\nEnum Constants  Enum Constant | Description  \n---|---  \n`ACCOUNT_MANAGEMENT` |    \n`CLAN` |    \n`COMBAT` |    \n`EMOTES` |    \n`EQUIPMENT` |    \n`FRIENDS` |    \n`INVENTORY` |    \n`LOGOUT` |    \n`MAGIC` |    \n`MUSIC` |    \n`OPTIONS` |    \n`PRAYER` |    \n`QUEST` |    \n`SKILLS` |    \n    * ### Method Summary\n\nAll Methods [Static Methods](javascript:show\\(1\\);) [Instance Methods](javascript:show\\(2\\);) [Concrete Methods](javascript:show\\(8\\);)  Modifier and Type | Method | Description  \n---|---|---  \n`@Nullable [Tab](Tab.html \"enum in org.dreambot.api.methods.tabs\")` | `get\u200b(int id)` |    \n`int` | `getId()` |    \n`int` | `getIndex()` |    \n`int` | `getKeyEvent()` |    \n`int` | `getParentId()` |    \n`@Nullable [WidgetChild](../../wrappers/widgets/WidgetChild.html \"class in org.dreambot.api.wrappers.widgets\")` | `getWidgetChild()` |    \n`boolean` | `isDisabled()` |    \n`boolean` | `isOpen()` |    \n`boolean` | `open()` |    \n`java.lang.String` | `toString()` |    \n`static [Tab](Tab.html \"enum in org.dreambot.api.methods.tabs\")` | `valueOf\u200b(java.lang.String name)` |  Returns the enum constant of this type with the specified name.  \n`static [Tab](Tab.html \"enum in org.dreambot.api.methods.tabs\")[]` | `values()` |  Returns an array containing the constants of this enum type, in the order they are declared.  \n      * ### Methods inherited from class java.lang.Enum\n\n`compareTo, equals, getDeclaringClass, hashCode, name, ordinal, valueOf`\n\n      * ### Methods inherited from class java.lang.Object\n\n`getClass, notify, notifyAll, wait, wait, wait`\n\n  *     * ### Enum Constant Detail\n\n      * #### CLAN\n            \n                        public static final [Tab](Tab.html \"enum in org.dreambot.api.methods.tabs\") CLAN\n\n      * #### FRIENDS\n            \n                        public static final [Tab](Tab.html \"enum in org.dreambot.api.methods.tabs\") FRIENDS\n\n      * #### ACCOUNT_MANAGEMENT\n            \n                        public static final [Tab](Tab.html \"enum in org.dreambot.api.methods.tabs\") ACCOUNT_MANAGEMENT\n\n      * #### LOGOUT\n            \n                        public static final [Tab](Tab.html \"enum in org.dreambot.api.methods.tabs\") LOGOUT\n\n      * #### OPTIONS\n            \n                        public static final [Tab](Tab.html \"enum in org.dreambot.api.methods.tabs\") OPTIONS\n\n      * #### EMOTES\n            \n                        public static final [Tab](Tab.html \"enum in org.dreambot.api.methods.tabs\") EMOTES\n\n      * #### MUSIC\n            \n                        public static final [Tab](Tab.html \"enum in org.dreambot.api.methods.tabs\") MUSIC\n\n      * #### COMBAT\n            \n                        public static final [Tab](Tab.html \"enum in org.dreambot.api.methods.tabs\") COMBAT\n\n      * #### SKILLS\n            \n                        public static final [Tab](Tab.html \"enum in org.dreambot.api.methods.tabs\") SKILLS\n\n      * #### QUEST\n            \n                        public static final [Tab](Tab.html \"enum in org.dreambot.api.methods.tabs\") QUEST\n\n      * #### INVENTORY\n            \n                        public static final [Tab](Tab.html \"enum in org.dreambot.api.methods.tabs\") INVENTORY\n\n      * #### EQUIPMENT\n            \n                        public static final [Tab](Tab.html \"enum in org.dreambot.api.methods.tabs\") EQUIPMENT\n\n      * #### PRAYER\n            \n                        public static final [Tab](Tab.html \"enum in org.dreambot.api.methods.tabs\") PRAYER\n\n      * #### MAGIC\n            \n                        public static final [Tab](Tab.html \"enum in org.dreambot.api.methods.tabs\") MAGIC\n\n    * ### Method Detail\n\n      * #### values\n            \n                        public static [Tab](Tab.html \"enum in org.dreambot.api.methods.tabs\")[] values()\n\nReturns an array containing the constants of this enum type, in the order they\nare declared. This method may be used to iterate over the constants as\nfollows:\n\n            \n                        for (Tab c : Tab.values())\n                System.out.println(c);\n            \n\nReturns:\n\n    an array containing the constants of this enum type, in the order they are declared\n      * #### valueOf\n            \n                        public static [Tab](Tab.html \"enum in org.dreambot.api.methods.tabs\") valueOf\u200b(java.lang.String name)\n\nReturns the enum constant of this type with the specified name. The string\nmust match _exactly_ an identifier used to declare an enum constant in this\ntype. (Extraneous whitespace characters are not permitted.)\n\nParameters:\n\n    `name` \\- the name of the enum constant to be returned.\nReturns:\n\n    the enum constant with the specified name\nThrows:\n\n    `java.lang.IllegalArgumentException` \\- if this enum type has no constant with the specified name\n    `java.lang.NullPointerException` \\- if the argument is null\n      * #### get\n            \n                        public @Nullable [Tab](Tab.html \"enum in org.dreambot.api.methods.tabs\") get\u200b(int id)\n\nParameters:\n\n    `id` \\- \nReturns:\n\n    the Tab with the given id\n      * #### getWidgetChild\n            \n                        public @Nullable [WidgetChild](../../wrappers/widgets/WidgetChild.html \"class in org.dreambot.api.wrappers.widgets\") getWidgetChild()\n\n      * #### getId\n            \n                        public int getId()\n\nReturns:\n\n    id the id of this Tab\n      * #### getParentId\n            \n                        public int getParentId()\n\nReturns:\n\n    id the parent id of this Tab\n      * #### getIndex\n            \n                        public int getIndex()\n\nReturns:\n\n    index the index of this Tab\n      * #### getKeyEvent\n            \n                        public int getKeyEvent()\n\n      * #### isDisabled\n            \n                        public boolean isDisabled()\n\n      * #### isOpen\n            \n                        public boolean isOpen()\n\n      * #### open\n            \n                        public boolean open()\n\n      * #### toString\n            \n                        public java.lang.String toString()\n\nOverrides:\n\n    `toString` in class `java.lang.Enum<[Tab](Tab.html \"enum in org.dreambot.api.methods.tabs\")>`\n\nSkip navigation links\n\n  * [Overview](../../../../../overview-summary.html)\n  * [Package](package-summary.html)\n  * Class\n  * [Tree](package-tree.html)\n  * [Deprecated](../../../../../deprecated-list.html)\n  * [Index](../../../../../index-all.html)\n  * [Help](../../../../../help-doc.html)\n\n  * [Frames](../../../../../index.html?org/dreambot/api/methods/tabs/Tab.html)\n  * [No Frames](Tab.html)\n\n  * [All Classes](../../../../../allclasses-noframe.html)\n\nJavaScript is disabled on your browser.\n\n  * Summary: \n  * Nested | \n  * Enum Constants | \n  * Field | \n  * Method\n\n  * Detail: \n  * Enum Constants | \n  * Field | \n  * Method"
    }
  ],
  "extraction_fallback_used": true
}