{
  "name": "Prayer",
  "full_name": "org.dreambot.api.methods.prayer.Prayer",
  "full_url": "https://dreambot.org/javadocs/org/dreambot/api/methods/prayer/Prayer.html",
  "type": "enum",
  "package": "org.dreambot.api.methods.prayer",
  "description": "Returns the enum constant of this type with the specified name.",
  "page_structure": {
    "type": "enum",
    "format_version": "old",
    "has_summary_tables": true,
    "has_detail_sections": true,
    "has_nested_classes": false
  },
  "inheritance": [
    "Prayer"
  ],
  "interfaces_implemented": [],
  "nested_classes": [],
  "methods": [
    {
      "name": "WidgetChild",
      "return_type": "",
      "modifiers": [],
      "description": "",
      "deprecated": false
    },
    {
      "name": "Prayer",
      "return_type": "Prayer[]",
      "modifiers": [
        "static"
      ],
      "description": "Returns an array containing the constants of this enum type, in the order they are declared.",
      "deprecated": false
    },
    {
      "name": "values",
      "signature": "public static Prayer[] values()",
      "return_type": "",
      "modifiers": [],
      "description": "Returns an array containing the constants of this enum type, in the order they are declared. This method may be used to iterate over the constants as follows: for (Prayer c : Prayer.values()) System.out.println(c);",
      "parameters": [],
      "return": {
        "type": "",
        "description": ""
      },
      "deprecated": false
    },
    {
      "name": "valueOf",
      "signature": "public static Prayer valueOf\u200b(java.lang.String name)",
      "return_type": "",
      "modifiers": [],
      "description": "Returns the enum constant of this type with the specified name. The string must match exactly an identifier used to declare an enum constant in this type. (Extraneous whitespace characters are not permitted.)",
      "parameters": [],
      "return": {
        "type": "",
        "description": ""
      },
      "deprecated": false
    },
    {
      "name": "of",
      "signature": "public static Prayer of\u200b(java.lang.String name)",
      "return_type": "",
      "modifiers": [],
      "description": "",
      "parameters": [],
      "return": {
        "type": "",
        "description": ""
      },
      "deprecated": false
    },
    {
      "name": "getLevel",
      "signature": "public int getLevel()",
      "return_type": "",
      "modifiers": [],
      "description": "",
      "parameters": [],
      "return": {
        "type": "",
        "description": ""
      },
      "deprecated": false
    },
    {
      "name": "getSetting",
      "signature": "public int getSetting()",
      "return_type": "",
      "modifiers": [],
      "description": "",
      "parameters": [],
      "return": {
        "type": "",
        "description": ""
      },
      "deprecated": false
    },
    {
      "name": "getChildIndex",
      "signature": "public int getChildIndex()",
      "return_type": "",
      "modifiers": [],
      "description": "",
      "parameters": [],
      "return": {
        "type": "",
        "description": ""
      },
      "deprecated": false
    },
    {
      "name": "getWidgetIndex",
      "signature": "public int getWidgetIndex()",
      "return_type": "",
      "modifiers": [],
      "description": "",
      "parameters": [],
      "return": {
        "type": "",
        "description": ""
      },
      "deprecated": false
    },
    {
      "name": "getWidgetChild",
      "signature": "public WidgetChild getWidgetChild()",
      "return_type": "",
      "modifiers": [],
      "description": "",
      "parameters": [],
      "return": {
        "type": "",
        "description": ""
      },
      "deprecated": false
    },
    {
      "name": "toString",
      "signature": "public java.lang.String toString()",
      "return_type": "",
      "modifiers": [],
      "description": "",
      "parameters": [],
      "return": {
        "type": "",
        "description": ""
      },
      "deprecated": false
    },
    {
      "name": "getQuickPrayerChild",
      "signature": "public int getQuickPrayerChild()",
      "return_type": "",
      "modifiers": [],
      "description": "",
      "parameters": [],
      "return": {
        "type": "",
        "description": ""
      },
      "deprecated": false
    }
  ],
  "fields": [],
  "constructors": [],
  "enum_constants": [
    {
      "name": "Enum",
      "description": "Constant Summary\n\nEnum Constants  Enum Constant | Description  \n---|---  \n`AUGURY` |    \n`BURST_OF_STRENGTH` |    \n`CHIVALRY` |    \n`CLARITY_OF_THOUGHT` |    \n`EAGLE_EYE` |    \n`HAWK_EYE` |    \n`IMPROVED_REFLEXES` |    \n`INCREDIBLE_REFLEXES` |    \n`MYSTIC_LORE` |    \n`MYSTIC_MIGHT` |    \n`MYSTIC_WILL` |    \n`PIETY` |    \n`PRESERVE` |    \n`PROTECT_FROM_MAGIC` |    \n`PROTECT_FROM_MELEE` |    \n`PROTECT_FROM_MISSILES` |    \n`PROTECT_ITEM` |    \n`RAPID_HEAL` |    \n`RAPID_RESTORE` |    \n`REDEMPTION` |    \n`RETRIBUTION` |    \n`RIGOUR` |    \n`ROCK_SKIN` |    \n`SHARP_EYE` |    \n`SMITE` |    \n`STEEL_SKIN` |    \n`SUPERHUMAN_STRENGTH` |    \n`THICK_SKIN` |    \n`ULTIMATE_STRENGTH` |    \n    * ### Method Summary\n\nAll Methods [Static Methods](javascript:show\\(1\\);) [Instance Methods](javascript:show\\(2\\);) [Concrete Methods](javascript:show\\(8\\);)  Modifier and Type | Method | Description  \n---|---|---  \n`int` | `getChildIndex()` |    \n`int` | `getLevel()` |    \n`int` | `getQuickPrayerChild()` |    \n`int` | `getSetting()` |    \n`[WidgetChild](../../wrappers/widgets/WidgetChild.html \"class in org.dreambot.api.wrappers.widgets\")` | `getWidgetChild()` |    \n`int` | `getWidgetIndex()` |    \n`static [Prayer](Prayer.html \"enum in org.dreambot.api.methods.prayer\")` | `of\u200b(java.lang.String name)` |    \n`java.lang.String` | `toString()` |    \n`static [Prayer](Prayer.html \"enum in org.dreambot.api.methods.prayer\")` | `valueOf\u200b(java.lang.String name)` |  Returns the enum constant of this type with the specified name.  \n`static [Prayer](Prayer.html \"enum in org.dreambot.api.methods.prayer\")[]` | `values()` |  Returns an array containing the constants of this enum type, in the order they are declared.  \n      * ### Methods inherited from class java.lang.Enum\n\n`compareTo, equals, getDeclaringClass, hashCode, name, ordinal, valueOf`\n\n      * ### Methods inherited from class java.lang.Object\n\n`getClass, notify, notifyAll, wait, wait, wait`\n\n  *     * ### Enum Constant Detail\n\n      * #### THICK_SKIN\n            \n                        public static final [Prayer](Prayer.html \"enum in org.dreambot.api.methods.prayer\") THICK_SKIN\n\n      * #### BURST_OF_STRENGTH\n            \n                        public static final [Prayer](Prayer.html \"enum in org.dreambot.api.methods.prayer\") BURST_OF_STRENGTH\n\n      * #### CLARITY_OF_THOUGHT\n            \n                        public static final [Prayer](Prayer.html \"enum in org.dreambot.api.methods.prayer\") CLARITY_OF_THOUGHT\n\n      * #### SHARP_EYE\n            \n                        public static final [Prayer](Prayer.html \"enum in org.dreambot.api.methods.prayer\") SHARP_EYE\n\n      * #### MYSTIC_WILL\n            \n                        public static final [Prayer](Prayer.html \"enum in org.dreambot.api.methods.prayer\") MYSTIC_WILL\n\n      * #### ROCK_SKIN\n            \n                        public static final [Prayer](Prayer.html \"enum in org.dreambot.api.methods.prayer\") ROCK_SKIN\n\n      * #### SUPERHUMAN_STRENGTH\n            \n                        public static final [Prayer](Prayer.html \"enum in org.dreambot.api.methods.prayer\") SUPERHUMAN_STRENGTH\n\n      * #### IMPROVED_REFLEXES\n            \n                        public static final [Prayer](Prayer.html \"enum in org.dreambot.api.methods.prayer\") IMPROVED_REFLEXES\n\n      * #### RAPID_RESTORE\n            \n                        public static final [Prayer](Prayer.html \"enum in org.dreambot.api.methods.prayer\") RAPID_RESTORE\n\n      * #### RAPID_HEAL\n            \n                        public static final [Prayer](Prayer.html \"enum in org.dreambot.api.methods.prayer\") RAPID_HEAL\n\n      * #### PROTECT_ITEM\n            \n                        public static final [Prayer](Prayer.html \"enum in org.dreambot.api.methods.prayer\") PROTECT_ITEM\n\n      * #### HAWK_EYE\n            \n                        public static final [Prayer](Prayer.html \"enum in org.dreambot.api.methods.prayer\") HAWK_EYE\n\n      * #### MYSTIC_LORE\n            \n                        public static final [Prayer](Prayer.html \"enum in org.dreambot.api.methods.prayer\") MYSTIC_LORE\n\n      * #### STEEL_SKIN\n            \n                        public static final [Prayer](Prayer.html \"enum in org.dreambot.api.methods.prayer\") STEEL_SKIN\n\n      * #### ULTIMATE_STRENGTH\n            \n                        public static final [Prayer](Prayer.html \"enum in org.dreambot.api.methods.prayer\") ULTIMATE_STRENGTH\n\n      * #### INCREDIBLE_REFLEXES\n            \n                        public static final [Prayer](Prayer.html \"enum in org.dreambot.api.methods.prayer\") INCREDIBLE_REFLEXES\n\n      * #### PROTECT_FROM_MAGIC\n            \n                        public static final [Prayer](Prayer.html \"enum in org.dreambot.api.methods.prayer\") PROTECT_FROM_MAGIC\n\n      * #### PROTECT_FROM_MISSILES\n            \n                        public static final [Prayer](Prayer.html \"enum in org.dreambot.api.methods.prayer\") PROTECT_FROM_MISSILES\n\n      * #### PROTECT_FROM_MELEE\n            \n                        public static final [Prayer](Prayer.html \"enum in org.dreambot.api.methods.prayer\") PROTECT_FROM_MELEE\n\n      * #### EAGLE_EYE\n            \n                        public static final [Prayer](Prayer.html \"enum in org.dreambot.api.methods.prayer\") EAGLE_EYE\n\n      * #### MYSTIC_MIGHT\n            \n                        public static final [Prayer](Prayer.html \"enum in org.dreambot.api.methods.prayer\") MYSTIC_MIGHT\n\n      * #### RETRIBUTION\n            \n                        public static final [Prayer](Prayer.html \"enum in org.dreambot.api.methods.prayer\") RETRIBUTION\n\n      * #### REDEMPTION\n            \n                        public static final [Prayer](Prayer.html \"enum in org.dreambot.api.methods.prayer\") REDEMPTION\n\n      * #### SMITE\n            \n                        public static final [Prayer](Prayer.html \"enum in org.dreambot.api.methods.prayer\") SMITE\n\n      * #### PRESERVE\n            \n                        public static final [Prayer](Prayer.html \"enum in org.dreambot.api.methods.prayer\") PRESERVE\n\n      * #### CHIVALRY\n            \n                        public static final [Prayer](Prayer.html \"enum in org.dreambot.api.methods.prayer\") CHIVALRY\n\n      * #### PIETY\n            \n                        public static final [Prayer](Prayer.html \"enum in org.dreambot.api.methods.prayer\") PIETY\n\n      * #### RIGOUR\n            \n                        public static final [Prayer](Prayer.html \"enum in org.dreambot.api.methods.prayer\") RIGOUR\n\n      * #### AUGURY\n            \n                        public static final [Prayer](Prayer.html \"enum in org.dreambot.api.methods.prayer\") AUGURY\n\n    * ### Method Detail\n\n      * #### values\n            \n                        public static [Prayer](Prayer.html \"enum in org.dreambot.api.methods.prayer\")[] values()\n\nReturns an array containing the constants of this enum type, in the order they\nare declared. This method may be used to iterate over the constants as\nfollows:\n\n            \n                        for (Prayer c : Prayer.values())\n                System.out.println(c);\n            \n\nReturns:\n\n    an array containing the constants of this enum type, in the order they are declared\n      * #### valueOf\n            \n                        public static [Prayer](Prayer.html \"enum in org.dreambot.api.methods.prayer\") valueOf\u200b(java.lang.String name)\n\nReturns the enum constant of this type with the specified name. The string\nmust match _exactly_ an identifier used to declare an enum constant in this\ntype. (Extraneous whitespace characters are not permitted.)\n\nParameters:\n\n    `name` \\- the name of the enum constant to be returned.\nReturns:\n\n    the enum constant with the specified name\nThrows:\n\n    `java.lang.IllegalArgumentException` \\- if this enum type has no constant with the specified name\n    `java.lang.NullPointerException` \\- if the argument is null\n      * #### of\n            \n                        public static [Prayer](Prayer.html \"enum in org.dreambot.api.methods.prayer\") of\u200b(java.lang.String name)\n\n      * #### getLevel\n            \n                        public int getLevel()\n\n      * #### getSetting\n            \n                        public int getSetting()\n\n      * #### getChildIndex\n            \n                        public int getChildIndex()\n\n      * #### getWidgetIndex\n            \n                        public int getWidgetIndex()\n\n      * #### getWidgetChild\n            \n                        public [WidgetChild](../../wrappers/widgets/WidgetChild.html \"class in org.dreambot.api.wrappers.widgets\") getWidgetChild()\n\n      * #### toString\n            \n                        public java.lang.String toString()\n\nOverrides:\n\n    `toString` in class `java.lang.Enum<[Prayer](Prayer.html \"enum in org.dreambot.api.methods.prayer\")>`\n      * #### getQuickPrayerChild\n            \n                        public int getQuickPrayerChild()\n\nSkip navigation links\n\n  * [Overview](../../../../../overview-summary.html)\n  * [Package](package-summary.html)\n  * Class\n  * [Tree](package-tree.html)\n  * [Deprecated](../../../../../deprecated-list.html)\n  * [Index](../../../../../index-all.html)\n  * [Help](../../../../../help-doc.html)\n\n  * [Frames](../../../../../index.html?org/dreambot/api/methods/prayer/Prayer.html)\n  * [No Frames](Prayer.html)\n\n  * [All Classes](../../../../../allclasses-noframe.html)\n\nJavaScript is disabled on your browser.\n\n  * Summary: \n  * Nested | \n  * Enum Constants | \n  * Field | \n  * Method\n\n  * Detail: \n  * Enum Constants | \n  * Field | \n  * Method"
    }
  ],
  "extraction_fallback_used": true
}